1;1246000188;MEI NAN DO BRASIL AGROPECUARIA LTDA;8;162899;AVENIDA;PENHA DE FRANCA;730;SALA 1;PENHA DE FRANCA;SP;SAO PAULO;;;;;5
2;1540000190;J.C.DE SOUZA MERCEARIA;8;322101;RUA;TRIO ARQUIDUQUE;18;;JD S BERNARDO;SP;SAO PAULO;;;;;1
3;1757000108;MARIA APARECIDA M OLIVIO;4;322101;RUA;FRANCISCO ANTONIO RENDA;82;;JD STA ADELIA;SP;SAO PAULO;;;;;1
4;2512000197;BAR E LANCHES BURGO'S LTDA;8;322101;RUA;NOVA HAMBURGO;102;;VILA CARIOCA;SP;SAO PAULO;;;;;5
5;2544000192;JOSE FRANCISCO ANTUNES DE SOUZA-BAR;8;322101;RUA;ETTORE ANDREAZZA;222;;JD TIETE;SP;SAO PAULO;;;;;1
6;3808000122;BAR E LANCHES ADALIVIA LTDA;3;322101;RUA;ADALIVIA DE TOLEDO;96;;REAL PARQUE;SP;SAO PAULO;;;;;5
7;4295000174;L.M. AMERICAN BAR E DIVERSOES ELETRONICAS LTDA;2;322101;;AVDA LINS DE VASCONCELOS;2036;;CAMBUCI;SP;SAO PAULO;;;;;1
8;4635000167;MARIA DE LOURDES GARCIA SAO PAULO;8;322101;RUA;CEBIPIRA;6;;JDM CAMPO GUAIANASE;SP;SAO PAULO;;;;;5
9;5786000130;WILSON ROBERTO GOMES CORREA BAR E LANCHES;4;322101;RUA;MUNHOZ DE MELO;SN;LT 08 QD 40;VILA SYLVIA;SP;SAO PAULO;;;;;1
10;5925000125;BAR E LANCHES RECANTO DANADO DE BOM LTDA;8;322101;AVENIDA;CELSO GARCIA;2089;;BELENZINHO;SP;SAO PAULO;;;;;5
11;5943000107;BAR E LANCHONETE FLASH LTDA;4;322101;RUA;MIGUEL ISASA;344;;PINHEIROS;SP;SAO PAULO;;;;;1
12;6070000157;MILTON SHIGUENORI FUJIKAWA;8;155501;RUA;UTUCURA;;QD12 LT30 CID IPAVA;SANTO AMARO;SP;SAO PAULO;;;;;5
13;6348000196;JOSE GOMES DA SILVA MERCEARIA E LANCHONETE;8;322101;AVENIDA;BENEDITO E DOS SANTOS;1145;;VILA MARIA;SP;SAO PAULO;;;;;5
14;6959000134;KURINU S BAR E LANCHES LTDA;2;322101;RUA;LUIS GAMA;721;;CAMBUCI;SP;SAO PAULO;;;;;1
15;7626000120;LANCHES TROPICALIENTE LIMITADA;8;322101;RUA;SIQUEIRA BUENO;1315;;AGUA RASA;SP;SAO PAULO;;;;;5
16;7820000105;FRANCISCO V. DA SILVA BAR;8;322101;RUA;ITAJUIBE;60;;JD NELIA ITAIM PTA;SP;SAO PAULO;;;;;5
17;8090000167;RIO NOVO ADMINISTRACAO EMPREENDIMENTOS E PARTICIPACOES SA.;2;162899;RUA;DUARTE DE AZEVEDO;448;5 ANDAR SALAS 53/54;SANTANA;SP;SAO PAULO;;;;;5
18;8288000140;J F DA SILVA SAO PAULO;2;322101;RUA;JOAO BRESSANE;108;;VL CAMPO GRANDE;SP;SAO PAULO;;;;;1
19;8654000161;CASTILER REPUXACAO E METALURGICA LTDA;4;134200;RUA;TEN.ISAIAS BCO. ARAUJO;103;;SANTO AMARO;SP;SAO PAULO;;;;;1
20;9938000172;ROSANGELA SOARES BAR E LANCHES;8;322101;RUA;PASCHOAL R MAZILLI;506;;VILA INDUSTRIAL;SP;SAO PAULO;;;;;5
21;10338000124;BAR E LANCHES GRUM LTDA;8;322101;PRACA;YEDDO;196;;JARDIM JAPAO;SP;SAO PAULO;;;;;5
22;10354000117;BAR E DRINK'S BETO LTDA;8;322101;AVENIDA;MATEO BEI;145;;CID SAO MATHEUS;SP;SAO PAULO;;;;;5
23;10487000193;ANTONIO AVELINO GITIRANA;8;322101;RUA;DIAS MOREIRA;34;;JARDIM SANTO ANDRE;SP;SAO PAULO;;;;;1
24;11516000131;JULIO CESAR AMARANTE;8;322101;;LARG SAO JOSE DO MARANHAO;17;;TATUAPE;SP;SAO PAULO;;;;;5
25;11926000182;MIRIAN'S HAMBURGUER LTDA;8;322101;AVENIDA;CUPECE;5579;;JARDIM MIRIAM;SP;SAO PAULO;;;;;5
26;12503000187;AGARICUS DO BRASIL COMERCIO IMPORTACAO E EXPORTACAO LTD;8;133402;RUA;GALVAO BUENO;212;4 6 AND CJTO 41B 62;LIBERDADE;SP;SAO PAULO;;;;;5
27;13663000140;PAULO ALVES BAR E BEBIDAS;2;322101;RUA;ALTAMIRA DO PARANA;386;;VILA NOVA JAGUARA;SP;SAO PAULO;;;;;1
28;14333000250;CORRENTEZA AGRO-PASTORIL LIMITADA;8;161099;AVENIDA;BRIGADERRO FARIA LIMA;1882;6 AND CJ 607;JD PAULISTANO;SP;SAO PAULO;;;;;5
29;16958000170;MAROMAS ASSESSORIA AGROPECUARIA SC LTDA;8;162899;RUA;ALEMEDA SANTOS;2534;APTO 73;CERQUEIRA CESAR;SP;SAO PAULO;;;;;1
30;16990000156;BAR E MERCEARIA VILAS BOAS LTDA;8;322101;RUA;RIO VERDE;1985;260A;VILA BONILHA;SP;SAO PAULO;;;;;5
31;17156000185;MANOEL CARLOS FERREIRA BAR;8;322101;RUA;LAVINIA RIBEIRO;53;A;VILA DIVA;SP;SAO PAULO;;;;;5
32;17211000137;DANIEL PATRICIO SANCHEZ LABADIA;8;122900;AVENIDA;NOSSA SENHORA DO SABARA;3137;;VILA ARRIETE;SP;SAO PAULO;;;;;5
33;17358000127;MARICULTURA DO MARANHAO LTDA;2;322101;AVENIDA;DO ESTADO;4667;2 ANDAR;MOOCA;SP;SAO PAULO;;;;;1
34;17599000176;NISBEL BISPO DA SILVA;8;322101;RUA;BAIA GRANDE;430;;VILA ALPINA;SP;SAO PAULO;;;;;5
35;18207000193;PAULO CELSO MANCUZO;8;322101;RUA;CARAIPE DAS AGUAS;154;;ITAIM PAULISTA;SP;SAO PAULO;;;;;5
36;19236000170;EMS EMPREENDIMENTOS COMERCIO E PARTICIPACOES LTDA;2;122900;AVENIDA;CHIBARAS;74;ANDAR /PARTE;MOEMA;SP;SAO PAULO;11 32591911;;;THIAGO@FISCONEPROSPER.COM.BR;1
37;19351000144;REALCE HOSPEDARIA LTDA;8;311601;RUA;VOLUNTARIOS DA PATRIA;645;;SANTANA;SP;SAO PAULO;;;;;5
38;19658000145;FQ INDUSTRIA E COMERCIO LTDA;8;153902;RUA;MARIA AFONSO;225;;CHACARA MAFALDA;SP;SAO PAULO;;;;;1
39;20641000108;BAR JARDIM TOBIAS LTDA;4;322101;RUA;JOAO DE LOAJA;104;;JARDIM TOBIAS;SP;SAO PAULO;;;;;1
40;21122000164;ESAR COMERCIO E REPRESENTACOES LTDA;2;311601;RUA;ALACRAN;67;;VILA IVA;SP;SAO PAULO;;;;;1
41;21513000189;ADRIATICO AGRO PASTORIL E COMERCIO LTDA;8;162899;RUA;TOME PORTES;289;;PARADA INGLESA;SP;SAO PAULO;11 33130499;;;;5
42;21514000123;RQT AGRO PASTORIL E COMERCIO LTDA;8;162899;ALAMEDA;BARAO DE LIMEIRA;985;1 ANDAR;CAMPOS ELISEOS;SP;SAO PAULO;;;;;5
43;22617000108;MDSERV AGROPECUARIA LTDA;4;159899;ALAMEDA;CAMPINAS;1630;;JD PAULISTA;SP;SAO PAULO;;;;;1
44;22617000299;MDSERV AGROPECUARIA LTDA;4;322105;RUA;ESTADOS UNIDOS;325;;JARDIM PAULISTA;SP;SAO PAULO;;;;;1
45;23386000157;LUIZ CARLOS RODRIGUES BAR E LANCHES;4;322101;RUA;MINERIOS ATOMICOS;302;;VILA ANTONIETA;SP;SAO PAULO;;;;;1
46;23704000180;BROOKS AGROPECUARIA LTDA;2;151201;AVENIDA;ROQUE PETRONI JUNIOR;999;ANDAR 1 SALA 13 E 14B;VILA DAS GERTRUDES;SP;SAO PAULO;11 38166658;;;lccontabil@netpoint.com.br;5
47;24140000108;AGUAS VIRTUOSAS PAES E DOCES LTDA;8;322101;RUA;AGUAS VIRTUOSAS;864;;CASA VERDE;SP;SAO PAULO;;;;;5
48;24571000166;BAR E LANCHES REI DE OURO LTDA;8;322101;RUA;DA CAVALGADA;91;;PROM FERNAO DIAS;SP;SAO PAULO;;;;;5
49;25008000102;BAR JUITA LTDA;8;322101;RUA;VISCONDE DE MAGE;86;;SACOMAN;SP;SAO PAULO;;;;;5
50;25579000147;PAULO RAMOS DA SILVA BAR;8;322101;RUA;MARIA CASUSA FEITOSA;23;;JORDANOPOLIS;SP;SAO PAULO;;;;;1
51;26061000128;DURVALY APARECIDA BASSO;8;322101;RUA;PELOTAS;83;BOX KI KREPPE;VILA MARIANA;SP;SAO PAULO;;;;;1
52;26250000109;ANGELES OF NIGHT BAR LTDA MICROEMPRESA;8;322101;AVENIDA;SAPOPEMBA;2656;;SANTA CLARA;SP;SAO PAULO;;;;;5
53;26394000157;BAR E MERCEARIA VOCE ESCOLHE LTDA;8;322101;RUA;DA GLORIA;947;;LIBERDADE;SP;SAO PAULO;;;;;5
54;26890000100;L A CEARA BAR E MERCEARIA LTDA;8;322101;AVENIDA;ENG ARMANDO ARRUDA PERE;5470;;JABAQUARA;SP;SAO PAULO;;;;;5
55;29218000250;ARTPAR AGRO COMERCIAL LTDA;8;134200;RUA;HUMBERTO I;220;5 AND CJ 51A S 3;VILA MARIANA;SP;SAO PAULO;;;;;5
56;29273000169;GENIVALDO SANTANA SILVA DRINKS;8;322101;RUA;AUGUSTA;791;TERREO;BELA VISTA;SP;SAO PAULO;;;;;5
57;30145000135;WILSON MONTEIRO BAR E LANCHES;8;322101;RUA;ARNALDO MAGNICCARO;687;;CAMPO GRANDE;SP;SAO PAULO;;;;;1
58;61927000131;PEDRO J CALAZANS MENDES REPRESENTACAO COMERCIAL S/C LT;4;161099;RUA;CEL LOPES BRANCO;37;;JD BRASIL;SP;SAO PAULO;;;;;1
59;88924000191;SALVAMOTO SERV. DE APOIO AO MOTOCICLISTA S/C LTDA;8;111301;RUA;ABAITINGA;306;;SAO MIGUEL PAULISTA;SP;SAO PAULO;;;;;5
60;1,09196E+11;BAR E LANCHES JUSEVI LTDA;8;322101;AVENIDA;CUPECE;5237;;CIDADE ADEMAR;SP;SAO PAULO;;;;;5
61;1,09449E+11;CARIS ADMINISTRACAO DE BENS LTDA;4;161099;RUA;BELA CINTRA;2080;3 AND.;CONSOLACAO;SP;SAO PAULO;;;;;1
62;1,11572E+11;FERTHAGA'S BAR E EMPORIO LTDA;8;322101;RUA;MANUEL DA COSTA;329;;PRQ SAO LUCAS;SP;SAO PAULO;;;;;5
63;1,1223E+11;BAR E MERCEARIA A S REIS LTDA;8;322101;RUA;DR JOAO ALVES DE LIMA;196;;BRAS;SP;SAO PAULO;;;;;1
64;1,14475E+11;AGROROSIS PASTORIL E COMERCIAL LTDA;4;151201;RUA;PIASSANGUABA;1869;;INDIANOPOLIS;SP;SAO PAULO;;;;;1
65;1,24526E+11;VICTORIA'S CLUB BAR E CAFE LTDA;8;322101;AVENIDA;JOAO PEDRO CARDOSO;537;;PQUE JABAQUARA;SP;SAO PAULO;;;;;1
66;1,2611E+11;AGROPECUARIA FLOR DA SERRA LTDA;8;151201;RUA;GALVAO BUENO;700;15. ANDAR SALA 1504;LIBERDADE;SP;SAO PAULO;;;;;5
67;1,28551E+11;AQUARINI COMERCIO DE FEIXES LTDA;8;322101;RUA;VITORINO CARMILO;339;;CAMPOS ELISEOS;SP;SAO PAULO;;;;;5
68;1,3043E+11;RESTAURANTE TRIO SABOROSO LTDA;8;322101;RUA;GUAICURUS;1192;;LAPA;SP;SAO PAULO;;;;;5
69;1,30494E+11;BAR LANCHES E MERCEARIA RECANTO DO ESCOLHIDO LTDA;4;322101;RUA;ROCHA;252;;BELA VISTA;SP;SAO PAULO;;;;;1
70;1,34375E+11;AGROPECUARIA PALESTINA LTDA;8;111301;RUA;LIBERO BADARO;377;28 ANDAR;CENTRO;SP;SAO PAULO;;;;;5
71;1,38375E+11;NOVO SOL DE VERAO BAR E LANCHES LTDA;8;322101;RUA;DOS RADIALISTAS;51;A;PRQ SAO DOMINGOS;SP;SAO PAULO;;;;;5
72;1,39836E+11;SANDRA MARIA VASCONCELOS PEREIRA;8;322101;RUA;TITO FRANCO DE ALMEIDA;194;;PARQUE BOTURUSSU;SP;SAO PAULO;;;;;5
73;1,39897E+11;COMEZAINA BAR LTDA;8;322101;RUA;DR ASSIS RIBEIRO;8428;;JD MATARAZZO;SP;SAO PAULO;;;;;5
74;1,39905E+11;IND E COM. DE MODELO P/FUNDICAO MARTSFERRA LTDA;8;122900;AVENIDA;TERESA CRISTINA;160;;IPIRANGA;SP;SAO PAULO;;;;;1
75;1,4389E+11;AGUINALDO AMANCIO DE SOUSA BAR;8;322101;RUA;DOUTOR ASSIS RIBEIRO;27;A;JARDIM MATARAZZO;SP;SAO PAULO;;;;;5
76;1,44052E+11;MANOEL XAVIER DE ALMEIDA IRMAO BAR E LANCHONETE;4;322101;AVENIDA;CARLOS LACERDA;289;;V PIRAJUSSARA;SP;SAO PAULO;;;;;1
77;1,44104E+11;DRINKAO BAR E LANCHES LTDA;2;322101;RUA;BOM PASTOR;128;;IPIRANGA;SP;SAO PAULO;;;;;1
78;1,44256E+11;FILHO E LUZ BAR E MERCEARIA LTDA;8;322101;RUA;MARQUES DE ABRANTES;21;;TATUAPE;SP;SAO PAULO;;;;;5
79;1,44298E+11;JUVENAL SALVINO LEITE;4;322101;RUA;MITUTO MIZUMOTO;589;;LIBERDADE;SP;SAO PAULO;;;;;1
80;1,44392E+11;MARIA GUIA MAXIMIANO;8;322101;RUA;15;27;;ITAIM PAULISTA;SP;SAO PAULO;;;;;5
81;1,44419E+11;ADEILDO DOS SANTOS BAR LANCHES;8;322101;RUA;GAL PROFIRIO DA PAZ;686;;VILA BANCARIA;SP;SAO PAULO;;;;;1
82;1,44707E+11;JOSE FRANCISCO MARTINS BAR E CAFE;8;322101;RUA;AURI VERDE;1551;;IPIRANGA;SP;SAO PAULO;;;;;5
83;1,46446E+11;ESPETOS & FESTAS ESPETINHOS PARA VIAGENS LTDA;4;322101;RUA;ATILIO PIFFER;35;;CASA VERDE;SP;SAO PAULO;;;;;1
84;1,48668E+11;TRI-AGRO PECUARIA E AGRICOLA S/A;2;162899;AVENIDA;ROUXINOL;174;CONJ 42;MOEMA;SP;SAO PAULO;11 35674705;;;contabilfarias@terra.com.br;5
85;1,48668E+11;TRI-AGRO PECUARIA E AGRICOLA S/A;2;162899;RUA;DIOGO MOREIRA;286;;JARDIM PAULISTANO;SP;SAO PAULO;;;;;5
86;1,48668E+11;TRI-AGRO PECUARIA E AGRICOLA S/A;2;162899;AVENIDA;BRIG FARIA LIMA;2003;CONJUNTO 2207;JARDIM PAULISTANO;SP;SAO PAULO;;;;;5
87;1,50905E+11;JOSE ROBERTO DE MELO FILHO LANCHONETE;8;322101;RUA;LUCIANO MURATORE;12;;V MISSIONARIA;SP;SAO PAULO;;;;;5
88;1,50942E+11;EMIDIO JORGE DO NASCIMENTO BAR E LANCHONETE;8;322101;AVENIDA;NORDESTINA;4877;;VILA CURUCA;SP;SAO PAULO;;;;;5
89;1,51817E+11;C.R.DISTRIBUIDORA DE ALIMENTOS LTDA;2;155501;RUA;CABO JOSE TEIXEIRA;212;;GUAIANAZES;SP;SAO PAULO;011 2075828;;011 2071000;;1
90;1,52748E+11;BAR E LANCHES MOGNOS LTDA;8;322101;AVENIDA;PROFESSOR PAPINI;388;;CID DUTRA;SP;SAO PAULO;;;;;1
91;1,53705E+11;KORIN AGROPECUARIA LTDA;8;122900;RUA;FRANCA PINTO;498;;VL MARIANA;SP;SAO PAULO;;;;;5
92;1,55434E+11;GUAICARAS AGRO FLORESTA LTDA;8;210106;RUA;PROF JOSE H M TEIXEIRA;538;CJ 152;VILA SONIA;SP;SAO PAULO;;;;;5
93;1,56474E+11;EMERSON F. L. VIDOTTO HOSPEDAGEM;8;311601;ALAMEDA;FRANCA;175;TERREO;CERQUEIRA CEZAR;SP;SAO PAULO;;;;;5
94;1,56651E+11;BAR E LANCHONETE RECANTO DA GAUCHA LTDA;4;322101;RUA;IBITURUNA;35;TERREOLOJA;PARQUE IMPERIAL;SP;SAO PAULO;11 55894930;11 55897665;11 55897665;contato@solidacontabil.com;1
95;1,57085E+11;PRO SERV COMERCIO DE REFEICOES LTDA;8;322101;RUA;JOAO AMOS COMENIUS;1288;;JD S BERNARDO;SP;SAO PAULO;;;;;1
96;1,57833E+11;LANCHONETE OCTASEVE LTDA;8;322101;RUA;LUDGERO JOAQUI DA SILVA;13;;IMRIM;SP;SAO PAULO;;;;;5
97;1,58619E+11;BAR E LANCHES AMARGOSA LTDA;8;322101;RUA;GOMES CARDIM;323;;BRAS;SP;SAO PAULO;;;;;1
98;1,58894E+11;MARIA ZIZI LEITE BOVOLON;8;322101;RUA;BENTO QUIRINO;571;;VILA TALARICO;SP;SAO PAULO;;;;;5
99;1,59456E+11;CECILIA GONCALVES DE OLIVEIRA MACKEY MARTINS;8;322101;RUA;PE PASCOAL ROCHIDROX;160;;LAUZANE PAULISTA;SP;SAO PAULO;;;;;5
100;1,59716E+11;NIGHT BOY'S BAR LTDA;8;322101;ALAMEDA;NOTHMANN;1220;;SANTA CECILIA;SP;SAO PAULO;;;;;5
101;1,60869E+11;TIMBALADA LANCHES LTDA;8;322101;RUA;NOVA LOUSA;118;;IPIRANGA;SP;SAO PAULO;;;;;5
102;1,60979E+11;MARIA APARECIDA DE OLIVEIRA BAR E MERCEARIA;4;322101;RUA;DEZOITO;17;;JD CAMARGO NOVO;SP;SAO PAULO;;;;;1
103;1,61351E+11;PECTRON ELETRO COMPONENTES LTDA;8;134200;RUA;AMAZONAS DA SILVA;263;;VILA GUILHERME;SP;SAO PAULO;;;;;1
104;1,62348E+11;JOSE EDUARDO DA SILVA MELLO;8;161099;RUA;GALEAZZO ALESSI;96;;VL MONTE ALEGRE;SP;SAO PAULO;;;;;1
105;1,63057E+11;BAR E LANCHES DORA FLORA LTDA;8;322101;RUA;CORIOLANO;936;;VL ROMANA;SP;SAO PAULO;;;;;5
106;1,63647E+11;CLAUDINEI BERNE;8;322101;RUA;NOVA DOS PORTUGUESES;463;;IMIRIM;SP;SAO PAULO;;;;;5
107;1,63833E+11;BAR E LANCHES JOMIRO LTDA;8;322101;ALAMEDA;BARAO DE PIRACICABA;185;;CAMPOS ELISEOS;SP;SAO PAULO;;;;;5
108;1,67069E+11;BAR E LANCHES MARADONA LTDA;8;322101;RUA;3 SG JOAO LOPES FILHO;423;;PQ NOVO MUNDO;SP;SAO PAULO;;;;;5
109;1,69746E+11;BAR E LANCHES TETRA LTDA;8;322101;RUA;AMARAL GURGEL;170;;VL BUARQUE;SP;SAO PAULO;;;;;5
110;1,6989E+11;OTACILIO FERREIRA SILVA;4;322101;RUA;URUBIATA;26;;JD ARNALDO;SP;SAO PAULO;;;;;1
111;1,78342E+11;LUZIA GOMES DA FONSECA BAR E LANCHES;8;322101;AVENIDA;DNA MARIANA C RONCHETTI;458;;CACHOEIRINHA;SP;SAO PAULO;;;;;5
112;1,78578E+11;ADEVAIR MARCO ANDRE AVICOLA;8;322101;ESTRADA;DO M'BOI MIRIM;1870;1873;PQUE FIGUEIRA GDE;SP;SAO PAULO;;;;;5
113;1,88418E+11;ELIS REGINA PINA MARTINIANO;8;322101;RUA;DEZ;8;;MATO VIRGEM;SP;SAO PAULO;;;;;1
114;1,98029E+11;TESORE REPRESENTACAO COMERCIAL LTDA;8;161099;RUA;DOS OPERARIOS;524;;VL BRASILINA;SP;SAO PAULO;;;;;5
115;1,98872E+11;AGROPECUARIA SIBIPIRUNA LTDA;8;161099;RUA;TREZE DE MAIO;431;SALA 02;BELA VISTA;SP;SAO PAULO;11 95388378;11 66011009;11 36620085;stevescholici@uol.com.br;5
116;2,06517E+11;MARIA JOSE LOPES COSTA BAR;8;322101;RUA;MARQUES DE ITU;284;;VILA BUARQUE;SP;SAO PAULO;;;;;5
117;2,06745E+11;FRANCARLOS BAR E LANCHES LTDA;4;322101;RUA;PE SABOIA DE MEDEIROS;983;;VL MEDEIROS;SP;SAO PAULO;;;;;1
118;2,08881E+11;AGROPECUARIA RIO GUAPORE LTDA;2;151201;RUA;PEDROSO ALVARENGA;1245;6 ANDAR;ITAIM;SP;SAO PAULO;;;;;1
119;2,10996E+11;EDNA LEONEL FERREIRA BAR E LANCHES;4;322101;RUA;FRANCISCA DE PAULA;496;;VL CARRAO;SP;SAO PAULO;;;;;5
120;2,11187E+11;BAR E LANCHES DEDEQUIRINO LTDA;2;322101;RUA;HELENA ZERRENER;320;;GLICERIO;SP;SAO PAULO;;;;;1
121;2,13779E+11;ADALBERTO RODRIGUES DE MORAES;8;322101;RUA;DOMINGOS SCARPEL;79;;ERMELINDO MATARAZZO;SP;SAO PAULO;;;;;1
122;2,16074E+11;J FERREIRA LEITE;8;322101;RUA;PEDRO TALARICO;658;;VL TALARICO;SP;SAO PAULO;;;;;5
123;2,16371E+11;BAR E LANCHES ALVES E SILVEIRA LTDA;4;322101;RUA;PALMEIRA LACA;220;;JD ELIANE;SP;SAO PAULO;;;;;1
124;2,1743E+11;RIO PARDO AGRO FLORESTAL S/A;8;210101;AVENIDA;SAO GABRIEL;180;7 AND CONJUNTO 71;JD PAULISTA;SP;SAO PAULO;;;;;5
125;2,20333E+11;ANTONIO CORDEIRO CAVALCANTE;8;322101;RUA;MOISES MARX;1153;;VL ARICANDUVA;SP;SAO PAULO;;;;;5
126;2,21246E+11;GERSIL BAR E LANCHES LTDA;8;322199;RUA;POLIGNANO A MARE;90;;BRAS;SP;SAO PAULO;;;;;1
127;2,22837E+11;EDITH DE OLIVEIRA;8;322101;RUA;JANDAIA;92;A;LIBERDADE;SP;SAO PAULO;;;;;5
128;2,24567E+11;BAR E MERCEARIA PEDRO JABUR LTDA;2;322101;RUA;DR PEDRO JABUR;149;;VILA BONILHA;SP;SAO PAULO;;;;;1
129;2,2465E+11;WAL BRAZ BAR LTDA;8;322101;AVENIDA;MIGUEL ESTEFANO;2255;;VILA DA SAUDE;SP;SAO PAULO;;;;;5
130;2,24697E+11;FLAVIO ANDRADE DIAS;8;322101;AVENIDA;JOSE MUNIZ RIBEIRO;109;;VILA PARANAGUA;SP;SAO PAULO;;;;;5
131;2,24701E+11;FRANCISCA LACERDA DA SILVA;4;322101;RUA;JOSE MARIA VILELA;50;;VILA SILVIA;SP;SAO PAULO;;;;;5
132;2,25246E+11;"CIGANO""S BAR E LANCHONETE LTDA";8;322101;RUA;DA MOOCA;674;;MOOCA;SP;SAO PAULO;;;;;5
133;2,25897E+11;TREILER BAR LTDA;2;322101;AVENIDA;PARADA PINTO;1605;;JD CONTINENTAL;SP;SAO PAULO;;;;;1
134;2,26106E+11;BAR E LANCHES CHICARELI LTDA;8;322101;RUA;LUPINOPOLIS;128;;JARDIM MARINGA;SP;SAO PAULO;;;;;5
135;2,28115E+11;BAR E MERCEARIA VPS LTDA;8;322101;RUA;LUAR DO SERTAO;56;A;VALO VELHO;SP;SAO PAULO;;;;;5
136;2,28362E+11;FRANCISCA L B DE CARVALHO BAR;8;322101;RUA;JOSE DE GOIS E MORAES;21;;PQ SAO RAFAEL;SP;SAO PAULO;;;;;5
137;2,28424E+11;BAR E LANCHES CASAL FELIZ LTDA;8;322101;RUA;JOAQUIM MARRA;1183;;VL MATILDE;SP;SAO PAULO;;;;;5
138;2,28439E+11;LAIS FILIZOLA;8;322101;RUA;PURPURINA;272;;VL MADALENA;SP;SAO PAULO;;;;;5
139;2,28575E+11;SEBASTIAO PAULO DA SILVA BAR;8;322101;RUA;ITAPORA;317;A;PQ PAULISTANO;SP;SAO PAULO;;;;;5
140;2,29395E+11;MARIA REGINA SGARBIOLA;8;322101;RUA;TIBAU DO SUL;28;;CID CONTINENTAL;SP;SAO PAULO;;;;;5
141;2,30807E+11;JOSE ANTONIO C ALVES BAR E MERCEARIA;8;322101;RUA;CACHOEIRA SETE QUEDAS;28;;GUAIANAZES;SP;SAO PAULO;;;;;1
142;2,33533E+11;BAR E LANCHES FGJ LTDA;4;322101;AVENIDA;GEN ATALIBA LEONEL;1781;;SANTANA;SP;SAO PAULO;;;;;5
143;2,37022E+11;SOCORTE COMERCIO, EXPORTACAO E IMPORTACAO LTDA;8;153902;RUA;SENADOR FEIJO;30;CONJ 503;CENTRO;SP;SAO PAULO;11 61614343;;;ocpr@terra.com.br;1
144;2,39986E+11;HAE JOON CHO;8;322101;AVENIDA;IMPERATRIZ LEOPOLDINA;1187;;VL LEOPOLDINA;SP;SAO PAULO;;;;;5
145;2,40314E+11;TERRA GRANDIS REFLOR IND COM DE ESSENCIAS FLOR LTDA;8;230600;AVENIDA;JURUCE;194/6;4 AND SL 30;INDIANOPOLIS;SP;SAO PAULO;;;;;5
146;2,43282E+11;KELLY CRISTINE CALDEIRA;8;322101;RUA;PROF PEDREIRA FREITAS;1278;;VL GOMES CARDIM;SP;SAO PAULO;;;;;5
147;2,43569E+11;OSMAR COLTURATO;2;322101;RUA;DOM GIOCONDO GROTTI;61;;PQ SAO RAFAEL;SP;SAO PAULO;;;;;1
148;2,44777E+11;ILUMI-BABY INDUSTRIA E COMERCIO DE ILUMINACAO LTDA;8;134200;RUA;EBAUBA;18;;VILA RE;SP;SAO PAULO;;;;;5
149;2,44949E+11;BAR E SORVETERIA ANTONIETA LTDA;4;322101;RUA;QUINTA DA CONRARIA;2;;PQUE STO ANTONIO;SP;SAO PAULO;;;;;1
150;2,45264E+11;GRASSO STUDIO S/C LTDA;8;210101;RUA;OSCAR FREIRE;1814;;JD.AMERICA;SP;SAO PAULO;;;;;1
151;2,4549E+11;R.H.C. LANCHONETE LTDA;8;322101;RUA;SANTO ELIAS;41;;TATUAPE;SP;SAO PAULO;;;;;5
152;2,46151E+11;AGROPECUARIA RIOS JUMA E GUARIBA LTDA;2;162899;RUA;GRAVATAI;23;"SALA: 158;";CONSOLACAO;SP;SAO PAULO;11 47267277;;;EZEQUIEL@ALTERNATIVAEEVOLUCAO.COM.BR;5
153;2,46154E+11;MERCEARIA MEIRA & SOUZA LTDA;4;322101;PRACA;MARECHAL DEODORO;56;;SANTA CECILIA;SP;SAO PAULO;;;;;1
154;2,46753E+11;JOSE AROLDO DIAS DE MEDEIROS;2;322101;RUA;MARQUES DESANTO AMARO;931;;VILA ALPINA;SP;SAO PAULO;11 97073296;11 20174470;11 20174470;sousa-celso@com.br;1
155;2,48253E+11;BAR E LANCHES CASA DO NORTE EUCLIDES DA CUNHA LTDA;8;322101;RUA;SILVA BUENO;2533;LOJA 4;IPIRANGA;SP;SAO PAULO;;;;;5
156;2,53178E+11;BRILHO DO SOL REFEICOES LTDA;8;322101;AVENIDA;IMIRIM;1340;;IMIRIM;SP;SAO PAULO;;;;;5
157;2,54027E+11;LANCHES VADAO LTDA;8;322101;RUA;SAPUCAIA;441;;BELENZINHO;SP;SAO PAULO;;;;;1
158;2,5415E+11;RASTELLI BAR E MERCEARIA LTDA;4;322101;RUA;MINISTRO LUIS SPARANO;228;;JD SANTA ADELIA;SP;SAO PAULO;;;;;1
159;2,55726E+11;BAIZA AGROPECUARIA LTDA;8;111301;RUA;HELENA;218;12 ANDAR CONJ 1202;VL OLIMPIA;SP;SAO PAULO;;;;;5
160;2,56231E+11;NARITA'S BAR LTDA;8;322101;RUA;MARIA DAFRE;817;TERREO;V PRUDENTE;SP;SAO PAULO;;;;;5
161;2,56445E+11;MARIA ADAUTA DA FONSECA;8;322101;RUA;DOMINGOS DE SANTA MARIA;239;;VILA GUARANI;SP;SAO PAULO;;;;;5
162;2,58332E+11;BAR E RESTAURANTE DOMARI LTDA;8;322101;RUA;PRES COSTA PINTO;194;A;MOOCA;SP;SAO PAULO;;;;;5
163;2,588E+11;MASSAS GINUS LTDA;8;322101;RUA;GALILEIA;502;;CASA VERDE;SP;SAO PAULO;;;;;1
164;2,59126E+11;BICLING'S LANCHONETE E PIZZARIA LTDA;8;322101;RUA;COSTA BARROS;359;;VL APINA;SP;SAO PAULO;;;;;5
165;2,59134E+11;ANTONIO BORGES DOS SANTOS BAR E EMPORIO;8;322101;RUA;MARIA DE SAO JOSE CUNHA;251;;VILA BELA VISTA;SP;SAO PAULO;;;;;1
166;2,59401E+11;BAR E LANCHONETE VERDAO LTDA;8;322101;RUA;TURIACU;1799;;AGUA BRANCA;SP;SAO PAULO;;;;;1
167;2,59425E+11;BONNI & ALA BAR E LANCHES LTDA;2;322101;AVENIDA;WASHINGTON LUIZ;4645;;VL CONGONHAS;SP;SAO PAULO;;;;;1
168;2,60319E+11;JOZINILDO GOMES DA SILVA;8;322101;RUA;DOM CARLOS GOUVEIA;19;;VL CONTINENTAL;SP;SAO PAULO;;;;;5
169;2,61512E+11;ABILIO DE PAULA NASCIMENTO BAR E LANCHES;8;322101;RUA;ALFREDO MAIA;349;;KPONTE PEQUENA;SP;SAO PAULO;;;;;5
170;2,62237E+11;FLOR DE LIS EMPREENDIMENTOS E PARTICIPACOES S/A;8;162899;RUA;CARLOS PETIT;356;CASA;VILA MARIANA;SP;SAO PAULO;011 5710656;;011 5754616;;5
171;2,63083E+11;V V DE SOUSA BAR E MERCEARIA;8;322101;RUA;CESARIO ALVIM;289;;BELENZINHO;SP;SAO PAULO;;;;;5
172;2,64286E+11;AGROPECUARIA ITACURU LTDA;8;162899;RUA;CASTILHO CABRAL;35;5º ANDAR;VILA PROGREDIOR;SP;SAO PAULO;1131385100;;;;5
173;2,64587E+11;CONFECCOES FIAMA LTDA;8;111301;RUA;NELSON BRISSAC;29;;PQ REGINA;SP;SAO PAULO;;;;;5
174;2,64684E+11;AIRTON MAXIMO AVICULTURA;4;155501;ESTRADA;DE CAMPINAS;LT16;QD P;JARAGUA;SP;SAO PAULO;;;;;1
175;2,65296E+11;PEDRO CHIGUENOBU GAKIYA BAR;8;322101;RUA;GUARIZINHO;144;;CASA VERDE;SP;SAO PAULO;;;;;5
176;2,68407E+11;RICARDO NOCAIS CHURRASQUINHO;8;322101;RUA;D SEBASTIAO DO REGO;68;CASA 01 E 02;VILA GUMERCINDO;SP;SAO PAULO;;;;;1
177;2,6845E+11;JOSE ALBERI DA SILVA;8;322101;RUA;VIDEIRA;43;;CIDADE PATRIARCA;SP;SAO PAULO;;;;;5
178;2,70409E+11;CICERO JOSE DA SILVA REFRIGERACAO;8;122900;RUA;ALDEIA DA FORMIGA;35;;ITAQUERA;SP;SAO PAULO;;;;;5
179;2,70453E+11;JOSE DE MOURA CAVALCANTI;8;322101;RUA;FIGUEIRA DA POLINESIA;621;;JD MATARAZZO;SP;SAO PAULO;;;;;5
180;2,7333E+11;MERCEARIA ARARIMA LTDA;8;322101;RUA;ARARIMA;39;;CHORA MENINO;SP;SAO PAULO;;;;;5
181;2,75124E+11;SERCA EMPREENDIMENTOS E PARTICIPACOES LTDA;2;111301;AVENIDA;IPIRANGA;795;5 AND. CJTOS 501/5;CENTRO;SP;SAO PAULO;;;;;1
182;2,75462E+11;BAR SALIM BENEVIDES LTDA;8;322101;RUA;TEREZINHA;136;;VILA MATIAS;SP;SAO PAULO;;;;;5
183;2,75469E+11;BAR E LANCHES AZUL DO MAR LTDA;8;322101;RUA;BUENO DE ANDRADE;34;LOJA 63;ACLIMACAO;SP;SAO PAULO;;;;;5
184;2,78153E+11;MADONAS BAR E LANCHES LTDA;4;322101;AVENIDA;SAO JOAO;439;SUB-SOLO LOJA 61;CENTRO;SP;SAO PAULO;;;;;1
185;2,78518E+11;SANTILHA STINGUEL DA SILVA-BAR E LANCHES;8;322101;RUA;RIBEIRAO DAS ALMAS;387;;VL PALMEIRAS;SP;SAO PAULO;;;;;5
186;2,8104E+11;CAMANDUIRA COMERCIO DE PLANTAS LTDA;4;230600;RUA;CASTRO DELGADO;107;;ALTO DE PINHEIROS;SP;SAO PAULO;;;;;1
187;2,81077E+11;BIG MONACO BAR E LANCHES LTDA;8;322101;RUA;DOS PINHEIROS;1384;;PINHEIROS;SP;SAO PAULO;;;;;5
188;2,81203E+11;BAR E CAFE CARNOT LTDA;8;322101;RUA;CARNOT;39;;PARI;SP;SAO PAULO;;;;;5
189;2,84283E+11;BAR E LANCHES A R LTDA;8;322101;AVENIDA;GAL PENHA BRASIL;3595;;JD RECANTO;SP;SAO PAULO;;;;;1
190;2,88653E+11;FAVORAVEL BAR E LANCHONETE LTDA;8;322101;PRACA;EUROTIDES DE CAMPOS;975;;JD BRASIL;SP;SAO PAULO;;;;;5
191;2,88676E+11;IVANILDO ANTONIO DE BARROS;8;322101;AVENIDA;ANGELO DI VERNIERI;114;;JD MONT KEMEL;SP;SAO PAULO;;;;;1
192;2,92278E+11;JOSE JUSTINO DA SILVA BAR;8;322101;RUA;ITAJUIBE;1484;;ITAIM PAULISTA;SP;SAO PAULO;;;;;5
193;2,92834E+11;BAR BOM NOME LTDA;4;322101;RUA;JOAO DE ARAUJO;662;;SANTO AMARO;SP;SAO PAULO;;;;;5
194;2,97863E+11;ELZIR DE CALDAS-BAR;8;322101;AVENIDA;JACANA;194;;JACANA;SP;SAO PAULO;;;;;1
195;3,08815E+11;BAR CLARIZE LTDA;8;322101;RUA;DR ALMEIDA NOBRE;62;;CASA VERDE ALTA;SP;SAO PAULO;;;;;5
196;3,11132E+11;BAR E LANCHES CHICOBOM LTDA;4;322101;RUA;MASSIMO AZEGLIO;3;A;JD VAZ DE LIMA;SP;SAO PAULO;;;;;1
197;3,13779E+11;INTERBANC AGROPECUARIA LTDA;2;152102;ALAMEDA;LORENA;638;ANDAR 7;JARDIM PAULISTA;SP;SAO PAULO;11 50580550;;11 55716104;DPLEGAL@OLIVEIRASCONTABIL.COM.BR;1
198;3,13944E+11;HELENA LUZIA BARNABE;8;322101;RUA;ANA CLARA;373;;VL INDUSTRIAL;SP;SAO PAULO;;;;;5
199;3,15354E+11;BAR E LANCHES 2 IRMAOS CARLILTON LTDA;8;322101;RUA;SOLD CRISTOVAO M GARCIA;460;;PQ NOVO MUNDO;SP;SAO PAULO;;;;;1
200;3,1893E+11;ARISTON CAFE E REFEICOES LTDA;8;322101;RUA;SANSAO ALVES DOS SANTOS;444;;BROOKLIN;SP;SAO PAULO;;;;;1
201;3,19456E+11;TAMBORES DE FOGO REGGAE BAR LTDA;8;322101;RUA;WISARD;557;;VL MADALENA;SP;SAO PAULO;;;;;5
202;3,20006E+11;BAR E LANCHES KEROSCO LTDA;3;322101;RUA;JOAO BOEMER;464;;PARI;SP;SAO PAULO;;;;;1
203;3,20286E+11;A R DE CARVALHO BAR;8;322101;RUA;AUGUSTA;888;TERREO;CONSOLACAO;SP;SAO PAULO;;;;;5
204;3,20526E+11;SOLUMAC MANUTENCAO DE EQUIPAMENTOS S/C LTDA;8;133402;RUA;CEL CARLOS AMBROGI;126;;PIRITUBA;SP;SAO PAULO;;;;;5
205;3,2109E+11;SANDRA APARECIDA ROMERO LOPES;4;322101;RUA;DOM JOAQUIM DE OLIVEIRA;228;;VL GUILHERMINA;SP;SAO PAULO;;;;;1
206;3,23975E+11;AGROPECUARIA CAMPINA DO NORTE LTDA;8;162899;ALAMEDA;MINISTRO ROCHA AZEVEDO;38;ANDAR 9 APT 901;CERQUEIRA CESAR;SP;SAO PAULO;11 33316795;;;;5
207;3,25377E+11;BAR E LANCHES R&K LTDA;8;322101;RUA;BELA CINTRA;1693;;CONSOLACAO;SP;SAO PAULO;;;;;5
208;3,31677E+11;LANCHONETE LA'FONTANA DO IPIRANGA LTDA;8;322101;RUA;DOS SOROCABANOS;356;;IPIRANGA;SP;SAO PAULO;;;;;5
209;3,31838E+11;TREVISO AGRO PECUARIA LTDA;8;151201;ALAMEDA;MIN ROCHA AZEVEDO;988;CJ 602;JD PAULISTA;SP;SAO PAULO;;;;;5
210;3,37578E+11;EVALDO PATRICIO DA SILVA;8;322101;RUA;IRMAOS PILA;495;;VL MAZZEI;SP;SAO PAULO;;;;;5
211;3,38101E+11;LUIZ CARLOS ROMANHA BAR E LANCHONETE;8;322101;RUA;CEL ERNESTO DUPRAT;335;;SAO MATEUS;SP;SAO PAULO;;;;;5
212;3,42556E+11;ROYAL PALACE AMERICAN BAR LTDA;8;322101;AVENIDA;IRAI;407;411;MOEMA;SP;SAO PAULO;;;;;5
213;3,42714E+11;HOTEL VALE VERDE LTDAME;4;311601;PRACA;DAS BANDEIRAS;39;;CENTRO;SP;SAO PAULO;;;;;1
214;3,42875E+11;TOP AGROPECUARIA S/A;2;159899;RUA;JOAQUIM FLORIANO;243;10 AND CJ 106;ITAIM BIBI;SP;SAO PAULO;;;;;5
215;3,43227E+11;PAULO JANUARIO CAVALCANTE AVICULTURA;4;155501;AVENIDA;IPE ROXO;323;A;ITAIM PAULISTA;SP;SAO PAULO;;;;;1
216;3,44579E+11;ESMERALDA ALVES DOS SANTOS;8;322101;AVENIDA;CUPECE;5369;;JD MIRIAM;SP;SAO PAULO;;;;;5
217;3,45812E+11;ELITRIMEC REPRESENTACOES LTDA;8;161099;RUA;AGISSE;268;APTO 21;VL MADALENA;SP;SAO PAULO;;;;;5
218;3,46259E+11;CAFETERIA REQUINTE LTDA;8;322101;RUA;BARAO DO TRIUNFO;520;;BROOKLIN;SP;SAO PAULO;;;;;5
219;3,47115E+11;SOCIEDADE COMERCIAL DO ROCHEDO LTDA;2;161099;RUA;JOSE MARIA LISBOA;1000;CJ 103;JARDINS;SP;SAO PAULO;;;;;5
220;3,47115E+11;SOCIEDADE COMERCIAL DO ROCHEDO LTDA;2;162899;RUA;JOSE MARIA LISBOA;1000;10 ANDAR SL 103;JARDINS;SP;SAO PAULO;011 2512866;;011 2897124;;5
221;3,47571E+11;BAR E LANCHES RODRIGUES E ALMEIDA LTDA;4;322101;RUA;RIBEIRAO DAS ALMAS;236;;VL PALMEIRA;SP;SAO PAULO;;;;;1
222;3,49228E+11;MARIA HILDA DA SILVA BAR;8;322101;RUA;ANTONIO FOUTANA;511;;CJ J BONIFACIO;SP;SAO PAULO;;;;;5
223;3,49351E+11;REINALDO FERREIRA SIMOES;2;322101;ESTRADA;DA COLONIA;191;;PARELHEIROS;SP;SAO PAULO;;;;;1
224;3,49735E+11;LANCHONETE FREEBOOTER LTDA;4;322101;AVENIDA;SAPOPEMBA;6734;;VL HELOISA;SP;SAO PAULO;;;;;1
225;3,50592E+11;FLORESTADORA CARACA LIMITADA;8;210101;AVENIDA;INTERLAGOS;4455;;SANTO AMARO;SP;SAO PAULO;;;;;5
226;3,53088E+11;AUGUSTO FERNANDES DE OLIVEIRA BAR;4;322101;RUA;ALTO DE MONTALEGRE;130;;LAUZANE PAULISTA;SP;SAO PAULO;;;;;5
