891000186;COALA COMERCIO DE LUBRIFICANTES LTDA;8;4731800;RUA;JULIO CONCEICAO;762;SALA 01;BOM RETIRO;SP;SAO PAULO;;;;;5
1494000129;SUL-LUB COMERCIO DE LUBRIFICANTES LTDA;8;4731800;AVENIDA;NSA SRA DO SABARA;643;SALA 01;SANTO AMARO;SP;SAO PAULO;;;;;1
3188001870;COMPETRO COMERCIO E DISTRIBUICAO DE DERIVADOS DE PETROLEO LTDA;2;4731800;AVENIDA;WASHINGTON LUIZ- AEROPORTO CONGONHAS;S/N;;AEROPORTO;SP;SAO PAULO;15 2321843;;15 2321843;;5
6235000190;REDEGAS SAO MIGUEL COM DE REVENDA DE GAS E ACES LTDA;8;4731800;RUA;PEDRO MEIRA;236;;SAO MIGUEL PTA;SP;SAO PAULO;;;;;5
8021000153;A.T.MOIL OLEOS E LUBRIFICANTES LTDA;2;4731800;RUA;AMAMBAI;635;BAIXOS;VILA MARIA;SP;SAO PAULO;;;;;1
13688000144;AMIRA AUTO POSTO LTDA;8;4731800;RUA;DOMINGOS DE MORAIS;343;;VILA MARIANA;SP;SAO PAULO;;;;;5
13726000169;MORIA COMERCIO DE LUBRIFICANTES LTDA;2;4731800;AVENIDA;ENG,ARMANDO A.PEREIRA;2367;;JABAQUARA;SP;SAO PAULO;;;;;1
13837000175;DENVER COM.DE OLEOS LUBRIFICANTES NOVOS E USADO LTDA;4;4731800;RUA;RICARDO GLUBETON DAUN'T;313;TERREO;VILA RICA;SP;SAO PAULO;;;;;1
14052000117;TUZAN LUBRIFICANTES E PECAS LTDA;2;4731800;RUA;MANOEL FERREIRA PIRES;93;;PQ SANTO ANTONIO;SP;SAO PAULO;;;;;1
15621000149;CERTEIRA COM.E ASSIST.TECNICA EM RELOG.DE PONTO LTDA;8;4731800;RUA;LUISA ALVARES;254;;V CAMPESTRE;SP;SAO PAULO;;;;;1
16966000117;APLAUSO AUTO POSTO LTDA;2;4731800;AVENIDA;ARATAS;1080;;INDIANOPOLIS;SP;SAO PAULO;;;;;5
16968000106;POSTO DE SERVICOS TALISMA SAO PAULO LTDA;2;4731800;ALAMEDA;JAUAPERI;45;ESQUINA COM A AV. REPUBLICA DO LIBANO 2168;MOEMA;SP;SAO PAULO;11 50805500;;;;5
16969000150;AUTO POSTO LIDER SANTOS DUMONT LTDA;2;4731800;AVENIDA;DO ESTADO;1036;;MERCADO;SP;SAO PAULO;11 22031403;;;JUNIOR@AJRCONTABILIDADE.COM.BR;5
17512000160;MILENA ELOISA VILLAVERDE POSTO DE COMBUSTIVEIS- EIRELI;2;4731800;AVENIDA;ONZE DE JUNHO;1519;;VILA CLEMENTINO;SP;SAO PAULO;;;;;5
17674000107;AUTO POSTO DOCARMO LTDA;2;4731800;AVENIDA;AFONSO SAMPAIO E SOUSA;1428;;JD NS DO CARMO;SP;SAO PAULO;;;;;5
17750000176;COMERCIAL ARIZONA LTDA;8;4731800;RUA;PADRE GREGORIO MAFRA;1600;BOX 1;SAO MIGUEL PAULISTA;SP;SAO PAULO;;;;;5
18571000153;AUTO POSTO LIVERPOOL LTDA;8;4731800;AVENIDA;SANTO AMARO;2250;;VILA OLIMPIA;SP;SAO PAULO;;;;;5
19319000169;COMERCIAL REI DO ALARME LTDA.;8;4731800;AVENIDA;CONSELHEIRO CARRAO;114 18;;VILA CARRAO;SP;SAO PAULO;;;;;5
20888000124;TEXAS DISTRIBUIDORA DE PETROLEO LTDA;2;4731800;AVENIDA;ENGO. LUIZ CARLOS BERRINI;1178;12 ANDAR;BROOKLIN NOVO;SP;SAO PAULO;;;;;5
21599000140;SFER-LUB COMERCIO DE LUBRIFICANTES LTDA;8;4731800;AVENIDA;MUTINGA;1935;;VILA PIRITUBA;SP;SAO PAULO;;;;;1
22054000158;COMERCIAL AOTEXAS LTDA;8;4731800;ALAMEDA;DOS MARACATINS;1818;BOX 1;CAMPO BELO;SP;SAO PAULO;;;;;5
22941000126;POSTO ROMA III LTDA;8;4731800;VIA;ANHANGUERA;SN;KM 15 5;PIRITUBA;SP;SAO PAULO;;;;;5
23692000193;WR COMERCIO DE LUBRIFICANTES LTDA;2;4731800;AVENIDA;LIDER;28;A;CIDADE LIDER;SP;SAO PAULO;;;;;1
23963000100;T.D.A. - COMERCIAL POSTO LTDA;8;4731800;RUA;FIDELIS PAPINI;877;FRENTE;VILA PRUDENTE;SP;SAO PAULO;;;;;5
24610000125;TREVO DO PESSEGO COM E SERV DE COMBUST E LUBRIFIC LTDA;2;4731800;AVENIDA;RAGUEB CHOHFI;4285;;JD IGUATEMI;SP;SAO PAULO;;;;;5
25107000194;POSTO DE SERVICOS M C P LIMITADA;2;4731800;AVENIDA;RAIMUNDO P DE MAGALHAES;2840;;PIRITUBA;SP;SAO PAULO;;;;;5
25605000137;MAXXI-POSTO DE SERVICOS LTDA;8;4731800;RUA;ABADIANIA;682;;VILA MATILDE;SP;SAO PAULO;;;;;5
27021000109;CLASSE A SERVICOS AUTOMOTIVOS LTDA;2;4731800;AVENIDA;VICENTE RAO;1001;;JD CORDEIRO;SP;SAO PAULO;11 29502066;11 29502074;;ARFECONTABIL@TERRA.COM.BR;5
27989000127;MARTE POSTO DE SERVICOS LTDA;8;4731800;RUA;VOLUNTARIOS DA PATRIA;1428;;SANTANA;SP;SAO PAULO;;;;;5
28849000173;PAULISTA CENTER AUTO POSTO LTDA;2;4731800;AVENIDA;BERNARDINO DE CAMPOS;307;;PARAISO;SP;SAO PAULO;;;;;5
29312000128;CENTRAL DE ITAQUERA AUTO POSTO LTDA;2;4731800;AVENIDA;ITAQUERA;900;;ITAQUERA;SP;SAO PAULO;;;;;1
29313000172;ITAQUERA LUB COMERCIAL LTDA;8;4731800;AVENIDA;ITAQUERA;902;;ITAQUERA;SP;SAO PAULO;;;;;5
29804000113;CENTRO AUTOMOTIVO DUMONT LTDA;2;4731800;AVENIDA;DR. GUILHERME DUMONT VILARES;1151;;VILA SUZANA;SP;SAO PAULO;011 5755158;;;;5
30377000193;AUTO POSTO DONA RAQUEL LTDA;8;4731800;AVENIDA;HEITOR PENTEADO;285;;SUMAREZINHO;SP;SAO PAULO;;;;;5
1,19377E+11;AUTO POSTO JEMINA LTDA;8;4731800;AVENIDA;BELMIRA MARIM;4045;;PARQUE COCAIA;SP;SAO PAULO;;;;;5
1,29505E+11;AUTO POSTO 9 LTDA;4;4731800;AVENIDA;CIDADE JARDIM;589;;ITAIM BIBI;SP;SAO PAULO;;;;;5
1,33507E+11;VENICIO BURATI;8;4731800;RUA;NOSSA SRA DAS MERCES;1020;1030 E 1060;VL DAS MERCES;SP;SAO PAULO;;;;;5
1,44051E+11;AUTO POSTO SANTA CLARA DE ASSIS LTDA;2;4731800;RUA;RAIMUNDO DA CUNHA MATOS;51;;VL MORRO GRANDE;SP;SAO PAULO;;;;;5
1,58365E+11;PARK BELLO AUTO POSTO LTDA;8;4731800;AVENIDA;MARQUES DE S VICENTE;990;;BARRA FUNDA;SP;SAO PAULO;;;;;5
1,59549E+11;AUTO POSTO RAGUEB LTDA;2;4731800;AVENIDA;RAGUEB CHOHFI;871;;JD IGUATEMI;SP;SAO PAULO;;;;;5
1,60678E+11;JJC AUTO MECANICA E COMERCIO DE AOLEO LTDA;8;4731800;AVENIDA;DO ORATORIO;485;;JD INDEPENDENCIA;SP;SAO PAULO;;;;;1
1,64832E+11;FELINQUE DISTRIBUIDORA E COMERCIO DE COMBUSTIVEIS LTDA;2;4731800;RUA;DA FLORICULTURA;23;;VL CONSTANCIA;SP;SAO PAULO;;;;;1
1,6629E+11;OPERADORA DE POSTOS DE SERVICOS LTDA;8;4731800;AVENIDA;NOVA TRABALHADORES JACU-PESSEGO;3301;;VILA JACUI;SP;SAO PAULO;;;;;5
1,6629E+11;OPERADORA DE POSTOS DE SERVICOS LTDA;2;4731800;AVENIDA;NOVA TRABALHADORES JACU-PESSEGO;1406;;JACU PESSEGO;SP;SAO PAULO;;;;;5
1,6629E+11;OPERADORA DE POSTOS DE SERVICOS LTDA;8;4731800;AVENIDA;BRIG. FARIA LIMA;1448;ESQ R TAVARES;PINHEIROS;SP;SAO PAULO;;;;;5
1,6629E+11;OPERADORA DE POSTOS DE SERVICOS LTDA;8;4731800;RUA;DR. CESAR;303;;SANTANA;SP;SAO PAULO;;;;;5
1,6629E+11;OPERADORA DE POSTOS DE SERVICOS LTDA;8;4731800;AVENIDA;MARECHAL TITO;3043;;SAO MIGUEL PAULISTA;SP;SAO PAULO;;;;;5
1,6629E+11;OPERADORA DE POSTOS DE SERVICOS LTDA;8;4731800;AVENIDA;JULIO BUONO;2851;;VILA GUSTAVO;SP;SAO PAULO;;;;;5
1,6629E+11;OPERADORA DE POSTOS DE SERVICOS LTDA;8;4731800;RUA;BARAO DE RESENDE;66;;IPIRANGA;SP;SAO PAULO;;;;;5
1,6629E+11;OPERADORA DE POSTOS DE SERVICOS LTDA;8;4731800;RUA;JOAQUIM CARLOS;1027;;PARI;SP;SAO PAULO;;;;;5
1,6629E+11;OPERADORA DE POSTOS DE SERVICOS LTDA;8;4731800;AVENIDA;MIGUEL FRIAS E VASCONCELOS;670;;JAGUARE;SP;SAO PAULO;;;;;5
1,67279E+11;LUBRIFICA DISTRIBUIDORA E COMERCIO DE LUBRIFICANTE LTDA;2;4731800;RUA;SOLD. CLOVIS R DA SILVA;353;;PQ NOVO MUNDO;SP;SAO PAULO;;;;;1
1,69851E+11;DISK LUB LUBRIFICANTES E PECAS LTDA;8;4731800;RUA;MIGUEL F DA TRINDADE;78;;VILA AMADEU;SP;SAO PAULO;;;;;5
1,70259E+11;AUTO POSTO GASOCENTER LTDA;8;4731800;RUA;JOAO TEODORO;565;;LUZ;SP;SAO PAULO;;;;;5
1,70487E+11;AUTO POSTO CIDADE VARGAS LTDA;2;4731800;RUA;NELSON FERNANDES;382;;PRQ JABAQUARA;SP;SAO PAULO;;;;;5
1,74576E+11;ALMIR CAMARGO PAGLIARI;8;4731800;AVENIDA;CONSELHEIRO CARRAO;1130;;VL CARRAO;SP;SAO PAULO;;;;;5
1,75094E+11;AUTO POSTO DOZE MIL LTDA;8;4731800;AVENIDA;ARICANDUVA;12000;;VILA ARICANDUVA;SP;SAO PAULO;;;;;5
1,82538E+11;POSTO DE SERVICOS XV DE NOVEMBRO LTDA;4;4731800;AVENIDA;DE PINEDO;251;;CAPELA DO SOCORRO;SP;SAO PAULO;;;;;3
1,8669E+11;COLONIA COM E SERV DE COMBUSTIVEIS E LUBRIFICANTES LTDA;8;4731800;AVENIDA;NOVA TRABALHADORES;477;;JD CIBELE;SP;SAO PAULO;;;;;5
1,93659E+11;TAURUS SERVICOS AUTOMOTIVOS LTDA;8;4731800;PRACA;D.FRANCISCO DE SOUZA;450;;SANTO AMARO;SP;SAO PAULO;;;;;5
2,00457E+11;AGUIA DA MARGINAL AUTO POSTO LIMITADA;2;4731800;RUA;ARTUR FERREIRA DE ABREU;342;;JARDIM GUARAU;SP;SAO PAULO;11 30897999;;11 30897995;carlos.ferraz@jcmferraz.com.br;5
2,11095E+11;JET TRES LAVA RAPIDO E TROCA DE OLEO LTDA;8;4731800;AVENIDA;IMPERADOR;3589;;SAO MIGUEL PAULISTA;SP;SAO PAULO;;;;;5
2,11927E+11;AGUIA DA MARGINAL AUTO POSTO LIMITADA;1;4731800;AVENIDA;DAS NACOES UNIDAS;17750;;SANTO AMARO;SP;SAO PAULO;;;;;5
2,15728E+11;JOSE NELSON AGUIAR FERNANDES POSTO DE GASOLINA;8;4731800;AVENIDA;ENG ARMANDO A PEREIRA;539;;JABAQUARA;SP;SAO PAULO;;;;;5
2,18986E+11;AUTO POSTO TETRA LTDA;8;4731800;RUA;DOS SOROCABANOS;264;;IPIRANGA;SP;SAO PAULO;;;;;5
2,28901E+11;COMERCIAL MYLONJET LTDA;2;4731800;AVENIDA;SANTA CATARINA;523;;VILA ALEXANDRIA;SP;SAO PAULO;;;;;1
2,29466E+11;RISSE DISTRIB DE PRODUTOS AUTOMOTIVOS LTDA;8;4731800;AVENIDA;DONA BELMIRA MARIN;1780;;GRAJAU;SP;SAO PAULO;;;;;5
2,3007E+11;SHOP-LUB REPRESENTACAO DE LUBRIFICANTES E PECAS EM GERAL LTDA;4;4731800;;VALDOMIRO GONZAGA DA SILVA;666;;JD DAS OLIVEIRAS;SP;SAO PAULO;;;;;1
2,30137E+11;JOSE RODRIGUES SOBRINHO LUBRIFICANTES;8;4731800;AVENIDA;ESPERANTINA;828;;JD COIMBRA;SP;SAO PAULO;;;;;5
2,31439E+11;CENTRO AUTOMOTIVO ATENAS LTDA;8;4731800;ESTRADA;DO IMPERADOR;18;;VL VERDE;SP;SAO PAULO;;;;;5
2,34442E+11;VAL DERRAMA SERVICOS ALTOMOTIVOS LTDA.;8;4731800;ESTRADA;ESTRADA DE ITAPECERICA;1985;;VL DAS BELEZAS;SP;SAO PAULO;;;;;5
2,3639E+11;PEN COMERCIAL E INFORMATICA LTDA;8;4731800;AVENIDA;LIBERDADE;21;SALAS 103 103A 104;LIBERDADE;SP;SAO PAULO;;;;;5
2,36483E+11;AUTO POSTO TREVO DE MALTA LTDA;4;4731800;AVENIDA;CELSO GARCIA;5780;;TATUAPE;SP;SAO PAULO;;;;;5
2,46493E+11;AUTO POSTO ALLOY LTDA;8;4731800;RUA;21 DE ABRIL;1413;;BELENZINHO;SP;SAO PAULO;;;;;5
2,51061E+11;AMELIA NAGATA;8;4731800;AVENIDA;MATEO BEI;1175;;CID SAO MATEUS;SP;SAO PAULO;;;;;1
2,56722E+11;AUTO POSTO MENDEL LTDA;2;4731800;AVENIDA;ROBERT KENNEDY;760;761;SOCORRO;SP;SAO PAULO;;;;;1
2,57087E+11;SAGITARIUN'S COMERCIAL LTDA;8;4731800;RUA;ILIRIA;58;;MOINHO VELHO;SP;SAO PAULO;;;;;5
2,58799E+11;COMERCIAL ALTEROSAS LTDA;8;4731800;AVENIDA;LIDER;2207;;CID.LIDER;SP;SAO PAULO;;;;;5
2,59781E+11;ASTURIAS COMERCIO DE DERIVADOS DE PETROLEO LTDA;8;4731800;AVENIDA;ENGENHEIRO LUIS CARLOS BERRINI;1178;6 ANDAR - SL 01;BROOKLIN NOVO;SP;SAO PAULO;;;;;5
2,6273E+11;JORGE SERMENTO JUNIOR POSTO DE SERVICOS;8;4731800;RUA;MAL HASTINPILO DE MOURA;990;;S Q MORUMBI;SP;SAO PAULO;;;;;5
2,64575E+11;KARTEROIL COMERCIO DE DERIVADOS DE PETROLEO LTDA;8;4731800;RUA;USHIKICHI KAMIYA;1048;;VILA ZILDA;SP;SAO PAULO;;;;;5
2,6515E+11;THATILUB LUBRIFICANTES LTDA;8;4731800;RUA;DO CAPRICHO;693;CASA 14 B;VL GUSTAVO;SP;SAO PAULO;;;;;5
2,65161E+11;AUTO POSTO KAK COMERCIO DE COMB E LUBRIFICANTES LTDA;8;4731800;AVENIDA;JAGUARE;1371;;BAIRRO JAGUARE;SP;SAO PAULO;;;;;5
2,72991E+11;POSTO DE SERVICOS PORTAL DE ITAPECERICA LIMITADA;2;4731800;ESTRADA;DE ITAPECERICA;4505;;CAPAO REDONDO;SP;SAO PAULO;;;;SOCIETARIO@MSCHMIDTCONTABIL.COM.BR;5
2,80304E+11;FAST LINE COMERCIO DE LUBRIFICANTES LTDA;4;4731800;AVENIDA;SANATORIO;1341;;JD BRASIL;SP;SAO PAULO;;;;;1
2,83687E+11;PAULO SERGIO FERREIRA DE GODOY LUBRIFICANTES;8;4731800;RUA;CARAPARU;74;ALTOS;VL GUSTAVO;SP;SAO PAULO;;;;;5
2,83818E+11;SPEED CENTRO AVANCADO DE LUBRIFICACAO AUTOMOTIVA LTDA;8;4731800;AVENIDA;POMPEIA;698;;VL POMPEIA;SP;SAO PAULO;;;;;5
2,86466E+11;CARIBE PETROLEUM DISTRIB DE COMB E LUBRIFICANTES LTDA;8;4731800;AVENIDA;JOSE CESAR DE OLIVEIRA;175;CJ 703;VL LEOPOLDINA;SP;SAO PAULO;;;;;5
3,02903E+11;CENTRO AUTOMOTIVO SAO CONRADO LIMITADA;2;4731800;AVENIDA;RAIMUNDO P DE MAGALHAES;6277;;PIRITUBA;SP;SAO PAULO;;;;;5
3,05701E+11;AUTO POSTO NEW CASTLE LTDA;4;4731800;RUA;NSA SRA DO SABARA;120;;V SAO PEDRO;SP;SAO PAULO;;;;;1
3,11553E+11;TREVO COMERCIO OLEOS AUTO MOT SERV LAVA RAPIDO LTDA;8;4731800;AVENIDA;WASHINGTON LUIZ;1840;;JD MARAJOARA;SP;SAO PAULO;;;;;5
3,27232E+11;RICARDO ABRAO JORGE ESTACIONAMENTO;2;4731800;AVENIDA;LEONCIO DE MAGLHAES;1063;;JD SAO PAULO;SP;SAO PAULO;;;;;1
3,39565E+11;PARADA DO CAMINHONEIRO OLEO E LUBRIFICANTES LTDA;8;4731800;RUA;DR MIRANDA DE AZEVEDO;1118;;POMPEIA;SP;SAO PAULO;;;;;5
3,49617E+11;AUTO OLEO CARECA LTDA;8;4731800;RUA;CAPRICHO;1264;A;VILA NIVI;SP;SAO PAULO;;;;;5
3,49736E+11;AUTO POSTO MEMORIAL LTDA;4;4731800;RUA;MARGARIDA;357;;BARRA FUNDA;SP;SAO PAULO;;;;;1
3,54533E+11;AUTO POSTO PETALA AZUL LTDA;2;4731800;RUA;CONSELHEIRO LAFAYETE;255;;MOOCA;SP;SAO PAULO;11 22137215;11 22166892;11 22164361;LOURENCOCONTABILIDADE@HOTMAIL.COM;5
3,55328E+11;RIAN COMERCIODE LUBRIFICANTES LTDA;8;4731800;RUA;ITANHAEM;706;;VL PRUDENTE;SP;SAO PAULO;;;;;5
3,56209E+11;J.A. LUBRIFICANTES E PECAS LTDA;2;4732600;RUA;SEBASTIAO F. DE SOUZA;37;;BUTANTA;SP;SAO PAULO;11 23482359;;;SOCIETARIO@MSCHMIDTCONTABIL.COM.BR;1
3,59272E+11;VALDOMIRO FERREIRA DE ARAUJO-LUBRIFICANTES;8;4731800;RUA;MANOEL DOS SANTOS;36;;VILA GOMES CARDIM;SP;SAO PAULO;11 29419420;;;;1
3,60048E+11;NASCAR PETROLEO LTDA;8;4731800;RUA;AURI VERDE;1560;;VL CARIOCA;SP;SAO PAULO;;;;;5
3,65207E+11;5200 POSTO DE SERVICOS LTDA;8;4731800;AVENIDA;MAGALHAES DE CASTRO;5200;;REAL PARQUE;SP;SAO PAULO;;;;;5
3,67602E+11;WILMAR & ANDERSON COMERCIO DE LUBRIFICANTES E PECAS PARA VEICULOS EIRELI;2;4732600;RUA;MANOEL BARBOSA;239;;PIRITUBA;SP;SAO PAULO;11 39778363;11 39724134;;alpsplan@ig.com.br;1
3,69441E+11;AUTO POSTO QUINTA DE SANTA LUZIA LTDA;2;4731800;AVENIDA;NOSSA SENHORA DO SABARA;4801;;PEDREIRA;SP;SAO PAULO;11 31056733;11 31056733;11 31056733;lisboasc@terra.com.br;5
3,70927E+11;CENTRO AUTOMOTIVO ROYALE EIRELI;2;4731800;RUA;JOAO TIBIRICA;705;;ALTO DA LAPA;SP;SAO PAULO;11 21433811;11 21434433;11 21433811;SILVERIO@SILVERIO.COM.BR;5
3,71075E+11;CIRANDA PAPELARIA E ARTIGOS PARA PRESENTES LTDA;8;4731800;RUA;VINTE E TRES DE OUTUBRO;265;;VILA SONIA;SP;SAO PAULO;;;;;5
3,71736E+11;CENTRO AUTOMOTIVO VIA LESTE LTDA;8;4731800;RUA;ESTEVAO RIBEIRO GARCIA;30;E 133 A;S MIGUEL PAULISTA;SP;SAO PAULO;;;;;5
3,72874E+11;RICHARD SULZBACH;8;4731800;AVENIDA;DAMASCENO VIEIRA;1173;APTO 51;VILA MASCOTE;SP;SAO PAULO;;;;;5
3,78317E+11;OVER OIL LUBRIFICANTES LTDA;8;4731800;;TV LEANDRO FERREIRA;90;;VL GUILHERME;SP;SAO PAULO;;;;;5
3,78817E+11;POSTO JARINA COMBUSTIVEIS LTDA;4;4731800;AVENIDA;DO CURSINO;2230;;JD DA SAUDE;SP;SAO PAULO;;;;;3
3,85387E+11;HAUPTMAN BRASILEIRA DE DERIVADOS DE PETROLEO LTDA;8;4731800;ALAMEDA;DOS GUAICANAS;331;;PLANALTO PAULISTA;SP;SAO PAULO;;;;;5
4,01384E+11;POSTO DE SERVICOS NONA DIMENSAO LTDA;8;4731800;RUA;21 DE ABRIL;900;;BRAS;SP;SAO PAULO;;;;;5
4,15131E+11;CENTRO AUTOMOTIVO HURACAN LTDA;2;4731800;AVENIDA;GEORGE CORBISIER;503;;JABAQUARA;SP;SAO PAULO;11 50115314;;11 50115314;CAHURACAN@TERRA.COM.BR;5
4,16241E+11;MAURO APARECIDO COSCARELLI;8;4731800;RUA;NOSSA SRA DAS MERCES;1060;;VL DAS MERCES;SP;SAO PAULO;;;;;5
4,18375E+11;ANTONIA VITORIA DO NASCIMENTO - MICRO EMPRESA;8;4731800;AVENIDA;ROLLAND GARROS;1038;1 AND SL 2;JD BRASIL;SP;SAO PAULO;;;;;1
4,19434E+11;OXIFREITAS COMERCIO DE GASES E MATER.P/SOLDA LTDA;8;4731800;RUA;DIOGO BOTELHO;17;;VILA GUILHERME;SP;SAO PAULO;;;;;1
4,22045E+11;TRATS COMERCIO DE BOMBAS LTDA;8;4731800;RUA;SIQUEIRA BUENO;910;;BELENZINHO;SP;SAO PAULO;;;;;5
4,22153E+11;GAS STATION SERVICOS AUTOMOTIVOS LTDA;2;4731800;RUA;GLICERIO;23;;SE;SP;SAO PAULO;;;;;1
4,23239E+11;NOVA IMPERADOR COMERCIO DE LUBRIFICANTES LTDA;8;4731800;RUA;JULIO CONCEICAO;762;SALA 03;BOM RETIRO;SP;SAO PAULO;;;;;5
4,37776E+11;AUTO POSTO ITABORAI LTDA;2;4731800;PRACA;PADRE DAMIAO;29;;VILA PRUDENTE;SP;SAO PAULO;;;;;3
4,42388E+11;CARINHOSO COM.E SERV DE COMBUST.E LUBRIFICANTES LTDA;8;4731800;AVENIDA;JOSE DA NOBREGA BOTELHO;28;;VL.ZELINA;SP;SAO PAULO;;;;;5
4,43673E+11;AUTO POSTO IBIZA LTDA;8;4731800;AVENIDA;GAL ATALIBA LEONEL;3714;;CARANDIRU;SP;SAO PAULO;;;;;1
4,50306E+11;AUTO POSTO KRJ LTDA;8;4731800;RUA;AMERICO SUGAI;22;;SAO MIGUEL;SP;SAO PAULO;;;;;5
4,56495E+11;CENTRO AUTOMOTIVO LOS ANGELES LTDA;4;4731800;AVENIDA;COD.ELIZABETH ROBIANO;S/N;C/AV ARICANDUVA;JD AMERICA PENHA;SP;SAO PAULO;;;;;1
4,56499E+11;CENTRO AUTOMOTIVO DENVER LTDA;2;4731800;ESTRADA;MOGI DAS CRUZES;432;;PONTE RASA;SP;SAO PAULO;11 25231815;11 25231815;11 25231815;FALECONOSCO@QUALICONTAX.COM.BR;5
4,75367E+11;AUTO POSTO BARRA FORTE LTDA;8;4731800;AVENIDA;MARQUES DE SAO VICENTE;998;;BARRA FUNDA;SP;SAO PAULO;;;;;5
4,7816E+11;FABIANO GIMENEZ;8;4731800;AVENIDA;DO ORATORIO;3830;;JD GUARAICA;SP;SAO PAULO;;;;;5
4,82558E+11;CENTRO AUTOMOTIVO SAO FRANCISCO DE JACAREI LTDA;8;4731800;AVENIDA;RIO DAS PEDRAS;2696;;VILA NOVA YORK;SP;SAO PAULO;;;;;5
4,8321E+11;D P MARTINS LUBRIFICANTES;8;4731800;RUA;CURUPITE;152;;TUCURUVI;SP;SAO PAULO;;;;;5
4,87375E+11;B C COMERCIAL LTDA;8;4731800;RUA;DA MOOCA;1026;;MOOCA;SP;SAO PAULO;;;;;5
4,93053E+11;SORREL LUBRIFICANTES LTDA;8;4731800;RUA;JOAO DE CARVALHAIS;55;;PIRITUBA;SP;SAO PAULO;;;;;5
4,93053E+11;SORREL LUBRIFICANTES LTDA;8;4731800;RUA;JOAO DE CARVALHAIS;55;;PIRITUBA;SP;SAO PAULO;;;;;5
5,01495E+11;PETROCON POSTO DE SERVICOS LTDA;8;4731800;RUA;ARAUJO;376;;VL BUARQUE;SP;SAO PAULO;;;;;5
5,03305E+11;AUTO POSTO LAGORIO LTDA;8;4731800;AVENIDA;HIGIENOPOLIS;938;;CENTRO;SP;SAO PAULO;;;;;5
5,06926E+11;REAL DOIS POSTO DE SERVICOS LTDA;8;4731800;RUA;HELVETIA;4;;STA EFIGENIA;SP;SAO PAULO;;;;;5
5,07414E+11;SIG-OIL COMERCIAL LTDA;2;4731800;AVENIDA;ELISEO TEIXEIRA LEITE;2248;;FREG DO O;SP;SAO PAULO;;;;;1
5,17481E+11;CAMPO LARGO POSTO DE SERVICOS LTDA;8;4731800;RUA;NATAL;952;;MOOCA;SP;SAO PAULO;;;;;5
5,24177E+11;ADEMIR GONCALVES PANORAMA;8;4731800;RUA;OTUSCO;385;;JD. MARCELO;SP;SAO PAULO;;;;;5
5,25027E+11;AUTO POSTO VANELLI LTDA;8;4731800;RUA;CONS MOREIRA DE BARROS;315;;SANTANA;SP;SAO PAULO;;;;;5
5,2719E+11;COMERCIAL EQUIPAN MAQS E EQUIPS P/ PANIFICACAO LTDA;8;4731800;RUA;JUAN DE LA CRUZ;269;;JARDIM JABAQUARA;SP;SAO PAULO;;;;;5
5,28369E+11;AUTO POSTO NOVA ZILDA LTDA;2;4731800;RUA;ZILDA;515;;CASA VERDE;SP;SAO PAULO;;;;;5
5,33599E+11;CENTRO AUTOMOTIVO FENIX LTDA;2;4731800;RUA;CATIGUA;657;;TATUAPE;SP;SAO PAULO;;;;;5
5,46961E+11;FOROIL COM E DISTRIBUICAO DE OLEOS LUB E PROD AUT LTDA;4;4731800;RUA;CIRENE DE OLIVEIRA LAET;400;;VL NILO;SP;SAO PAULO;;;;;1
5,47366E+11;CENTRO AUTOMOTIVO ROD'FOR LIMITADA;8;4731800;RUA;GENERAL LECOR;969;;IPIRANGA;SP;SAO PAULO;;;;;5
5,47368E+11;EDMIR JAYME BRADASCHIA;4;4731800;AVENIDA;DR RICARDO JAFET;1101;;IPIRANGA;SP;SAO PAULO;;;;;1
5,49585E+11;LAVEMP LAVAGEM E LUBRIFICACAO DE EMPILHADEIRAS LTDA;4;4731800;RUA;TTE PAULO ALVES;231;;VL ELISIO;SP;SAO PAULO;;;;;5
5,62219E+11;D'NILDO COMERCIO DE VEICULOS LTDA;8;4731800;AVENIDA;LEONARDO DA VINCI;2180;;VILA GUARANI;SP;SAO PAULO;;;;;1
5,65738E+11;AUTO POSTO REINO UNIDO LTDA;8;4731800;AVENIDA;JOAO DIAS;3541;;SANTO AMARO;SP;SAO PAULO;;;;;5
5,69283E+11;AUTO POSTO MURILO LTDA;8;4731800;RUA;VISCONDE DE INHOMIRIM;288;;MOOCA;SP;SAO PAULO;;;;;5
5,74027E+11;MORI COMERCIO E REPRESENT DE DERIV DE PETROLEO LTDA;8;4731800;RUA;EPITACIO PESSOA;87;2 AND CJ 24;VL BUARQUE;SP;SAO PAULO;;;;;5
5,76478E+11;MARCOS DANIEL AMARO VIEIRA;8;4731800;AVENIDA;ANTONIO LOUZADA ANTUNES;15;;SAO MIGUEL PAULISTA;SP;SAO PAULO;;;;;5
5,78428E+11;AUTO POSTO DE SERVICOS EL-SHADAI LTDA;8;4731800;RUA;LUIS MATEUS;516;;GUAIANAZES;SP;SAO PAULO;;;;;5
5,85565E+11;YES AUTO POSTO LTDA;8;4731800;RUA;ROBERT BOCH;45;;BARRA FUNDA;SP;SAO PAULO;011 69502066;;011 69502074;;5
5,88494E+11;SUPER POSTO AVINHADO EIRELI;8;4731800;RUA;AVINHADO;8;;VL AMERICANA;SP;SAO PAULO;11 47999906;;11 59046664;LEGAL@MELLOASSESSORIA.COM.BR;5
5,94755E+11;AUTO POSTO CENTER BOOL LIMITADA;3;4731800;AVENIDA;MARQUES DE SAO VICENTE;996;;BARRA FUNDA;SP;SAO PAULO;;;;;1
5,96698E+11;CENTRO DE SERVICOS CANDELARIA LTDA;8;4731800;RUA;TEN CEL JOSE J C ARRUDA;545;;FREG DO O;SP;SAO PAULO;;;;;5
6,05787E+11;MAX LUBRIFICANTES AUTOMOTIVOS LTDA.;2;4732600;ESTRADA;DOM JOAO NERY;758;;ITAIM PAULISTA;SP;SAO PAULO;11 25150027;;;ANDREA_ASSESSORIACONTABIL@HOTMAIL.COM;1
6,09371E+11;CENTRO AUTOMOTIVO TRUCKCAR LTDA;8;4731800;AVENIDA;WASHINGTON LUIS;270;TERREO;SANTO AMARO;SP;SAO PAULO;;;;;5
6,14608E+11;QUINTA MARCHA AUTO POSTO LTDA;2;4731800;AVENIDA;WASHINGTON LUIZ;1171;;SANTO AMARO;SP;SAO PAULO;;;;;5
6,27647E+11;TP COMERCIO DE FILTROS E OLEOS LTDA;8;4731800;RUA;BARRA FUNDA;239;;BARRA FUNDA;SP;SAO PAULO;;;;;5
6,29528E+11;POSTO DE SERVICOS 1000 MARAVILHA LTDA;4;4731800;RUA;SILVA BUENO;29;;IPIRANGA;SP;SAO PAULO;;;;;1
6,30133E+11;SUCESSO SERVICOS AUTOMOTIVOS LTDA;4;4731800;AVENIDA;ENG. QUEIROS TELLES;352;;JD D'ABRIL;SP;SAO PAULO;;;;;5
6,32632E+11;S.S.C.AUTO POSTO LTDA;2;4731800;RUA;AFONSO DE OLIVEIRA SANTOS;150;;PARAISOPOLIS;SP;SAO PAULO;11 5777772;;;;5
6,35158E+11;VIC COMERCIO DE LUBRIFICANTES LTDA;2;4732600;AVENIDA;SARGENTO GERALDO SANT'ANA;1114;ANEXO B;JARDIM TAQUARAL;SP;SAO PAULO;11 56677857;11 11566778;11 56677857;MARCIOMIKAMI2132@HOTMAIL.COM;1
6,38013E+11;JOSE GRIGORIO MOREIRA;8;4731800;RUA;SALVADOR DALI;700;LOTE B;JD APURA;SP;SAO PAULO;;;;;5
6,38211E+11;AUTO POSTO JARDIM EUROPA LTDA;2;4731800;AVENIDA;CIDADE JARDIM;172;;JARDIM PAULISTANO;SP;SAO PAULO;;;;;1
6,43738E+11;MESTRE COMERCIO DE OLEOS E LUBRIFICANTES LTDA;8;4731800;RUA;ANTONIO ROBERTO DE ALMEIDA;51;;ENGENHEIRO GOULART;SP;SAO PAULO;;;;;5
6,43978E+11;ZOZIMO AUTOMOTIVOS LTDA;8;4731800;RUA;CUIABANO;68;;VL PRIMAVERA;SP;SAO PAULO;;;;;5
6,48222E+11;CENTRO AUTOMOTIVO BARCELONA LTDA;8;4731800;AVENIDA;GIOVANNI GRONCHI;3510;;MORUMBI;SP;SAO PAULO;;;;;5
6,68625E+11;FALCAO COMERCIO DE LUBRIFICANTES LTDA;8;4731800;AVENIDA;RAGUEB CHOFFI;S/N;;SANTA ETELVINA;SP;SAO PAULO;;;;;5
6,69811E+11;AUTO POSTO VALE ENCANTADO LIMITADA;8;4731800;AVENIDA;WASHINGTON LUIZ;1527;;JARDIM BELGICA;SP;SAO PAULO;;;;;5
6,86068E+11;GRANDE PARADA AUTO SERVICOS LTDA;8;4731800;ESTRADA;DE ITAPECIRICA DA SERRA;3395;;JD CAMPO FORA;SP;SAO PAULO;;;;;5
6,92489E+11;AUTO POSTO CONTDES LTDA;4;4731800;AVENIDA;GUILHERME;374;;VL GUILHERME;SP;SAO PAULO;;;;;1
7,05945E+11;POSTO DE SERVICOS VILA TALARICO LTDA;4;4731800;RUA;PARANHOS;45;;VILA TALARICO;SP;SAO PAULO;;;;;1
7,07272E+11;SUNSET POSTOS DE SERVICOS E CONVENIENCIA LTDA;2;4731800;RUA;PEREIRA LEITE;27;;JD JACARANDAS;SP;SAO PAULO;;;;;5
7,10128E+11;MARIANA VASCONCELLOS RIBEIRO;8;4731800;;'R SERRA DE BRAGANCA;336;LJ 30;TATUAPE;SP;SAO PAULO;;;;;5
7,15081E+11;ROSANA OLIVEIRA VIEIRA;8;4731800;RUA;JOAO VESSONI;30;;SAO MIGUEL PTA;SP;SAO PAULO;;;;;5
7,28166E+11;CORREIA & CORREIA LTDA;8;4731800;AVENIDA;SUMARE;1547;;PERDIZES;SP;SAO PAULO;;;;;5
7,31249E+11;PETROAZUL PAULISTA TRR LTDA;8;4731800;RUA;BERNARDINO DE CAMPOS;541;;VL MARIANA;SP;SAO PAULO;;;;;5
7,31318E+11;JOSE PAULO DARAIA;2;4731800;AVENIDA;DONA BELMIRA MARIN;1211;;GRAJAU;SP;SAO PAULO;;;;;1
7,35378E+11;AUTO POSTO ATOBA LTDA;8;4731800;RUA;BORBA GATO;680;;STO AMARO;SP;SAO PAULO;;;;;5
7,50606E+11;COMERCIO DE DERIVADOS DE PETROLEO SP MINAS LTDA;8;4731800;RUA;JOAO VELOSO FILHO;780;A;VL GUILHERME;SP;SAO PAULO;;;;;5
7,64948E+11;MARCELO ATTILIO GRACIA;8;4731800;RUA;BELA CINTRA;691;;CONSOLACAO;SP;SAO PAULO;;;;;5
7,68537E+11;VITARA POSTO DE SERVICOS LTDA;2;4731800;AVENIDA;CELSO GARCIA;3999;;TATUAPE;SP;SAO PAULO;;;;;5
7,76627E+11;ALBERTINO AUGUSTO MELO;8;4731800;AVENIDA;ELISEU DE ALMEIDA;1221;;JD A DE BARROS;SP;SAO PAULO;;;;;5
7,87742E+11;AUTO POSTO AIWA LTDA;2;4731800;AVENIDA;DAS CEREJEIRAS;1827;;JD JAPAO;SP;SAO PAULO;;;;;5
7,8874E+11;FORT PETRO POSTO DE SERVICOS LTDA;8;4731800;RUA;VERGUEIRO;6008;;PARAISO;SP;SAO PAULO;;;;;5
7,88741E+11;HERMELINDO POSTO DE SERVICOS LTDA;8;4731800;AVENIDA;SAO MIGUEL;5300;;ERM MATARAZZO;SP;SAO PAULO;;;;;5
8,15368E+11;AUTO POSTO PLATINA LTDA;8;4731800;ESTRADA;ITAQUERA A GUAIANAZES;1870;;GUAIANAZES;SP;SAO PAULO;;;;;5
8,33532E+11;AUTO POSTO CASARAO DA FACO LTDA;2;4731800;AVENIDA;GAL EDGAR FACO;1339;;PIQUERI;SP;SAO PAULO;;;;;5
8,38875E+11;JACANA-GUAPIRA COMERCIO DE PRODUTOS AUTOMOTIVOS LTDA;4;4731800;AVENIDA;GUAPIRA;1520;;JACANA;SP;SAO PAULO;;;;;1
8,43868E+11;AUTO POSTO CAMBUC LTDA;8;4731800;AVENIDA;LINS DE VASCONCELOS;494;;CAMBUCI;SP;SAO PAULO;;;;;5
8,4524E+11;FLAKRIST INFORMATICA LTDA;8;4731800;RUA;VUARAME;109;;JD SANTA MAR;SP;SAO PAULO;;;;;5
8,62978E+11;SUPERTIGRE COMERCIAL DE COMBUSTVEIS E TRANSPORTES LTDA;2;4731800;RUA;TENENTE CORONEL CARLOS DA SILVA;269;LOJA 22;SANTO AMARO;SP;SAO PAULO;;;;;1
8,67642E+11;VERA LUCIA WANSAUCHEKI;8;4731800;AVENIDA;DO ESTADO;4483;;CAMBUCI;SP;SAO PAULO;;;;;5
8,68063E+11;LAVAPETRO POSTO DE SERVICOS LTDA;8;4731800;AVENIDA;TUCURUVI;1106;;TUCURUVI;SP;SAO PAULO;;;;;5
8,80516E+11;LAGUNA AUTO POSTO LTDA;2;4731800;RUA;DR JOSE PEREIRA GOMES;681;;JD DAS OLIVEIRAS;SP;SAO PAULO;;;;;5
8,82025E+11;POSTO DE SERVICO PORTAL DA ANCHIETA LTDA;8;4731800;VIA;ANCHIETA;372;;IPIRANGA;SP;SAO PAULO;;;;;5
8,82054E+11;CANTINHO DO CEU AUTO POSTO III LIMITADA;4;4731800;RUA;CARLOS CALDEIRA FILHO;4401;;CIDE AUXILIADORA;SP;SAO PAULO;;;;;1
8,96976E+11;AUTO POSTO LIRIOS DO CAMPO LTDA;8;4731800;RUA;ALVARO RAMOS;2459;;AGUA RAZA;SP;SAO PAULO;;;;;5
9,08374E+11;POSTO DE SERVICOS ANASMAR LTDA;2;4731800;AVENIDA;VEREADOR JOSE DINIZ;2402;;CAMPO BELO;SP;SAO PAULO;;;;;5
9,08427E+11;PETROJOIA POSTO DE SERVICOS LTDA;8;4731800;AVENIDA;CRUZEIRO DO SUL;2025;;CARANDIRU;SP;SAO PAULO;;;;;5
9,15128E+11;ROMA DISTRIBUIDORA E TRANSPORTADORA DE PRODUTOS QUIMICOS LTDA;8;4731800;RUA;LYDIA FERRARI MAGNOLI;108;SALA 1206;JARDIM AVELINO;SP;SAO PAULO;;;;;5
9,28966E+11;RICARDO DEMETRIO BAEZ Y SANTANA;8;4731800;AVENIDA;ENG ARMANDO A PEREIRA;1646;;JABAQUARA;SP;SAO PAULO;;;;;5
9,32596E+11;COMERCIO E TROCA DE OLEO TAMBORELLO LTDA;2;4732600;RUA;PARAPUA;263;JUNTO AO N 263;FREGUESIA DO O;SP;SAO PAULO;;;;;3
9,40873E+11;AL&S SERVICOS E COM DE SUPRIMENTOS P/ INFORMATICA;4;4731800;RUA;DR GENTIL LET MARTINS;598;;JD PRUDENCIA;SP;SAO PAULO;;;;;1
9,47361E+11;AUTO POSTO SANTA FE DE INTERLAGOS LTDA;4;4731800;RUA;PROF HAIDEE S MARTINS;943;;INTERLAGOS;SP;SAO PAULO;;;;;1
9,52079E+11;AUTO POSTO NOVA TRABALHADORES C E S DE COMB E LUB LTDA;4;4731800;AVENIDA;NOVA TRABALHADORES;45;;ITAQUERA;SP;SAO PAULO;;;;;3
9,53328E+11;TRIANON POSTO DE SERVICOS LTDA;8;4731800;RUA;LAVAPES;884;;CAMBUCI;SP;SAO PAULO;;;;;5
9,53338E+11;POWER POSTO DE SERVICOS LTDA;8;4731800;RUA;VINTE E UM DE ABRIL;1050;;BELENZINHO;SP;SAO PAULO;;;;;5
9,61252E+11;AUTO POSTO COMPLEXO 2001 LTDA;8;4731800;RUA;EUGENIO FALK;393;;JDM PREVIDENCIA;SP;SAO PAULO;;;;;1
9,6491E+11;POSTO QUALITY LTDA;2;4731800;AVENIDA;VL EMA;3200;;VL EMA;SP;SAO PAULO;11 29502066;11 29502066;11 29502066;arfecontabil@terra.com.br;3
9,71181E+11;SERVICE CENTRO VILA MARIANA LTDA;2;4731800;RUA;DOMINGOS DE MORAES;853;;VL MARIANA;SP;SAO PAULO;11 25231815;;11 25231815;LEGALIZACAO@QUALICONTAX.COM.BR;3
9,81486E+11;CENTRO AUTOMOTIVO FORTE LTDA;4;4731800;ESTRADA;DO ALVARENGA;2234;;PEDREIRA;SP;SAO PAULO;;;;;5
9,84412E+11;AUTO POSTO ARINELLA LIMITADA;2;4731800;ESTRADA;DO CAMPO LIMPO;3735;;CAMPO LIMPO;SP;SAO PAULO;;;;;5
9,88755E+11;COMERCIO E SERVICOS DE BOMBAS INJETORAS B.J.LTDA;8;4731800;RUA;GUACURI;100;;CIDADE JULIA;SP;SAO PAULO;;;;;5
1,00246E+12;MGSYSTEMS INFORMATICA LTDA;8;4731800;RUA;COLATINA;293;;CID PATRIARCA;SP;SAO PAULO;;;;;5
1,00292E+12;IRMAOS MARGINI'S COMERCIO E SERVICOS LTDA;8;4731800;AVENIDA;SAO MIGUEL;2860;;VL FIDELIS RIBEIRO;SP;SAO PAULO;;;;;5
