7,25646E+12;MATHEUS BRANEMIR CAVACICH;4;4731800;AVENIDA;PIRES DO RIO;1932;;ITAQUERA;SP;SAO PAULO;;;;;5
7,25693E+12;POSTO DE SERVICOS KATATAU LTDA;4;4731800;RUA;VINTE E UM DE ABRIL;1413;;BRAS;SP;SAO PAULO;11 66980677;11 66980677;;orian@uol.com.br;1
7,29268E+12;INOQUIMICA INDUSTRIA E COMERCIO LTDA.;2;4732600;AVENIDA;DIEDERICHSEN;981;SALA 01;VILA GUARANI (Z SUL);SP;SAO PAULO;11 69653776;11 47891360;;OTAVIO@MARCONDESEPEREIRA.COM.BR;5
7,30218E+12;TOTAL AUTO SERVICOS LTDA;2;4731800;RUA;HEITOR PENTEADO;1645;;SUMARE;SP;SAO PAULO;;;;;1
7,30324E+12;AUTO POSTO NOVA JACUI LTDA;8;4731800;AVENIDA;JACU PESSEGO - NOVA TRABALHADORES;3301;;VILA JACUI;SP;SAO PAULO;;;;;1
7,30792E+12;MASTER-OIL DISTRIBUIDORA DE LUBRIFICANTES LTDA;8;4731800;RUA;FLAVIA;2;A;VILA CONSTANCA;SP;SAO PAULO;011 69869618;;011 69869618;ntccontab@terra.com.br;5
7,31339E+12;AUTO POSTO ESTRELA DA LINS LTDA;4;4731800;AVENIDA;LINS DE VASCONCELOS;1770;;CAMBUCI;SP;SAO PAULO;;;;;1
7,3184E+12;AUTO POSTO SUPER ANHANGUERA LTDA.;2;4731800;VIA;ANHANGUERA;KM 24;;VILA SULINA;SP;SAO PAULO;11 55062304;;11 55073764;conceitual@superig.com.br;5
7,31933E+12;AUTO POSTO NOVO IDEAL LTDA;2;4731800;RUA;MARIA CANDIDA;1850;;VILA GUILHERME;SP;SAO PAULO;;;;;5
7,32129E+12;NORDIK COMERCIO E PARTICIPACOES LTDA.;8;4731800;AVENIDA;SALIM FARAH MALUF;3400;;VILA BERTIOGA;SP;SAO PAULO;;;;;1
7,3241E+12;AUTO POSTO ESCOCIA LTDA;2;4731800;RUA;CHAFIC MALUF;381;;SANTO AMARO;SP;SAO PAULO;11 59046664;11 59046664;11 59046664;contar.fiscon@uol.com.br;5
7,34059E+12;AUTO POSTO BOMFIM LTDA;4;4731800;RUA;21 DE ABRIL;1050;;BRAS;SP;SAO PAULO;11 22951450;11 69536952;11 69536952;juliobiligao@hotmail.com;3
7,34136E+12;COMERCIO DE COMBUSTIVEIS E LUBRIFICANTES PEROLA NEGRA LTDA;2;4731800;AVENIDA;PROFESSOR CARDOSO DE MELO NETO;70;TERREO;PARQUE DOROTEIA;SP;SAO PAULO;11 20612300;11 20617849;11 59046664;POSTOPEROLENEGRA@GMAIL.COM;1
7,34438E+12;AUTO POSTO COLORS LTDA;4;4731800;RUA;FLORES DO PIAUI;14;;ITAQUERA;SP;SAO PAULO;;;;;3
7,34615E+12;FERA DO LIMAO SERVICOS AUTOMOTIVOS LTDA;3;4731800;AVENIDA;GASPAR VAZ DA CUNHA;215;;VILA SANTA MARIA;SP;SAO PAULO;;;;;5
7,34709E+12;AUTO POSTO DRIKAR LTDA;4;4731800;AVENIDA;MANDAQUI;389;;LIMAO;SP;SAO PAULO;;;;;1
7,36765E+12;TOSCA AUTO POSTO LTDA;8;4731800;AVENIDA;IMIRIM;2576;;IMIRIM;SP;SAO PAULO;;;;;1
7,36765E+12;AUTO POSTO TUGO LTDA;4;4731800;AVENIDA;ISABEL SCHMIDT;270;;SANTO AMARO;SP;SAO PAULO;11 32429010;11 32425893;;reparticoes@tormena.com.br;5
7,37886E+12;RUVIGAS COMERCIO VAREJISTA DE COMBUSTIVEIS E DERIVADOS DE PETROLEO LTDA.;2;4731800;RUA;BICUDO DE BRITO;150;;VILA GUARANI;SP;SAO PAULO;11 55032134;;11 55032134;contberrini@yahoo.com.br;1
7,37898E+12;POSTO PANAMBY LIMITADA;2;4731800;AVENIDA;GUIDO CALOI;661;;SANTO AMARO;SP;SAO PAULO;11 30549499;;;PAULO@BARROSDUTRA.COM.BR;5
7,38784E+12;AUTO POSTO EL PASSO LTDA;8;4731800;RUA;VISCONDE DE PARNAIBA;3178;;BRAS;SP;SAO PAULO;11 67837444;11 67837432;;;5
7,39047E+12;MAGNO DE LIMA REPRESENTACOES;4;4731800;ESTRADA;PIRAJUSSARA A VALO VELHO;1.157;;JD. MITSUTANI;SP;SAO PAULO;;;;;1
7,3958E+12;JM COMERCIO DE OLEOS LUBRIFICANTES EM GERAL LTDA;4;4731800;AVENIDA;VILA EMA;2610;;VILA EMA;SP;SAO PAULO;011 69119737;;;;5
7,40306E+12;AUTO POSTO ERINA LTDA;8;4731800;AVENIDA;SANTO AMARO;4545;;BROOKLIN PAULISTA;SP;SAO PAULO;11 55436006;;;;3
7,41596E+12;PORTAL DO BROOKLIN AUTO POSTO LTDA.;2;4731800;AVENIDA;SARGENTO GERALDO SANTANA;998;;BROOKLIN;SP;SAO PAULO;11 69141406;;11 69141406;oestrella@uol.com.br;1
7,42394E+12;AUTO POSTO AZZOLINI LTDA;2;4731800;RUA;DA CONSOLACAO;424;;CONSOLACAO;SP;SAO PAULO;;;;;5
7,43197E+12;AUTO POSTO BRASIL LTDA;2;4731800;AVENIDA;ZAKI NARCHI;1526;;CARANDIRU;SP;SAO PAULO;11 69584811;11 69584811;11 69584811;anderson@plumascontabil.com.br;5
7,43373E+12;ADECAR COMERCIO E SERVICOS AUTOMOTIVOS LTDA;2;4731800;RUA;IBITIRAMA;1359;;VILA PRUDENTE;SP;SAO PAULO;;;;;5
7,43567E+12;J F S SOARES;4;4731800;RUA;QUINTA DE SANTA LUZIA;123;CS6;JD PEDREIRA;SP;SAO PAULO;;;;;1
7,4357E+12;JARDIM NORTE POSTO DE SERVICOS & CONVENIENCIAS LTDA;2;4731800;RUA;PADRE JOAO GUALBERTO;701;;IMIRIM;SP;SAO PAULO;011 69502066;;;;5
7,43997E+12;AUTO POSTO CANCUN - INTERLAGOS LTDA.;8;4731800;AVENIDA;SENADOR TEOTONIO VILELA;410;;INTERLAGOS;SP;SAO PAULO;;;;;5
7,44175E+12;AUTO POSTO LIRITAPURA LTDA;2;4731800;RUA;MELO FREIRE;1232;;TATUAPE;SP;SAO PAULO;11 51819929;11 51819929;11 51822864;brasilton@hotmail.com;1
7,44361E+12;AR2 COMERCIO DE ADITIVOS LTDA;2;4732600;AVENIDA;VEREADOR ABEL FERREIRA;2603;;VILA REGENTE FEIJO;SP;SAO PAULO;11 99211632;;;ROBERTO@MAXYPOWER.COM;1
7,44672E+12;AUTO POSTO ORIBA LTDA;8;4731800;AVENIDA;PACAEMBU;406;;BARRA FUNDA;SP;SAO PAULO;;;;;5
7,44679E+12;AUTO POSTO RUDA LTDA;2;4731800;AVENIDA;PACAEMBU;469;;BARRA FUNDA;SP;SAO PAULO;;;;;5
7,45234E+12;AUTO POSTO TEIMOSINHO LTDA;8;4731800;AVENIDA;DO IMPERADOR;3804;;VILA JACUI;SP;SAO PAULO;;;;;5
7,45412E+12;AUTO POSTO AMAZON LTDA.;2;4731800;AVENIDA;VEREADOR JOAO DE LUCA;61;;JARDIM PRUDENCIA;SP;SAO PAULO;11 22137215;11 22169892;11 22164361;LOURENCOCONTABILIDADE@HOTMAIL.COM;3
7,46245E+12;HEROI DO OLEO COMERCIO DE LUBRIFICANTES LTDA;2;4732600;AVENIDA;ROLAND GARROS;1313;;JARDIM BRASIL;SP;SAO PAULO;;;;;1
7,46572E+12;THONYMAR-AZUL LAVA RAPIDO E ESTACIONAMENTO LTDA;2;4732600;RUA;SANTO AMARO;467;;BELA VISTA;SP;SAO PAULO;11 99037074;;;WILSON.JORGE44@GMAIL.COM;1
7,46844E+12;AUTO POSTO RECANTO DO GOLF LTDA.;8;4731800;AVENIDA;WASHINGTON LUIS;56A;;SANTO AMARO;SP;SAO PAULO;;;;;5
7,48357E+12;AUTO POSTO UNIAO DE SANTANA LTDA;4;4731800;AVENIDA;TUCURUVI;1016;;TUCURUVI;SP;SAO PAULO;;;;;1
7,54955E+12;CITY BELA VISTA SERVICOS AUTOMOTIVOS LTDA;8;4731800;RUA;MARIA JOSE;295;;BELA VISTA;SP;SAO PAULO;;;;;5
7,54956E+12;VILA ROMANA SERVICOS AUTOMOTIVOS LTDA;8;4731800;RUA;FAUSTOLO;962;;VILA ROMANA;SP;SAO PAULO;;;;;5
7,58859E+12;AUTO POSTO MARTINIANO LTDA;2;4731800;RUA;SANTA MADALENA;134;;BELA VISTA;SP;SAO PAULO;;;;;5
7,59101E+12;AUTO POSTO HEBREUS LTDA;8;4731800;ALAMEDA;2 SARGENTO FABIO PAVANI;94;;PARQUE NOVO MUNDO;SP;SAO PAULO;11 67837430;;;nbbcontabil@ig.com.br;5
7,59102E+12;MAXPODIUM BR COMERCIO E SERVICOS AUTOMOTIVOS E CONVENIENCIAS LTDA;4;4731800;AVENIDA;NOSSA SENHORA DO SABARA;2742;;VILA EMIR;SP;SAO PAULO;11 55723415;;011 50322498;totalauditoria@terra.com.br;1
7,59954E+12;SHEIK DO OLEO - SERVICOS E PECAS AUTOMOTIVAS LTDA;2;4732600;AVENIDA;ENGENHEIRO CAETANO ALVARES;1.820;;DO LIMAO;SP;SAO PAULO;11 78560616;11 64569099;11 39737800;mgaldi@hotmail.com.br;1
7,62785E+12;AUTO POSTO DOS PASSAROS LTDA;2;4731800;AVENIDA;POLITECNICA;5050;;RIO PEQUENO;SP;SAO PAULO;11 22959091;11 22959091;11 22959091;fabio@consultoriahera.com.br;5
7,65935E+12;AUTO POSTO VILA MONTE VERDE LTDA;4;4731800;RUA;PROFESSOR ALEXANDRE CORREIA;7;;JARDIM VITORIA REGIA;SP;SAO PAULO;11 59046664;11 59046664;11 59046664;CONTAR.CONTAR@UOL.COM.BR;5
7,66993E+12;SONIA REGINA AZARIAS PIRES;8;4731800;RUA;JORGE VELHO;31;;BOM RETIRO;SP;SAO PAULO;11 31044800;;;anto-sou@uol.com.br;1
7,67098E+12;TOP LUB IMPORTADORA E EXPORTADORA DE DERIVADOS DE PETROLEO LTDA;8;4731800;AVENIDA;JOAO DIAS;1371;SALA 01;SANTO AMARO;SP;SAO PAULO;;;;;1
7,67273E+12;CENTRO AUTOMOTIVO C.V.M LTDA;2;4731800;RUA;CAIO GRACO;263;;VILA ROMANA;SP;SAO PAULO;11 69502066;;11 69502066;ARFECONTABIL@TERRA.COM.BR;5
7,67495E+12;FORTSUL POSTO DE SERVICOS E CONVENIENCIAS LTDA;2;4731800;AVENIDA;MORVAN DIAS DE FIGUEIREDO;5479;C;VILA MARIA;SP;SAO PAULO;11 69544466;19 38065570;11 69544466;MURILLO.ORIAN@UOL.COM.BR;5
7,67499E+12;CENTRO AUTOMOTIVO ATLANTIS LTDA;2;4731800;AVENIDA;INTERLAGOS;5937;A;INTERLAGOS;SP;SAO PAULO;11 20239999;;;PLUMAS@PLUMASCONTABIL.COM.BR;5
7,67909E+12;AUTO POSTO INDEPENDENCIA DO CAMBUCI LTDA;2;4731800;RUA;DA INDEPENDENCIA;907;;CAMBUCI;SP;SAO PAULO;11 30549499;;11 59046664;SAC@CONTAR.CNT.BR;5
7,68049E+12;SANTA FE COMERCIO VAREJISTA DE COMBUSTIVEIS LTDA;2;4731800;RUA;LEOPOLDO DE PASSOS LIMA;292;;JARDIM SANTA FE;SP;SAO PAULO;11 59046664;11 47813109;;contar.jr@uol.com.br;5
7,68115E+12;AUTO POSTO SARAIVA LTDA;8;4731800;RUA;CONSELHEIRO SARAIVA;440;;SANTANA;SP;SAO PAULO;;;;;5
7,69245E+12;AUTO POSTO ADAMO LTDA;2;4731800;AVENIDA;ROBERT KENNEDY;4605;;INTERLAGOS;SP;SAO PAULO;11 51822577;11 51820885;11 51822577;SAOPAULO@SEDI.COM.BR;5
7,69511E+12;POSTO DE SERVICOS SANTA RITA DO MONTE AZUL LTDA;2;4731800;RUA;ESTRADA DE ITAPECERICA,;1422;;CAMPO LIMPO;SP;SAO PAULO;11 33150228;11 32294274;11 33150228;rosenirade@uol.com.br;5
7,69885E+12;ORLANDO NUNO FERNANDES;8;4731800;LARGO;DOS PINHEIROS;111;;PINHEIROS;SP;SAO PAULO;11 65453389;11 65460165;11 65460165;ottam@terra.com.br;1
7,70346E+12;AUTO POSTO G. A. COMERCIO DE COMBUSTIVEIS LTDA;8;4731800;AVENIDA;WASHINGTON LUIS;56;;SANTO AMARO;SP;SAO PAULO;11 78543250;;;carlosmarciomarques@yahoo.com.br;5
7,71731E+12;BRISTOL AUTO POSTO E SERVICOS LTDA.;2;4731800;AVENIDA;REGENTE FEIJO;639;;AGUA RASA;SP;SAO PAULO;11 21433811;11 21434433;11 21433811;SILVERIO@SILVERIO.COM.BR;5
7,72138E+12;POSTO AUTOMOTIVO SIQUEIRA LTDA;8;4731800;ESTRADA;DAS TAIPAS;1335;;PARQUE NACOES UNIDAS;SP;SAO PAULO;11 46674429;;;yotha@globo.com;1
7,72498E+12;MARIO DA SILVA JUNIOR;4;4731800;RUA;SAO JERONIMO DA SERRA;30;;VILA VARANDA;SP;SAO PAULO;11 66843923;11 66843923;11 66843923;gslcontabil@terra.com.br;5
7,72812E+12;AUTO POSTO DANSA LTDA;2;4731800;AVENIDA;DA ACLIMACAO;11;;ACLIMACAO;SP;SAO PAULO;11 69506556;;;modestus@ig.com.br;5
7,72863E+12;MAX DONALD ESTEVES;2;4732600;AVENIDA;SAO MIGUEL;3111;;VILA BUENOS AIRES;SP;SAO PAULO;11 26215473;;11 66219799;trevo.cont@terra.com.br;1
7,73171E+12;BOULEVARD-FARIA LIMA COMERCIO VAREJISTA DE COMBUSTIVEIS LTDA;8;4731800;AVENIDA;BRIGADEIRO FARIA LIMA;3825;;PINHEIROS;SP;SAO PAULO;11 5904664;11 62215852;;contar.contar@uol.com.br;5
7,73648E+12;A. LAURICELLA;8;4731800;RUA;JOAO TEODORO;284;;LUZ;SP;SAO PAULO;11 44129177;;11 44128825;contabil@contabilalvinopolis.com.br;1
7,75152E+12;CENTRO AUTOMOTIVO SUPER VERGUEIRO LTDA;4;4731800;RUA;VERGUEIRO;4999;TERREO;VILA MARIANA;SP;SAO PAULO;11 62166892;11 62137215;;beta4@terra.com.br;3
7,76689E+12;POSTO DE SERVICOS CAMBUI EIRELI;2;4731800;PRACA;DEPUTADO DARIO DE BARROS,;17;;CIDADE JARDIM;SP;SAO PAULO;11 33150228;;11 32294274;ORCONTSERVICOS@IG.COM.BR;5
7,76796E+12;AUTO POSTO VEJA LA LTDA.;4;4731800;AVENIDA;JOAO DIAS;1916;;SANTO AMARO;SP;SAO PAULO;11 50798439;;11 50798430;adm@helmarcontabil.com.br;5
7,81262E+12;COREL AUTO POSTO EIRELI;2;4731800;AVENIDA;ENGENHEIRO HEITOR ANTONIO EIRAS GARCIA;419;;JARDIM ESMERALDA;SP;SAO PAULO;11 37332704;11 29502066;11 37504111;ARFECONTABIL@TERRA.COM.BR;5
7,84575E+12;AUTO POSTO DUQUE WASHINGTON LUIS LTDA.;4;4731800;AVENIDA;WASHINGTON LUIS;5815;;AEROPORTO;SP;SAO PAULO;11 55723415;;;totalcontabil@hotmail.com;1
7,84577E+12;AUTO POSTO DUQUE GUAIANASES LTDA.;2;4731800;ESTRADA;DE POA;102;;GUAIANASES;SP;SAO PAULO;11 55723415;;;totalcontabil@hotmail.com;1
7,84654E+12;AUTO POSTO DUQUE ZAGOTTIS LTDA.;2;4731800;AVENIDA;ALBERTO DE ZAGOTTIS;567;;JURUBATUBA;SP;SAO PAULO;11 55723415;;;totalcontabil@hotmail.com;1
7,84654E+12;AUTO POSTO DUQUE BANDEIRANTES LTDA;2;4731800;RUA;CONCEICAO DE MONTE ALEGRE;1680;;BROOKLIN PAULISTA;SP;SAO PAULO;11 55723415;;;totalauditoria@terra.com.br;5
7,84655E+12;AUTO POSTO DUQUE PIRATININS LTDA.;2;4731800;ALAMEDA;DOS PIRATININS;534;;PLANALTO PAULISTA;SP;SAO PAULO;11 55723415;;;totalauditoria@terra.com.br;1
7,84655E+12;AUTO POSTO DUQUE REBOUCAS-I LTDA.;2;4731800;AVENIDA;REBOUCAS;2036;;PINHEIROS;SP;SAO PAULO;11 31732080;11 30878100;11 31732080;SELMA@GRUPODUQUE.COM.BR;1
7,84655E+12;AUTO POSTO DUQUE REBOUCAS-II LTDA.;4;4731800;AVENIDA;REBOUCAS;2083;;PINHEIROS;SP;SAO PAULO;11 55723415;;;totalcontabil@hotmail.com;1
7,84656E+12;AUTO POSTO DUQUE SALIM MALUF LTDA.;2;4731800;AVENIDA;SALIM FARAH MALUF;3400;;VILA BERTIOGA;SP;SAO PAULO;11 38863814;11 38865367;11 38869828;paralegal@grupopaodeacucar.com.br;1
7,84656E+12;AUTO POSTO DUQUE DUMONT VILLARES LTDA.;2;4731800;AVENIDA;LUIS DUMONT VILLARES;1422;;SANTANA;SP;SAO PAULO;11 30878100;11 31732080;;ANA.COLETO@REDEDUQUE.COM.BR;1
7,84656E+12;AUTO POSTO DOUTOR CESAR LTDA;8;4731800;RUA;DOUTOR CESAR;303;.;SANTANA;SP;SAO PAULO;11 59084120;11 59084120;11 59084120;societario@totalauditoria.com.br;1
7,84656E+12;AUTO POSTO DUQUE BERRINI LTDA.;2;4731800;AVENIDA;ENHGENHEIRO LUIS CARLOS BERRINI;1264;;BROOKLIN NOVO;SP;SAO PAULO;11 55723415;;;totalcontabil@hotmail.com;1
7,84656E+12;AUTO POSTO DUQUE AMARAL GURGEL LTDA.;4;4731800;RUA;AMARAL GURGEL;387;;VILA BUARQUE;SP;SAO PAULO;11 55723415;;;totalcontabil@hotmail.com;1
7,84657E+12;AUTO POSTO DUQUE IMPERADOR LTDA.;4;4731800;ESTRADA;DO IMPERADOR;18;;VILA VERDE;SP;SAO PAULO;11 55723415;;;totalcontabil@hotmail.com;1
7,84657E+12;AUTO POSTO DUQUE PERDIZES LTDA.;4;4731800;AVENIDA;FRANCISCO MATARAZZO;260;;PERDIZES;SP;SAO PAULO;11 55723415;;;totalcontabil@hotmail.com;1
7,84658E+12;AUTO POSTO DUQUE PIRITUBA LTDA;4;4731800;AVENIDA;RAIMUNDO PEREIRA DE MAGALHAES;6900;;PIRITUBA;SP;SAO PAULO;11 55723415;;;totalcontabil@hotmail.com;1
7,84658E+12;AUTO POSTO DUQUE LAPA LTDA.;2;4731800;PRACA;JACOMO ZANELA;154;;LAPA;SP;SAO PAULO;11 38863814;11 38865367;11 38869828;paralegal@grupopaodeacucar.com.br;1
7,84658E+12;AUTO POSTO DUQUE JK LTDA.;2;4731800;AVENIDA;JUSCELINO KUBISTCHECK;909;;CHACARA ITAIM;SP;SAO PAULO;11 55723415;;;totalauditoria@terra.com.br;1
7,84709E+12;AUTO POSTO NOVA JACU-PESSEGO LTDA;2;4731800;AVENIDA;JACU PESSEGO - NOVA TRABALHADORES;3301;;VILA JACUI;SP;SAO PAULO;11 69584811;;11 69584811;plumas@plumascontabil.com.br;1
7,85636E+12;BEM - BR AUTO POSTO LTDA;8;4731800;AVENIDA;SANTO AMARO;5327;;SANTO AMARO;SP;SAO PAULO;11 50936403;;11 50936401;LAFE@IG.COM.BR;1
7,86994E+12;POSTO GASPUR LTDA;8;4731800;AVENIDA;JOAO DIAS;3400;;SANTO AMARO;SP;SAO PAULO;11 51822577;;11 51820885;saopaulo@sedi.com.br;5
7,8835E+12;AUTO POSTO ESTRELA DA PAZ LTDA.;2;4731800;AVENIDA;DONA BELMIRA MARIN;4045;;PARQUE BRASIL;SP;SAO PAULO;11 56631076;;11 56681177;CA.1028@UOL.COM.BR;5
7,88627E+12;HL COMERCIO DE COMBUSTIVEIS LTDA;4;4731800;RUA;DR. LUIZ MIGLIANO;2100;;VILA ANDRADE;SP;SAO PAULO;11 56420963;;;contar.contar@uol.com.br;3
7,88828E+12;POSTO DE GASOLINA RIBEIRA LTDA.;2;4731800;AVENIDA;MAZZEI;732;;TUCURUVI;SP;SAO PAULO;11 62044422;11 69583504;11 69583504;gersoncassal@terra.com.br;1
7,89354E+12;GRAMADO POSTO DE SERVICOS E COMBUSTIVEIS LTDA;2;4731800;AVENIDA;PARADA PINTO;3280;;VL NOVA CACHOEIRINHA;SP;SAO PAULO;11 30352800;;;WAGNER.CARVALHO@POSTOSSETEE.COM.BR;5
8,03731E+12;AUTO POSTO COPENHAGUE LTDA;2;4731800;RUA;DIOGO MOREIRA;303;;PINHEIROS;SP;SAO PAULO;11 59046664;11 59046664;11 59046664;contar.fiscon@uol.com.br;5
8,04702E+12;AUTO POSTO TALARICO LTDA;4;4731800;AVENIDA;WALDEMAR CARLOS PEREIRA;1455;;VILA TALARICO;SP;SAO PAULO;11 61984673;11 61943470;;eascon@terra.com.br;1
8,08167E+12;POSTO VILLA LOBOS LTDA;2;4731800;RUA;GENERAL FURTADO NASCIMENTO;599;;ALTO DE PINHEIROS;SP;SAO PAULO;11 30878100;;;ANA.COLETO@REDEDUQUE.COM.BR;1
8,14876E+12;AUTO POSTO ARINELLA CENTRO LTDA;2;4731800;ALAMEDA;NOTHMANN;833;;CENTRO;SP;SAO PAULO;11 59046664;;;contar.contar@uol.com.br;5
8,16559E+12;AUTO POSTO CITY TABOAO LTDA;2;4731800;AVENIDA;ANTONIO SALLES PETEADO;52;;JARDIM TABOAO;SP;SAO PAULO;11 55062304;11 55062304;11 55073764;conceitual@superig.com.br;5
8,17984E+12;CENTRO AUTOMOTIVO AGUA ESPRAIADA LTDA;2;4731800;RUA;ZACARIAS DE GOES;628;;CAMPO BELO;SP;SAO PAULO;11 55062304;11 55062304;11 55073764;conceitual@superig.com.br;5
8,17999E+12;AUTO POSTO BRILHANTEX LIMITADA.;2;4731800;AVENIDA;NOSSA SENHORA DO SABARA;4.133;PARTE;VILA ANHANGUERA;SP;SAO PAULO;11 38751605;;;rodriguesdal@ig.com.br;5
8,20506E+12;REDE CAMPEAO POSTOS DE SERVICOS LTDA;8;4731800;RUA;GOMES DE CARVALHO;541;ESQ.RUA RIBEIRAO CLARO;VILA OLIMPIA;SP;SAO PAULO;11 36725500;11 55756651;11 38715576;signus@uol.com.br;5
8,2064E+12;ESTACAO DE SERVICOS AUTOMOTIVOS AMISTERDA LTDA.;2;4731800;AVENIDA;DR. PEREIRA VERGUEIRO;537;;VILA NHOCUNE;SP;SAO PAULO;11 49947299;;;praxis@praxiscontabil.com.br;5
8,20997E+12;G-10 ESTACAO DE SERVICOS AUTOMOTIVOS LTDA.;2;4731800;AVENIDA;CONSELHEIRO CARRAO;1624;;VILA CARRAO;SP;SAO PAULO;11 49947299;;;praxis@praxiscontabil.com.br;5
8,21004E+12;P-50 ESTACAO DE SERVICOS AUTOMOTIVOS LTDA.;2;4731800;AVENIDA;SAPOPEMBA;1790;;VILA PRUDENTE;SP;SAO PAULO;11 49947299;;;praxis@praxiscontabil.com.br;5
8,25312E+12;CENTRO AUTOMOTIVO SAO MANUEL I LTDA;4;4731800;AVENIDA;ATALIBA LEONEL;3714;;PARADA INGLESA;SP;SAO PAULO;11 67837430;;;nbbcontabil@ig.com.br;3
8,25638E+12;SENHORA DE APARECIDA LAGUNA AUTO POSTO LTDA;2;4731800;RUA;PONTE RASA;226;;JARDIM PONTE RASA;SP;SAO PAULO;11 63459966;11 63459633;11 63459966;tropper@terra.com.br;1
8,26897E+12;AMANDA RAMOS MARQUES;2;4732600;RUA;HEITOR PENTEADO;930;;SUMAREZINHO;SP;SAO PAULO;11 38771142;;;contabilhidalgo@yahoo.com.br;1
8,2882E+12;AUTO POSTO CAR 10 LTDA;4;4731800;AVENIDA;SANTO AMARO;3521;;SANTO AMARO;SP;SAO PAULO;11 29419494;11 29419494;11 69419494;carla.mortari@uol.com.br;1
8,29461E+12;M.P.A. COMERCIO DE LUBRIFICANTES EIRELI;2;4732600;RUA;ABILIO PEDRO RAMOS;208;;VILA NILO;SP;SAO PAULO;11 34354846;;11 69098690;barranco.pires@terra.com.br;1
8,30511E+12;GIUSEPPE ANTONIO PINGARO;4;4732600;RUA;DA BOLSA;19;A;VILA BANCARIA;SP;SAO PAULO;11 61066490;11 61064389;;megamultipla@megamultipla.com.br;3
8,31663E+12;CARLOS ALBERTO PAPACIDERO;2;4731800;AVENIDA;PROFESSOR CELESTINO BOURROUL;34;;LIMAO;SP;SAO PAULO;11 55723415;;;totalauditoria@terra.com.br;5
8,31663E+12;CARLOS ALBERTO PAPACIDERO;8;4731800;AVENIDA;ASSIS CHATEAUBRIAND;2212;;PARQUE ANHEMBI;SP;SAO PAULO;11 39515942;11 69791818;11 39512682;contar.contar@uol.com.br;5
8,32623E+12;CENTRO AUTOMOTIVO MONTE MORIAH LTDA;8;4731800;AVENIDA;DO ORATORIO;221;;JARDIM INDEPENDDENCIA;SP;SAO PAULO;11 61911464;;;cartel.seguros@uol.com.br;3
8,33909E+12;CENTRO AUTOMOTIVO CASTHELLARI LTDA;2;4731800;AVENIDA;OURO VERDE DE MINAS;2075;;JARDIM IMPERADOR;SP;SAO PAULO;11 69141406;;11 69141406;oestrella@uol.com.br;5
8,33957E+12;FUEL EVOLUTION AUTO POSTO LTDA;2;4731800;AVENIDA;PAES DE BARROS;2381;;MOOCA;SP;SAO PAULO;11 50411170;;11 55316168;conceitual@superig.com.br;1
8,35188E+12;AUTO POSTO PALERMO LTDA;2;4731800;AVENIDA;AGENOR COUTO DE MAGALHOES;1825;;PIRITUBA;SP;SAO PAULO;11 66843923;;11 66843923;gslcont@terra.com.br;3
8,38522E+12;AUTO POSTO FLECHA DOURADA LTDA;2;4731800;AVENIDA;MARECHAL TITO;347;------;SAO MIGUEL PAULISTA;SP;SAO PAULO;11 20612300;11 20617849;0 0;POSTOFLECHADOURADA@GMAIL.COM;5
8,41045E+12;POSTO CAMPANA DORATO LTDA;2;4731800;AVENIDA;INTERLAGOS;3429;;SANTO AMARO;SP;SAO PAULO;11 55723415;;;MURILLO.ORIAN@UOL.COM.BR;5
8,44224E+12;AUTO POSTO JOSE MARIA LISBOA LTDA;2;4731800;AVENIDA;NOVE DE JULHO;3062;;JARDIM PAULISTA;SP;SAO PAULO;11 69593997;11 31074627;11 31011326;orian@uol.com.br;5
8,46526E+12;AUTOPOSTO ABRAAO RIBEIRO LTDA;8;4731800;AVENIDA;DOUTOR ABRAAO RIBEIRO;119;;BARRA FUNDA;SP;SAO PAULO;11 69500344;;;eskala@eskalaengenharia.com.br;5
8,47796E+12;MARIA CELINA DE ARAUJO GARCIA - COMBUSTIVEIS;8;4731800;AVENIDA;CONSELHEIRO CARRAO;1134;;VILA CARRAO;SP;SAO PAULO;11 22950279;11 61972492;11 22950279;ac.marcond@ig.com.br;1
8,47903E+12;AUTO POSTO TAKATA LTDA;2;4731800;AVENIDA;PIRES DO RIO;1856;;JARDIM SAO SEBASTIAO;SP;SAO PAULO;11 61520116;;;aptakata@terra.com.br;5
8,49347E+12;IAP IDEAL AUTO POSTO LTDA;4;4731800;AVENIDA;CELSO GARCIA;4314;;TATUAPE;SP;SAO PAULO;11 64086698;;;danieljose@terra.com.br;1
8,51636E+12;PARIS CENTRO AUTOMOTIVO E DE CONVENIENCIAS LTDA.;4;4731800;ESTRADA;DO CAMPO LIMPO;434;;VILA PREL;SP;SAO PAULO;11 69193533;11 69623993;;jamila.contabe@ig.com.br;5
8,52056E+12;AUTO POSTO ALVORADA PAULISTA LTDA;2;4731800;AVENIDA;ORDEM E PROGRESSO;56;;BARRA FUNDA;SP;SAO PAULO;11 69764007;;11 62817327;contabilidade@carvalhomachado.com.br;5
8,52057E+12;AUTO POSTO VILA CAMPO BELO LTDA.;2;4731800;RUA;DAVID BEM GURION;49;;VILA CAMPO BELO;SP;SAO PAULO;11 50798430;11 50798439;11 50798430;ADM@HELMARCONTABIL.COM.BR;5
8,53028E+12;AUTO POSTO POINT LTDA;2;4731800;RUA;DA MOOCA;3.622;;MOOCA;SP;SAO PAULO;11 69584811;11 69584811;;PLUMAS@PLUMASCONTABIL.COM.BR;3
8,54683E+12;HIROTA AUTO POSTO & SERVICOS LTDA.;2;4731800;RUA;GASPAR FERNANDES;416;;VILA MONUMENTO;SP;SAO PAULO;11 61665300;11 22748988;11 22748988;ctb@contped.com.br;3
8,55291E+12;CENTRO AUTOMOTIVO MADRI LTDA;2;4731800;RUA;ORFANATO;1074;;VILA PRUDENTE;SP;SAO PAULO;11 62921000;;;luciano@grupomcfernandes.com.br;5
8,57416E+12;AUTO POSTO ORVIETO LTDA;2;4731800;RUA;MARIA LUCIA DUARTE;891;;VILA PIRITUBA;SP;SAO PAULO;11 59084120;11 55723415;11 55723415;SOCIETARIO@TOTALAUDITORIA.COM.BR;3
8,60467E+12;FORMULA I AUTO POSTO LTDA.;2;4731800;RUA;ALEXANDRE DUMAS;1369;;CHACARA SANTO ANTONIO;SP;SAO PAULO;11 55241555;11 55216265;11 55216265;pedro projeta@yool.com.br;5
8,61899E+12;AUTO POSTO FASCINACAO DA ZONA LESTE LTDA;2;4731800;AVENIDA;MONTEMAGNO;460;;VILA FORMOSA;SP;SAO PAULO;11 26714155;11 26764155;;ATENDIMENTO@POSTOFASCINACAO.COM.BR;3
8,6313E+12;CENTRO AUTOMOTIVO NOVO JF LTDA;4;4731800;AVENIDA;SAPOPEMBA;6522;BOXE 1;VILA PRIMAVERA;SP;SAO PAULO;11 6292100;;;soclaudine@terra.com.br;3
8,6438E+12;AUTO POSTO FRANCISCO MESQUITA LTDA;2;4731800;AVENIDA;DR FRANCISCO MESQUITA;917;N 985;QUITANDA DA PAINEIRA;SP;SAO PAULO;11 51819929;11 51819929;;totalauditoria@terra.com.br;3
8,64808E+12;POSTO DE SERVICOS GUAIMIM LTDA;2;4731800;RUA;MANUEL FERREIRA LOPES;19;;VILA NOSSA SENHORA APARECIDA;SP;SAO PAULO;11 66954046;11 39314787;11 39314797;genesiscontabil@superig.com.br;5
8,6531E+12;LIDER DA PENHA AUTO POSTO LTDA;2;4731800;AVENIDA;AMADOR BUENO DA VEIGA;1026;;PENHA;SP;SAO PAULO;11 27837430;11 27828213;11 25231815;BBASSESSORIACONTABIL@GMAIL.COM;3
8,65734E+12;PORTAL DO JAGUARE AUTO POSTO LTDA.;4;4731800;AVENIDA;JAGUARE;1112;;JAGUARE;SP;SAO PAULO;11 67435306;11 74749004;11 67433425;escuridinho@hotmail.com;3
8,6602E+12;POSTO DE COMBUSTIVEIS E LUBRIFICANTES ALVARO RAMOS LTDA;2;4731800;AVENIDA;ALVARO RAMOS;833;;BELENZINHO;SP;SAO PAULO;11 21433811;11 21434433;11 21434433;SILVERIO@SILVERIO.COM.BR;5
8,68221E+12;AUTO POSTO SHALLON ADONAI LTDA.;2;4731800;RUA;QUINTA DA MAGNOLIA;404;;JARDIM IPANEMA;SP;SAO PAULO;11 69141406;11 69141406;11 69141406;oestrella@uol.com.br;1
8,68716E+12;IVANA GARDEN AUTO POSTO LTDA.;4;4731800;AVENIDA;POLITECNICA;2555;;JAGUARE;SP;SAO PAULO;11 67435306;11 74749004;11 67433425;nbbcontabil@ig.com.br;5
8,7158E+12;KAPOR AUTO POSTO DE SERVICOS LTDA;8;4731800;AVENIDA;CASA VERDE;3332;;CASA VERDE;SP;SAO PAULO;11 69502066;;11 69502066;ARFECONTABIL@TERRA.COM.BR;5
8,71927E+12;AUTO POSTO NOVA RADIAL LTDA;2;4731800;RUA;RIO BOM;S/N;;VILA PROGRESSO;SP;SAO PAULO;11 20581978;11 20581979;11 29564667;DA_COSTA@UOL.COM.BR;5
8,72037E+12;JOSE ADILSON NETO;4;4732600;RUA;CABO ANTONIO ALVES;50;A;PARQUE NOVO MUNDO;SP;SAO PAULO;11 29542328;;11 29672644;TORRE@TORRECONTABILIDADE.COM.BR;1
8,7335E+12;CASA DO OLEO SOUZA & LIMA LTDA;2;4732600;AVENIDA;WASHINGTON LUIS;945;;JARDIM MARAJOARA;SP;SAO PAULO;11 38041889;;11 36213672;CONTATO@CASTELODOOLEO.COM.BR;1
8,73773E+12;ACAUA - COMERCIO VAREJISTA DE COMBUSTIVEIS LTDA;8;4731800;AVENIDA;ERMANO MARCHETTI;1044;;LAPA;SP;SAO PAULO;11 55482155;11 91777424;;kijai@bol.com.br;3
8,74074E+12;ANUBIS SERVICOS AUTOMOTIVOS LTDA .;2;4731800;AVENIDA;REBOUCAS;701;;CERQUEIRA CESAR;SP;SAO PAULO;11 38848884;;;jajlopes@ig.com.br;5
8,76016E+12;Z-VINTE E UM AUTO POSTO LTDA.;8;4731800;AVENIDA;SANTO AMARO;2093;;SANTO AMARO;SP;SAO PAULO;11 22961035;;11 22961035;contamax@sili.com.br;5
8,78196E+12;M.I. COMERCIO DE FILTROS E LUBRIFICANTES LTDA;2;4732600;ALAMEDA;AFONSO SCHMIDT;828;;SANTA TEREZINHA;SP;SAO PAULO;11 66062750;11 66062887;11 66062889;acsilva@ecb.com.br;1
8,7833E+12;Z-VINTE E TRES AUTO POSTO LTDA.;8;4731800;AVENIDA;INTERLAGOS;2035;;INTERLAGOS;SP;SAO PAULO;11 30539999;11 56317431;11 30539999;contabilidade@grascon-cont.com.br;5
8,78904E+12;AUTO POSTO MONT ALVERNE LTDA;8;4731800;AVENIDA;ARICANDUVA;1555;;VILA ARICANDUVA;SP;SAO PAULO;11 50310555;;;metropolitana@metropolitana.srv.br;1
8,80226E+12;COMERCIO VAREJISTA DE COMBUSTIVEIS LUMAR TAIPAS LTDA;2;4731800;AVENIDA;RAIMUNDO PEREIRA DE MAGALHAES;11823;;CITY JARAGUA;SP;SAO PAULO;11 29502066;;11 36213672;ARFECONTABIL@TERRA.COM.BR;5
8,8078E+12;ATLANTICA AUTO POSTO E CONVENIENCIA LTDA;2;4731800;AVENIDA;GENERAL OLIMPIO DA SILVEIRA;309;;SANTA CECILIA;SP;SAO PAULO;11 21433811;11 21434433;11 21433811;SILVERIO@SILVERIO.COM.BR;5
8,81367E+12;COMERCIO VAREJISTA DE COMBUSTIVEIS SUCESSO LTDA.;2;4731800;AVENIDA;ENGENHEIRO ARMANDO DE ARRUDA PEREIRA;1646;;JABAQUARA;SP;SAO PAULO;11 59046664;;11 59046664;contar.jr@uol.com.br;3
8,81989E+12;DE ARAUJO E BULARA LTDA;2;4732600;RUA;GONCALO DA CUNHA,;42;;CHACARA INGLESA;SP;SAO PAULO;11 37420942;11 37420942;11 37420942;eneiasfaria@hotmail.com;1
8,8278E+12;CENTRO AUTOMOTIVO COMPLEXO 2001 LTDA;2;4731800;AVENIDA;PRESIDENTE TANCREDO NEVES;1600;;VILA NANCY;SP;SAO PAULO;11 62921000;;;cacomplexo20021@terra.com.br;5
8,84157E+12;AUTO POSTO BANDEIRA ROCHA LTDA;2;4731800;AVENIDA;PARANAGUA;2122;;ERMELINO MATARAZZO;SP;SAO PAULO;11 31074627;11 31074627;11 31011326;orian@uol.com.br;3
8,84724E+12;AUTO POSTO ZURICK - EIRELI;2;4731800;AVENIDA;ARICANDUVA;1630;;VILA MANCHESTER;SP;SAO PAULO;11 22272121;11 76421468;11 22272121;gdezltda@hotmail.com;1
8,85101E+12;REINADO COMERCIO E SERVICOS DE LUBRIFICANTES LTDA;2;4732600;RUA;CLODOMIRO AMAZONAS;1225;;ITAIM BIBI;SP;SAO PAULO;11 56614599;11 56635785;11 56635785;contabilidademelo@bol.com.br;1
8,85736E+12;XINGUI-LING MERCADAO AUTO POSTO LTDA.;4;4731800;AVENIDA;DO ESTADO;2411;;BOM RETIRO;SP;SAO PAULO;11 74749004;;;escuridinho@hotmail.com;5
8,85982E+12;SERVICOS AUTOMOTIVOS PEDRODAVI LTDA;2;4731800;RUA;PAULO ANDRIGHETTI;1484;1688;PARI;SP;SAO PAULO;11 25231815;11 25231815;11 25231815;FALECONOSCO@QUALICONTAX.COM.BR;5
8,87718E+12;AUTO POSTO AGULHAS NEGRAS LTDA;2;4731800;AVENIDA;VINTE E TRES DE MAIO;3115;;VILA MARIANA;SP;SAO PAULO;11 55712555;;11 50629199;rose@meritor.com.br;1
8,87728E+12;AUTO POSTO ROSSI LTDA;2;4731800;AVENIDA;MIGUEL DE CASTRO;1210;;JD CIDADE PIRITUBA;SP;SAO PAULO;11 39745300;;11 68425001;externos@qualitycontabil.com.br;5
8,88363E+12;IGLOOTEC COSMETICOS E LUBRIFICANTES LTDA;2;4732600;RUA;JACOBUS BALDI;105;SALA 05;JARDIM FIM DE SEMANA;SP;SAO PAULO;11 55136892;;11 55136892;ualuna.lub@gmail.com;1
8,90087E+12;POTENZA AUTO POSTO LTDA;4;4731800;AVENIDA;SANTO AMARO;5327;;SANTO AMARO;SP;SAO PAULO;11 69502066;;11 69502066;arfecontabil@terra.com.br;1
