4,89485E+13;AUTO POSTO PONTE RASA LTDA;8;4731800;AVENIDA;SAO MIGUEL;4681;;ERMELINDO MATARAZZO;SP;SAO PAULO;;;;;5
4,8953E+13;AUTO POSTO VANIA LTDA;8;4731800;RUA;ARNALDO CINTRA;106;;VL MOREIRA;SP;SAO PAULO;;;;;5
4,89565E+13;AUTO POSTO MITSUOKA LTDA;8;4731800;AVENIDA;CONS CARRAO;2500;;VL CARRAO;SP;SAO PAULO;;;;;5
4,89567E+13;AUTO POSTO GUARARAPES LTDA;2;4731800;AVENIDA;PARAGUASSU PAULISTA;351;;CID PATRIARCA;SP;SAO PAULO;11 21158899;11 21158899;11 21158899;;5
4,90796E+13;PRESTSERV AUTO POSTO LTDA;4;4731800;AVENIDA;COM SANTANA;153;;CAPAO REDONDO;SP;SAO PAULO;;;;;5
4,90832E+13;PRESIDENTE GASOLINA E LUBRIFICANTES LTDA;8;4731800;AVENIDA;JOSE MARIA FERNANDES;958;;PARQUE NOVO MUNDO;SP;SAO PAULO;;;;;5
4,92557E+13;EQUIPE II AUTO POSTO LTDA;8;4731800;RUA;FRANCISCO REBELO;210;;VL CALIFORNIA;SP;SAO PAULO;;;;;1
4,92741E+13;AUTO POSTO COLEGIO LTDA;4;4731800;ESTRADA;DE ITAPECERICA;5100;;SANTO AMARO;SP;SAO PAULO;;;;;1
4,92792E+13;HELIO AQUILA;8;4731800;RUA;JORGE VELHO;31;;LUZ;SP;SAO PAULO;;;;;5
4,92802E+13;LUCAR AUTO POSTO LTDA;8;4731800;RUA;AMERICO BRASILIENSE;2280;;SANTO AMARO;SP;SAO PAULO;;;;;5
4,92921E+13;AUTO POSTO SAO VALENTIM LTDA;8;4731800;AVENIDA;AUGUSTO BARBOSA TAVARES;1080;;JD LEME;SP;SAO PAULO;;;;;5
4,92925E+13;CARINHOSO AUTO POSTO LIMITADA;4;4731800;;V ANHANGUERA;1500;;PIRITUBA;SP;SAO PAULO;;;;;1
4,92943E+13;AUTO POSTO DETROIT LTDA.;8;4731800;RUA;MONTEIRO DE MELO;279;;LAPA;SP;SAO PAULO;;;;;5
4,92948E+13;SEBASTIAO MALVEZ;8;4731800;RUA;EURIDICE BUENO;56;;VL BRASILANDIA;SP;SAO PAULO;;;;;5
4,93002E+13;CENTREVILLE SERVICOS AUTOMOTIVOS LIMITADA;2;4731800;RUA;CERRO CORA;1095;;VILA ROMANA;SP;SAO PAULO;;;;;5
4,93005E+13;AUTO POSTO RIO DO OURO LTDA;2;4731800;RUA;GUAIPA;1333;;VILA LEOPOLDINA;SP;SAO PAULO;;;;;5
4,93099E+13;AUTO POSTO PAULA FERREIRA LTDA;2;4731800;AVENIDA;PAULA FERREIRA;1397;;VILA BONILHA;SP;SAO PAULO;11 59046664;11 59046664;11 59046664;contar.contar@uol.com.br;5
4,93107E+13;AUTO POSTO RAMAL LTDA;2;4731800;AVENIDA;EMB MACEDO SOARES;6000;;VL ANASTACIO;SP;SAO PAULO;;;;;5
4,93226E+13;AUTO POSTO DOM DIEGO LTDA;8;4731800;RUA;DO LAVAPES;884;;CAMBUCI;SP;SAO PAULO;;;;;5
4,93332E+13;H JORDAO;8;4731800;AVENIDA;DO ESTADO;4483;;CENTRO;SP;SAO PAULO;;;;;5
4,93334E+13;POSTO DE SERVICOS SAO NICOLAU LTDA;8;4731800;AVENIDA;PRESTES MAIA;656;;STA EFIGENIA;SP;SAO PAULO;;;;;5
4,93334E+13;S GIORGETTI;8;4731800;RUA;TUTOIA;372;;VILA MARIANA;SP;SAO PAULO;;;;;5
4,93334E+13;S GIORGETTI;8;4731800;RUA;VERGUEIRO;1694;;VILA MARIANA;SP;SAO PAULO;;;;;5
4,93372E+13;AUTO POSTO NONINHA LTDA;2;4731800;RUA;DA CONSOLACAO;785;;CONSOLACAO;SP;SAO PAULO;;;;redenoninha@hotmail.com;3
4,93396E+13;AUTO POSTO ANGOLA LTDA;8;4731800;RUA;MANOEL DUTRA;288;;BELA VISTA;SP;SAO PAULO;;;;;5
4,93419E+13;SERVICENTRO ESSO ORATORIO LTDA;8;4731800;RUA;DO ORATORIO;625;;MOOCA;SP;SAO PAULO;;;;;5
4,9365E+13;R & V PRESENTES DECORACOES E INTERIORES LTDA;8;4731800;AVENIDA;9 DE JULHO;4024;FUNDOS;JD PAULISTA;SP;SAO PAULO;;;;;5
4,93664E+13;ANEZIO FERREIRA PINTO;4;4731800;RUA;GUARAPIRANGA;280;;SANTO AMARO;SP;SAO PAULO;;;;;1
4,9367E+13;POSTO DE SERVICOS LUBE LTDA;2;4731800;ALAMEDA;LORENA;415;;JARDIM PAULISTA;SP;SAO PAULO;;;;;1
4,93966E+13;LUBRASIL LUBRIFICANTES LTDA;8;4731800;RUA;BRAGANCA PAULISTA;832;;VARZEA DE BAIXO;SP;SAO PAULO;;;;;5
4,94684E+13;BUGRAO AUTO POSTO LTDA;8;4731800;RUA;AMERICO SAMARONE;71;;VL MOINHO VELHO;SP;SAO PAULO;;;;;5
4,94701E+13;POSTO DE SERVICOS VIVIANE LTDA;8;4731800;AVENIDA;RIO DAS PEDRAS;4315;;JARDIM NOVE JULHO;SP;SAO PAULO;;;;;5
4,94728E+13;SERVEBEM AUTO POSTO LTDA;8;4731800;RUA;CECILIA CALOVINI;406;;JARDIM SAO JOSE;SP;SAO PAULO;;;;;5
4,94739E+13;VM COM DE OLEOS LUBRIFICANTES E ACES P/ AUTOS LTDA;4;4731800;RUA;CAETES;650;;VL MARIA;SP;SAO PAULO;;;;;1
4,94753E+13;JUSTINO BARBOSA GERALDO;8;4731800;RUA;LUIS PACHECO;168;FUNDOS;S IFIGENIA;SP;SAO PAULO;;;;;1
4,94958E+13;AUTO POSTO ESTRELA DO LESTE EIRELI;2;4731800;RUA;GALILEU MENON;95;;VL RE;SP;SAO PAULO;;;;;5
4,95013E+13;AUTO POSTO OPEPE LTDA;8;4731800;RUA;MARIA CORUPAITI;914;;CASA VERDE;SP;SAO PAULO;;;;;5
4,95091E+13;OFICINA PLANALTO LTDA;8;4731800;ALAMEDA;GLETE;741;;CAMPOS ELISEOS;SP;SAO PAULO;;;;;5
4,95141E+13;TEST CAR AUTO POSTO LTDA;4;4731800;AVENIDA;OLAVO FONTOURA;S/N;;SANTANA;SP;SAO PAULO;;;;;1
4,95145E+13;BEIRA RIO COMERCIO E REPRESENTACOES LTDA;8;4731800;RUA;PAULO ANDRIGHETTI;1484;;CATUMBI;SP;SAO PAULO;;;;;5
4,95151E+13;KNOW GAS MANUTENCAO E DISTRIBUICAO LTDA;8;4731800;AVENIDA;CRUZEIRO DO SUL;255;;PONTE PEQUENA;SP;SAO PAULO;;;;;5
4,95168E+13;AUTO POSTO CARRILHAO LTDA;8;4731800;AVENIDA;GUILHERME;1107;;VILA GUILHERME;SP;SAO PAULO;;;;;5
4,95179E+13;AUTO POSTO MOCO LTDA;8;4731800;RUA;CARNOT;486;;PARI;SP;SAO PAULO;;;;;3
4,95186E+13;RENATO HOSSEPIAN SALLES LIMA AUTO POSTO;8;4731800;RUA;JOAO TEODORO;1248;;BRAS;SP;SAO PAULO;;;;;5
4,95573E+13;FLOR DE GOIAS LUBRIFICANTES LTDA;8;4732600;RUA;ARRABALDE DA PONTE;17;;VILA ARISI;SP;SAO PAULO;11 49947299;;;praxis@praxiscontabil.com.br;1
4,96414E+13;FURACAO AUTO SERVICOS LTDA;8;4731800;AVENIDA;CANGAIBA;22;;PENHA;SP;SAO PAULO;;;;;5
4,97035E+13;AUTO POSTO MENCOROSSI LTDA;2;4731800;AVENIDA;AIRTON PRETINI;43;;PENHA;SP;SAO PAULO;118502037;;118507798;;1
4,97371E+13;AUTO POSTO SAO FELIPE LTDA;8;4731800;AVENIDA;PROF FRANCISCO MORATO;4944;;VILA SONIA;SP;SAO PAULO;;;;;5
4,97414E+13;CABECA BRANCA AUTO POSTO LTDA;8;4731800;AVENIDA;WASHINGTON LUIS;270;;SANTO AMARO;SP;SAO PAULO;;;;;1
4,9745E+13;DIVINO SERVICOS AUTOMOTIVOS LTDA;2;4731800;AVENIDA;DIVINO SALVADOR;245;;PLANALTO PAULISTA;SP;SAO PAULO;;;;;5
4,97554E+13;ANTONIO CARLOS VERTUANE DA SILVA;8;4731800;AVENIDA;WASHINGTON LUIS;4604;;AEROPORTO;SP;SAO PAULO;;;;;1
4,97754E+13;AUTO POSTO JOVEM CAR LTDA;8;4731800;RUA;SILVA BUENO;2727;;IPIRANGA;SP;SAO PAULO;;;;;1
4,97844E+13;MARCELO CENTER POSTO E SERVICOS LTDA;8;4731800;RUA;LUIS GOIS;163;;MIRANDOPOLIS;SP;SAO PAULO;;;;;5
4,97848E+13;AUTO POSTO MOINHO VELHO LIMITADA;2;4731800;RUA;CAMINHO DO ENGENHO;655;;FERREIRA;SP;SAO PAULO;;;;;5
4,9789E+13;SERGIO LUIS GOMES;8;4731800;RUA;BALTAR;258;;VL CALIFORNIA;SP;SAO PAULO;;;;;5
4,98228E+13;EUNICE BORETTI PACHECO;8;4731800;AVENIDA;MATEO BEI;1409;;CID SAO MATHEUS;SP;SAO PAULO;;;;;5
4,98295E+13;LAVA RAPIDO E TROCA DE OLEO AMIGOS LTDA;8;4731800;RUA;SAO LUCIANO;56;;JD COLORADO;SP;SAO PAULO;;;;;5
4,98299E+13;AUTO POSTO MIRANDINHA LTDA;4;4731800;AVENIDA;AMADOR BUENO DA VEIGA;816;;PENHA;SP;SAO PAULO;;;;;5
4,98319E+13;AUTO POSTO MOGIANA LTDA;4;4731800;RUA;ATALHO DA MOGIANA;197;;SAO MIGUEL PAULISTA;SP;SAO PAULO;;;;;3
4,98696E+13;SERVICOS AUTOMOTIVOS SANTO ANTONIO LTDA;8;4731800;AVENIDA;JUNTAS PROVISORIAS;969;;IPIRANGA;SP;SAO PAULO;;;;;5
4,98736E+13;AUTO POSTO PELICANO LTDA;4;4731800;RUA;DR CESAR;303;;SANTANA;SP;SAO PAULO;;;;;1
4,99205E+13;AUTO POSTO MARLICE LTDA;2;4731800;AVENIDA;ITAQUERA;2407;;VL TALARICO;SP;SAO PAULO;;;;;5
4,9922E+13;POSTO DE SERVICO NORMANDI LTDA;2;4731800;AVENIDA;MOREIRA GUIMARAES;1019;;INDIANOPOLIS;SP;SAO PAULO;11 59084120;;;SOCIETARIO@TOTALAUDITORIA.COM.BR;1
4,99268E+13;AMERICAN AUTO POSTO LTDA;8;4731800;RUA;ARAUJO;376;;VL BUARQUE;SP;SAO PAULO;;;;;5
4,9929E+13;ZAIDEN PARK COMERCIAL LTDA;8;4731800;RUA;BUENO DE ANDRADE;740;;ACLIMACAO;SP;SAO PAULO;;;;;5
4,99293E+13;POSTO METRO VERGUEIRO LTDA;4;4731800;RUA;DOMINGOS DE MORAIS;1191;;VL MARIANA;SP;SAO PAULO;;;;;1
4,994E+13;AGEA AUTO POSTO LIMITADA;8;4731800;AVENIDA;RANGEL PESTANA;944;A 978;BRAS;SP;SAO PAULO;;;;;5
4,99415E+13;POSTO DE SERVICO JARDIM DAS OLIVEIRAS LTDA;4;4731800;AVENIDA;MIGUEL ESTEFNO;2750;;BOSQUE DA SAUDE;SP;SAO PAULO;;;;;1
4,99422E+13;ALFREDO AUGUSTO RODRIGUES PIUNCA;8;4731800;AVENIDA;WASHINGTON LUIS;4604;;SANTO AMARO;SP;SAO PAULO;;;;;5
4,99857E+13;COMBRAERO COMERCIAL LTDA;8;4731800;AVENIDA;WASHINGTON LUIZ;S/N;CX POSTAL 18526;AEROPORTO;SP;SAO PAULO;;;;;5
4,99857E+13;COMBRAERO COMERCIAL LTDA;8;4731800;AVENIDA;SANTOS DUMONT;1979;SETOR B LOTE 3;SANTANA;SP;SAO PAULO;;;;;5
5,00237E+13;DEPOSITO DE GAS ELIZIL LTDA;8;4731800;RUA;MIN LINS DE BARROS;34;;JD PERY;SP;SAO PAULO;;;;;5
5,0055E+13;POSTO DE SERVICOS LESTE OESTE LTDA;2;4731800;RUA;PIRES DO RIO;338;;BELENZINHO;SP;SAO PAULO;11 20581979;11 20581978;;LUCIANO@UNICONCONTABILIDADE.COM.BR;5
5,00565E+13;AUTO POSTO MAREL LTDA;4;4731800;RUA;CONS FURTADO;516;;LIBERDADE;SP;SAO PAULO;;;;;5
5,00565E+13;POSTO RIBARTE LTDA;4;4731800;RUA;DO GLICERIO;23;;SE;SP;SAO PAULO;11 59046664;11 59046664;11 59046664;contar.contar@uol.com.br;5
5,00592E+13;AUTO POSTO PINHO LTDA;4;4731800;RUA;DONA BELMIRA MARIN;2350;;PARQUE GRAJAU;SP;SAO PAULO;;;;;5
5,00594E+13;AUTO POSTO PALINAR LTDA;4;4731800;AVENIDA;JAGUARE;1662;;JAGUARE;SP;SAO PAULO;;;;;1
5,01224E+13;AUTO POSTO DANIMAR LIMITADA;8;4731800;AVENIDA;PRESTES MAIA;656;;SANTA EFIGENIA;SP;SAO PAULO;;;;;5
5,01254E+13;AUTO POSTO PATARELO LTDA;8;4731800;RUA;DR ALMEIDA LIMA;315;;BRAS;SP;SAO PAULO;;;;;5
5,01909E+13;AUTO POSTO ZABEU LTDA;8;4731800;AVENIDA;NOVA CANTAREIRA;894;;TUCURUVI;SP;SAO PAULO;;;;;5
5,01955E+13;AUTO POSTO CASELLA LTDA;2;4731800;AVENIDA;IMIRIM;3176;;IMIRIM;SP;SAO PAULO;;;;;5
5,0197E+13;AUTO COMERCIAL DOM LTDA;8;4731800;RUA;CURUCA;1708;;JD ANDARAI;SP;SAO PAULO;;;;;5
5,01996E+13;AUTO POSTO ARUMA LTDA;8;4731800;RUA;DOMINGOS CALHEIROS;58;;TUCURUVI;SP;SAO PAULO;;;;;5
5,02004E+13;JARDIM SAO BENTO AUTO POSTO LTDA;2;4731800;RUA;MARIA CURUPAITI;280;;SANTANA;SP;SAO PAULO;;;;;5
5,02007E+13;AUTO POSTO JARDIM SAO PAULO LTDA;2;4731800;AVENIDA;NOVA CANTAREIRA;428;;TUCURUVI;SP;SAO PAULO;;;;ORIAN@UOL.COM.BR;5
5,02008E+13;AUTO POSTO CKA LTDA;8;4731800;RUA;VOLUNTARIOS DA PATRIA;1210;;SANTANA;SP;SAO PAULO;;;;;5
5,02026E+13;AUTO POSTO COPA 78 LTDA;8;4731800;AVENIDA;TUCURUVI;1016;;TUCURUVI;SP;SAO PAULO;;;;;5
5,02067E+13;MANDARIN AUTO POSTO LTDA.;2;4731800;RUA;CANHOBA;810;;JARDIM ADELFIORI;SP;SAO PAULO;11 39362370;11 39663088;11 39663088;escritorio@sacontabil.com.br;1
5,02073E+13;ROYAL LUBRIFICANTES LTDA;8;4731800;RUA;AGUA SANTA;470;;ELDORADO;SP;SAO PAULO;;;;;5
5,02478E+13;AUTO POSTO UNIVERSAL SAO PAULO II LTDA;2;4731800;RUA;DOS CAFEZAIS;165;;JD PRUDENCIA;SP;SAO PAULO;11 59084120;;;SOCIETARIO@TOTALAUDITORIA.COM.BR;5
5,02529E+13;AUTO POSTO VILA IGUATEMI LTDA;8;4731800;AVENIDA;BENTO GUELFI;1186;;IGUATEMI;SP;SAO PAULO;11 31569363;;11 31569369;legalizacao3@gesplanoffice.com.br;5
5,02677E+13;NEWTON CASTILHO CARDOSO;8;4731800;AVENIDA;CONS CARRAO;3002;;VL CARRAO;SP;SAO PAULO;;;;;5
5,02683E+13;JOAO APARECIDO DA SILVEIRA;8;4731800;RUA;RICHMONT;11;;PENHA;SP;SAO PAULO;;;;;5
5,02694E+13;COMTINTAS COMERCIO DE TINTAS LTDA;4;4731800;PRACA;DR SAMPAIO VIDAL;283;;VL FORMOSA;SP;SAO PAULO;;;;;1
5,02731E+13;PENINHA SUPER TROCA DE OLEO LTDA;8;4731800;AVENIDA;ENG CAETANO ALVARES;3495;;IMIRIM;SP;SAO PAULO;;;;;5
5,0278E+13;TERREMOTO AUTO SERVICOS LTDA;4;4731800;AVENIDA;CANGAIBA;2810;;CANGAIBA;SP;SAO PAULO;;;;;5
5,02928E+13;WASABA AUTO POSTO LTDA;8;4731800;AVENIDA;NOVA CANTAREIRA;894;;CANTAREIRA;SP;SAO PAULO;;;;;5
5,02932E+13;BIBOKA COMERCIO DE MATERIAIS PARA CONSTRUCAO LTDA;4;4731800;AVENIDA;MAL EURICO GASPAR DUTRA;914;;JARDIM SAO PAULO;SP;SAO PAULO;;;;;1
5,02932E+13;BIBOKA COMERCIO DE MATERIAIS PARA CONSTRUCAO LTDA;4;4731800;AVENIDA;PERI RONCHETTI;43;;JARDIM PERI;SP;SAO PAULO;;;;;1
5,0295E+13;AUTO POSTO POM POM LTDA;8;4731800;AVENIDA;SAO MIGUEL;4681;;ERM MATARAZZO;SP;SAO PAULO;;;;;5
5,02984E+13;MAGNUM SERVICOS AUTOMOTIVOS LTDA;8;4731800;RUA;IBITIRAMA;1426;;VL PRUDENTE;SP;SAO PAULO;;;;;5
5,03101E+13;AUTO POSTO SINHA MOCA LIMITADA;2;4731800;RUA;CAP PACHECO E CHAVES;394;;VILA PRUDENTE;SP;SAO PAULO;;;;GERENCIA@ALWACONTABIL.COM.BR;5
5,0332E+13;JOSELITO OLEO E LUBRIFICANTES LTDA;2;4732600;RUA;CRAVO DA INDIA;40;;PQ SAVOY CITY;SP;SAO PAULO;11 27410199;;;MARCOSCONTAB@UOL.COM.BR;1
5,03816E+13;AUTO POSTO ROCHA LTDA;4;4731800;RUA;DR PLINIO BARRETO;31;;BELA VISTA;SP;SAO PAULO;;;;;1
5,03975E+13;AUTO POSTO LAIS LTDA;8;4731800;RUA;CAVOUR;771;;VILA PRUDENTE;SP;SAO PAULO;;;;;5
5,04669E+13;H M BADREDDINE E CIA LTDA;8;4731800;RUA;RAMOS BATISTA;225;;VILA OLIMPIA;SP;SAO PAULO;;;;;5
5,04814E+13;AUTO POSTO SEPETIBA LTDA;8;4731800;RUA;CARNEIRO DA CUNHA;151;;SAUDE;SP;SAO PAULO;;;;;5
5,05451E+13;POSTO DE SERVICOS OS CUNHADOS LTDA;2;4731800;AVENIDA;NORDESTINA;2718;;S.M.PAULISTA;SP;SAO PAULO;;;;;5
5,05469E+13;AUTO POSTO CIVA LTDA;8;4731800;RUA;LUISIANIA;496;;BARRA FUNDA;SP;SAO PAULO;;;;;5
5,05938E+13;ITAPOAN AUTO POSTO LTDA;8;4731800;RUA;PAULO ANDRIGHETTI;1484;1688;PARI;SP;SAO PAULO;;;;;5
5,06006E+13;LISIMACO CARRASCO HENK;8;4731800;RUA;LUIS GAMA;267;;MOOCA;SP;SAO PAULO;;;;;5
5,06114E+13;CARBONO QUIMICA LTDA EM RECUPERACAO JUDICIAL;2;4731800;RUA;HONDURAS;825 A;;VL ST CATARINA;SP;SAO PAULO;;;;;5
5,06139E+13;REMIS DISTR DE OLEOS LUBRIFICANTES E MAT LIMPEZA LTDA;8;4731800;RUA;ANGATURAMA;507;;VILA MORAES;SP;SAO PAULO;;;;;5
5,06189E+13;VILSON SAM FELIPPO;8;4731800;RUA;D VILARES;166;;VILA BRASILINA;SP;SAO PAULO;;;;;1
5,06309E+13;SUPER TROCA DE OLEO PLATINA LTDA MICROEMPRESA;2;4732600;RUA;PLATINA;313;;TATUAPE;SP;SAO PAULO;;;;;1
5,06521E+13;LAVA RAPIDO TROCA DE OLEO E ESTACIONAMENTO PCJ LTDA;8;4731800;RUA;BARAO DE DUPRAT;250;;SANTO AMARO;SP;SAO PAULO;;;;;5
5,06531E+13;POSTO TAKILHO LTDA;8;4731800;AVENIDA;PROF FRANCISCO MORATO;3061;;VILA SONIA;SP;SAO PAULO;;;;;5
5,06564E+13;J DO ESPIRITO S PEREIRA;8;4731800;;LG DOS PINHEIROS;111;;PINHEIROS;SP;SAO PAULO;;;;;5
5,06682E+13;JUPITER POSTO DE SERVICOS LIMITADA;4;4731800;RUA;SAO CAETANO;788;;LUZ;SP;SAO PAULO;;;;;5
5,06698E+13;AUTO SERVICO MIGUEL STEFANO LTDA;4;4731800;AVENIDA;MIGUEL ESTEFNO;731;;SAUDE;SP;SAO PAULO;;;;;5
5,06731E+13;METROPOSTO SERVICOS AUTOMOTIVOS LTDA;8;4731800;RUA;DOS PATRIOTAS;641;;IPIRANGA;SP;SAO PAULO;;;;;5
5,06793E+13;SUPER TROCA DE OLEO COPACABANA LTDA;8;4731800;AVENIDA;PROF CELESTINO BOURROUL;630;;BAIRRO DO LIMAO;SP;SAO PAULO;;;;;5
5,06809E+13;POSTO DE SERVICO DORO LTDA;8;4731800;RUA;ANASTACIO SOUZA PINTO;288;;FREGUESIA DO O';SP;SAO PAULO;;;;;5
5,06822E+13;AUTO POSTO NAVETE LTDA;4;4731800;RUA;MANOEL DUTRA;224;;BELA VISTA;SP;SAO PAULO;;;;;1
5,0683E+13;AUTO POSTO SALZMANN MONTEIRO LTDA;2;4731800;RUA;CONS RIBAS;450;;VILA ANASTACIO;SP;SAO PAULO;11 36439185;;;DUAL.IPIRANGA@GMAIL.COM;3
5,06837E+13;MOACYR FIGUEIREDO & CIA LTDA;8;4731800;RUA;RIO DE JANEIRO;100;;JD DO ESTADO;SP;SAO PAULO;;;;;5
5,06968E+13;A B M MOTORES MANUTENCAO E LUBRIFICANTES LTDA;8;4731800;RUA;FLOR DE SAO MIGUEL;234;;CID PEDRO J NUNES;SP;SAO PAULO;;;;;5
5,07002E+13;AUTO POSTO MEGA CENTER LTDA;2;4731800;AVENIDA;BARONESA DE MURITIBA;843;;PQ. SAO RAPHAEL;SP;SAO PAULO;;;;;3
5,07131E+13;AUTO POSTO R S LTDA;4;4731800;AVENIDA;WASHINGTON LUIZ;5955;;BROOKLIN;SP;SAO PAULO;;;;;5
5,07389E+13;GILBERTO LEIROZ;8;4731800;AVENIDA;GUILHERME COTCHING;627;;VL MARIA;SP;SAO PAULO;;;;;5
5,07572E+13;AUTO POSTO PHOENIX LTDA;8;4731800;RUA;CLELIA;1547;;LAPA;SP;SAO PAULO;;;;;1
5,07584E+13;MARCO ANTONIO ALVES AUTO ELETRICO;8;4731800;RUA;ALBERTO NEPOMUCENO;31;;VL DOM PEDRO I;SP;SAO PAULO;;;;;5
5,07633E+13;JAIR NAPOLITANO;8;4731800;AVENIDA;CELSO GARCIA;3999;;TATUAPE;SP;SAO PAULO;;;;;1
5,07704E+13;TORINO AUTO POSTO LTDA;2;4731800;AVENIDA;JOAQUINA RAMALHO;675;;VILA GUILHERME;SP;SAO PAULO;;;;;5
5,08565E+13;AUTO POSTO VILA REMO LTDA;8;4731800;ESTRADA;M'BOI MIRIM;3214;;VILA REMO;SP;SAO PAULO;;;;;5
5,08575E+13;AUTO POSTO COMPASSO LTDA;8;4731800;RUA;ALFREDO PUJOL;945;;SANTANA;SP;SAO PAULO;;;;;5
5,08592E+13;POSTO DE SERVICOS CONDE DE ITU LTDA;8;4731800;RUA;DR ANTONIO BENTO;419;;SANTO AMARO;SP;SAO PAULO;;;;;5
5,08644E+13;AUTO POSTO BEL LTDA;4;4731800;RUA;BAR DE CAMPINAS;472;;CAMPOS ELISEOS;SP;SAO PAULO;;;;;5
5,08661E+13;AUTO POSTO TUCURUI LTDA;4;4731800;AVENIDA;GUAPIRA;1985;;JACANA;SP;SAO PAULO;;;;;5
5,08661E+13;POSTO DE SERVICOS SNOB'S LIMITADA;8;4731800;RUA;GENARO DE CARVALHO;59;;VL STA CATARINA;SP;SAO PAULO;;;;;5
5,08914E+13;AUTO POSTO PALMEIRAS LTDA;2;4731800;RUA;BENEDITO GUEDES DE OLIVEIRA;561;;VILA PALMEIRAS;SP;SAO PAULO;11 39315600;11 39312001;11 39312001;;5
5,08995E+13;AUTO POSTO QUEIROZ FILHO LTDA;8;4731800;AVENIDA;QUEIROZ FILHO;1320;;VILA LEOPOLDINA;SP;SAO PAULO;;;;;5
5,09057E+13;AUTO POSTO META LTDA;2;4731800;AVENIDA;MARIA COELHO AGUIAR;215;;JARDIM SAO LUIS;SP;SAO PAULO;;;;;5
5,09139E+13;BROOKLIN AUTO POSTO LTDA;8;4731800;AVENIDA;WASHINGTON LUIS;4547;;BROOKLIN;SP;SAO PAULO;;;;;5
5,0925E+13;AUTO POSTO JOAO TEODORO LTDA;8;4731800;RUA;JOAO TEODORO;1248;;BRAS;SP;SAO PAULO;;;;;5
5,09509E+13;POSTO DE SERVICOS ESPLANADA LTDA;2;4731800;RUA;CEL MARCILIO FRANCO;1046;;VILA IZOLINA;SP;SAO PAULO;;;;;5
5,09515E+13;AUTO POSTO NOVO TABOR LTDA;8;4731800;RUA;IBITIRAMA;532;;VILA PRUDENTE;SP;SAO PAULO;;;;;1
5,0954E+13;AUTO POSTO SERVICAR LTDA;4;4731800;RUA;MARIA CANDIDA;1246;;CARANDIRU;SP;SAO PAULO;;;;;1
5,09582E+13;POSTO DE SERVICOS AVENIDA PAULISTA LTDA;8;4731800;RUA;HUGO VITOR DA SILVA;248;;AMERICANOPOLIS;SP;SAO PAULO;;;;;5
5,09614E+13;AUTO POSTO VILA DIVA LTDA;2;4731800;AVENIDA;SAPOPEMBA;3577;;VL DIVA;SP;SAO PAULO;;;;;5
5,09675E+13;AUTO POSTO RUBRENSE LTDA;4;4731800;AVENIDA;ITAQUERA;2804;;JARDIM BRASILIA;SP;SAO PAULO;;;;;1
5,09959E+13;AUTO POSTO VILA ALPINA LTDA;4;4731800;RUA;COSTA BARROS;339;;VILA ALPINA;SP;SAO PAULO;;;;;3
5,10001E+13;AUTO POSTO MICHELE LTDA;2;4731800;RUA;FRANCISCO REBELO;1072;;VILA ALPINA;SP;SAO PAULO;;;;;5
5,10024E+13;AUTO POSTO RUDCAR LTDA;8;4731800;AVENIDA;RENATA;439;;CHACARA BELENZINHO;SP;SAO PAULO;;;;;5
5,10045E+13;SUPER LAVA RAPIDO REMAR LTDA;8;4731800;RUA;DOMINGOS CALHEIROS;209;;TUCURUVI;SP;SAO PAULO;;;;;5
5,10102E+13;AUTO POSTO DAS CARRETAS LTDA;8;4731800;AVENIDA;SANTA MARINA;2023;;FREGUESIA DO O;SP;SAO PAULO;;;;;5
5,1012E+13;POSTO DE SERVICOS PIQUERI LTDA;8;4731800;RUA;PEDRO COLACO;6;;PIQUERI;SP;SAO PAULO;;;;;5
5,1028E+13;AUTO POSTO TAKARA LTDA;8;4731800;AVENIDA;MIN PETRONIO PORTELA;85;;FREGUESIA DO O;SP;SAO PAULO;;;;;1
5,10313E+13;RODNEY R G ALEXANDRE AUTO POSTO;8;4731800;RUA;VOLUNTARIOS DA PATRIA;1375;;SANTANA;SP;SAO PAULO;;;;;5
5,11546E+13;RICHARD LIZIDATTI;8;4731800;RUA;CON JANUARIO;357;;VILA MONUMENTO;SP;SAO PAULO;;;;;5
5,11571E+13;DADO AUTO POSTO EIRELI;2;4731800;AVENIDA;SANTA CATARINA;669;;VILA ALEXANDRIA;SP;SAO PAULO;11 20239999;;;POSTODADO@TERRA.COM.BR;5
5,11726E+13;COSME JOSE DE MELO;8;4731800;RUA;DO IMPERADOR;27;B;ITAQUERA;SP;SAO PAULO;;;;;1
5,11756E+13;MANA COMERCIO DE LUBRIFICANTES LTDA;4;4731800;RUA;INACIO LUIS DA COSTA;2205;;PIRITUBA;SP;SAO PAULO;;;;;5
5,11772E+13;AUTO POSTO TURQUESA LTDA;2;4731800;AVENIDA;ALCANTARA MACHADO;75;;MOOCA;SP;SAO PAULO;;;;;1
5,11772E+13;POSTO DE SERVICOS ANCORA LTDA;8;4731800;RUA;21 DE ABRIL;900;;BRAS;SP;SAO PAULO;;;;;5
5,11811E+13;ANTONIO ALONSO FILHO;8;4731800;AVENIDA;GABRIELA MISTRAL;1007;;PENHA;SP;SAO PAULO;;;;;5
5,11812E+13;SERVICOS AUTOMOTIVOS CENTER PENHA LTDA;8;4731800;AVENIDA;AMADOR BUENO DA VEIGA;2035;;PENHA;SP;SAO PAULO;;;;;5
5,1185E+13;VIA LAGOS AUTO POSTO LTDA;8;4731800;AVENIDA;JOAO DIAS;1951;;SANTO AMARO;SP;SAO PAULO;;;;;5
5,11907E+13;REDE BANDEIRANTES DE POSTOS DE SERVICOS LTDA;8;4731800;AVENIDA;PROF FRANCISCO MORATO;5051;;FERREIRA;SP;SAO PAULO;;;;;1
5,11907E+13;REDE BANDEIRANTES DE POSTOS DE SERVICOS LTDA;8;4731800;AVENIDA;DR GASTAO VIDIGAL;1209;;VILA LEOPOLDINA;SP;SAO PAULO;;;;;1
5,12038E+13;AUTO POSTO IRMAOS FONSECA LTDA;8;4731800;RUA;VISC DE PARNAIBA;3274;3296;BELEM;SP;SAO PAULO;;;;;5
5,12066E+13;POSTO DE SERVICOS VILA CALIFORNIA LTDA;8;4731800;AVENIDA;SAO RAIMUNDO;S/N;ESQ JOSE J DA ROCHA;VILA CALIFORNIA;SP;SAO PAULO;;;;;5
5,12067E+13;LUBRIFICANTES R M LTDA;8;4731800;RUA;JOAO DE CARVALHAIS;55;;PIRITUBA;SP;SAO PAULO;;;;;5
5,12117E+13;RUEDA LUBRIFICANTES LTDA;8;4732600;RUA;TOLEDO BARBOSA;922;;BELENZINHO;SP;SAO PAULO;11 49947299;;11 49947299;legalizacao@praxiscontabil.com.br;3
5,12208E+13;AGNELLO JOSE TRIPARI;8;4731800;ESTRADA;DO CAMPO LIMPO;4550;;CAMPO LIMPO;SP;SAO PAULO;;;;;5
5,12248E+13;BR AUTO POSTO LTDA;8;4731800;RUA;PEDRO COLACO;12;;PIQUERI;SP;SAO PAULO;;;;;5
5,12284E+13;SICLOIL TRANSPORTES E COMERCIO LTDA;8;4731800;RUA;KUNITO MIYASAKA;71;;CAMPO LIMPO;SP;SAO PAULO;;;;;5
5,13796E+13;SAMPIN SERVICOS COMERCIO DE PECAS LANCHONETE LTDA;8;4731800;ESTRADA;DO CAMPO LIMPO;S/N;;CAMPO LIMPO;SP;SAO PAULO;;;;;5
5,14292E+13;AUTO POSTO ZONA NORTE LTDA;8;4731800;AVENIDA;CRUZEIRO DO SUL;2897;;SANTANA;SP;SAO PAULO;;;;;5
5,14923E+13;ANTONIO LOURENCO RODRIGUES;8;4731800;RUA;LUZITANIA;416 30;;VARZEA DA B FUNDA;SP;SAO PAULO;;;;;5
5,15396E+13;POSTO DE GASOLINA JARDIM PRUDENCIA LTDA;2;4731800;PRACA;NSRA DO PERPETUO SOCORRO;33;;JD PRUDENCIA;SP;SAO PAULO;;;;;1
5,15523E+13;AUTO POSTO EMA LTDA;4;4731800;AVENIDA;VILA EMA;5085;;VL EMA;SP;SAO PAULO;;;;;5
5,15572E+13;SUPER TROCA DE OLEO MARANHAO LTDA;8;4731800;;SAO JOSE DO MARANHAO;26 30;;TATUAPE;SP;SAO PAULO;;;;;5
5,15577E+13;AUTO POSTO NAPOLEAO LTDA;8;4731800;RUA;JOAQUIM MARRA;770;;VL MATILDE;SP;SAO PAULO;;;;;5
5,15587E+13;AUTO POSTO SAN MARTIN LTDA;8;4731800;AVENIDA;GAL OLIMPIO DA SILVEIRA;324;;SANTA CECILIA;SP;SAO PAULO;19 35543155;19 35543155;;confianca@linkway.com.br;5
5,1559E+13;MARIO CORREIA DOMINGUES;8;4731800;RUA;CON JANUARIO;11;;IPIRANGA;SP;SAO PAULO;;;;;5
5,15627E+13;TERPSICORE AUTO POSTO E SERVICOS LTDA;8;4731800;RUA;VERGUEIRO;4710;;SAUDE;SP;SAO PAULO;;;;;5
5,15696E+13;SERVICOS AUTOMOTIVOS SEL LTDA;8;4731800;RUA;DO GRITO;748;;IPIRANGA;SP;SAO PAULO;;;;;5
5,15734E+13;AUTO POSTO EDUARDO LTDA;8;4731800;AVENIDA;CARLOS LIVIERO;353;;VILA LIVIERO;SP;SAO PAULO;;;;;5
5,15793E+13;LAVA RAPIDO DOIS AMIGOS LTDA;8;4731800;AVENIDA;SAPOPEMBA;80;;AGUA RAZA;SP;SAO PAULO;;;;;5
5,15933E+13;AUTO POSTO GRAFITE LTDA;8;4731800;RUA;JOAO PEREIRA;110;;LAPA;SP;SAO PAULO;;;;;5
5,15966E+13;REAL AUTO POSTO LTDA;4;4731800;AVENIDA;RIO DAS PEDRAS;2550;;VILA NOVA IORQUE;SP;SAO PAULO;;;;;3
5,16053E+13;NILSON LEME CONCEICAO SILVA;8;4731800;RUA;PARAPUA;SN;AO LADO DO N 1094;VL BRASILANDIA;SP;SAO PAULO;;;;;1
5,16882E+13;GABOR FEKETE;8;4731800;AVENIDA;STO AMARO;1510;;VILA OLIMPIA;SP;SAO PAULO;;;;;5
5,17151E+13;COM DE OLEOS LUBRIFICANTES E LAVAGEM SAO FELIPE LTDA;4;4731800;RUA;D VILARES;166;;VILA BRASILINA;SP;SAO PAULO;;;;;5
5,1726E+13;COMERCIAL DE OLEOS EM GERAL SANTA BABILONIA LTDA;8;4731800;RUA;PEDRO CUBAS;76;;VILA BONILHA;SP;SAO PAULO;;;;;5
5,17297E+13;AUTO POSTO SUPERPONTES LTDA;4;4731800;AVENIDA;POMPEIA;2557;;SUMAREZINHO;SP;SAO PAULO;;;;;3
5,17354E+13;SUPER TROCA DE OLEO PEDRA DOURADA LTDA;8;4731800;ESTRADA;M'BOI MIRIM;2103;;JARDIM ANGELA;SP;SAO PAULO;;;;;5
5,17475E+13;LAVA RAPIDO NINHO S CAR LTDA;8;4731800;RUA;PROF FABIO FANUCCHI;306;;SANTANA;SP;SAO PAULO;;;;;5
5,17481E+13;POSTO DE SERVICOS ROBERTAO LTDA;8;4731800;RUA;PAIM;364;;BELA VISTA;SP;SAO PAULO;;;;;5
5,17498E+13;PAULO ROBERTO FELIPE;8;4731800;RUA;ROCHA LIMA;69;;BAIRRO DO LIMAO;SP;SAO PAULO;;;;;5
5,17527E+13;LEAO DE VENEZA AUTO POSTO LTDA;8;4731800;AVENIDA;MORUMBI;7650;;SANTO AMARO;SP;SAO PAULO;;;;;5
5,17625E+13;POSTEC SERVICOS AUTOMOTIVOS E COMERCIO LTDA;8;4731800;RUA;DOS CAMPINEIROS;575;;MOOCA;SP;SAO PAULO;;;;;5
5,1764E+13;JULIO CAROTTA FILHO;4;4731800;RUA;DA ANA NERI;28;;CAMBUCI;SP;SAO PAULO;11 25231815;11 25231815;11 25231815;faleconosco@qualicontax.com.br;3
5,17717E+13;AUTO POSTO RG LTDA;8;4731800;AVENIDA;GAL ATALIBA LEONEL;2493;;SANTANA;SP;SAO PAULO;;;;;5
5,17755E+13;LAVA RAPIDO E LANCHONETE SPACIAL LTDA;4;4731800;AVENIDA;WALDEMAR CARLOS PEREIRA;S/N;LOTE 30 31 QUADRA M;VILA NOVA SAVOIA;SP;SAO PAULO;;;;;1
5,17792E+13;POSTO DUQUE 13 LIMITADA;8;4731800;AVENIDA;CIDADE JARDIM;514;;JARDIM EUROPA;SP;SAO PAULO;;;;;5
5,1787E+13;XUXU AUTO POSTO LTDA;8;4731800;RUA;RIBEIRO DO AMARAL;445;;IPIRANGA;SP;SAO PAULO;;;;;5
5,19507E+13;AUTO POSTO SANTA EDWIGES LTDA;2;4731800;AVENIDA;RAIMUNDO P DE MAGALHAES;3460;;PIRITUBA;SP;SAO PAULO;;;;;5
5,19511E+13;J P DE OLIVEIRA POSTO DE GASOLINA;4;4731800;RUA;GUARAPIRANGA;280;;SANTO AMARO;SP;SAO PAULO;;;;;1
5,19589E+13;AUTO POSTO 5 IRMAOS LTDA;8;4731800;RUA;SANTO EURILO;360;;JAGUARE;SP;SAO PAULO;;;;;5
5,19605E+13;AUTO POSTO BERING LTDA;4;4731800;RUA;JULIO CESAR DA SILVA;253;;BRAS;SP;SAO PAULO;;;;;5
5,19722E+13;COMERCIO E REPRES DE OLEOS LUBRIFICANTES ESMERALDA LTDA;8;4731800;RUA;CORONEL MEIRELLES;588;;PENHA;SP;SAO PAULO;;;;;5
5,19808E+13;AUTO POSTO SAN GENNARO LTDA;8;4731800;RUA;DA MOOCA;1033;;MOOCA;SP;SAO PAULO;;;;;5
5,20071E+13;GILVAN SANT ANNA LOPES;8;4731800;RUA;ANTONIO DE BARROS;1876;;TATUAPE;SP;SAO PAULO;;;;;5
5,20085E+13;POSTO DE SERVICOS PRESIDENTE ALTINO LIMITADA;2;4731800;AVENIDA;PRES ALTINO;1579;;JAGUARE;SP;SAO PAULO;;;;;5
5,20249E+13;AUTO POSTO CHEGADA LTDA;2;4731800;RUA;NAZARE PAULISTA;210;;VILA JATAY;SP;SAO PAULO;;;;;5
5,20972E+13;C.V.OIL - COMERCIO VAREJISTA DE OLEOS E LUBRIFICANTES LTDA.;4;4731800;RUA;DA CANTAREIRA;1012;;MERCADO;SP;SAO PAULO;;;;;1
5,21148E+13;J.M.POSTO DE GASOLINA LTDA;8;4731800;AVENIDA;GUARAPIRANGA;280;;SANTO AMARO;SP;SAO PAULO;;;;;5
5,21259E+13;DISTRIBUIDORA DE LUBRIFICANTES SAN DIEGO LTDA;8;4731800;RUA;VIEIRA MARTINS;65;;BRAS;SP;SAO PAULO;;;;;5
5,21305E+13;DAVO SUPERMERCADOS LTDA;2;4731800;ESTRADA;ITAQUERA GUAIANAZES;2100;;JARDIM HELENA;SP;SAO PAULO;11 25514500;11 25514555;11 25514520;fiscal@davo.com.br;5
5,21436E+13;AUTO POSTO ANDREA LIMITADA;8;4731800;AVENIDA;STO AMARO;6868;;SANTO AMARO;SP;SAO PAULO;;;;;5
5,21487E+13;AUTO POSTO CITY LAPA LTDA;2;4731800;RUA;CORDILHEIRAS;4;;ALTO DA LAPA;SP;SAO PAULO;;;;;5
5,2163E+13;POSTO ILHAS DO HAWAI LTDA;2;4731800;AVENIDA;IMPERATRIZ LEOPOLDINA;1864;;VILA LEOPOLDINA;SP;SAO PAULO;;;;;5
5,21712E+13;AUTO POSTO FLAMAR LTDA;8;4731800;AVENIDA;LINS DE VASCONCELOS;444;;CAMBUCI;SP;SAO PAULO;;;;;5
5,21749E+13;GASCOBRA COMERCIO DE GAS LTDA;8;4731800;AVENIDA;NOSSA SENHORA DO O;1177;FUNDOS;FREGUESIA DO O;SP;SAO PAULO;;;;;5
5,21841E+13;ECA LAVAGEM DE AUTOMOVEIS LTDA;8;4731800;RUA;ANTONIO BENTO;106;;SANTO AMARO;SP;SAO PAULO;;;;;5
5,21888E+13;HERCULE CHRYSSOCHERI;8;4731800;AVENIDA;STO AMARO;4579;;SANTO AMARO;SP;SAO PAULO;;;;;1
5,21953E+13;LAVA RAPIDO E LANCHONETE WASH & BURGER LTDA;8;4731800;ESTRADA;DE ITAPECERICA;2013;;VILA DAS BELEZAS;SP;SAO PAULO;;;;;5
5,22133E+13;SUPER TROCA DE OLEO HEMBRI LTDA;8;4731800;RUA;DEMINI;582;;PENHA;SP;SAO PAULO;;;;;5
5,2215E+13;J.C. PIRES;2;4732600;AVENIDA;CORIFEU AZEVEDO MARQUES;4615;;JAGUARE;SP;SAO PAULO;;;;;1
5,22171E+13;POSTO DE SERVICOS TIRADENTES LIMITADA;8;4731800;RUA;AFONSO PENA;414;;BOM RETIRO;SP;SAO PAULO;;;;;5
5,22436E+13;MARCELY AUTO POSTO LTDA;8;4731800;RUA;LUIS GOIS;163;;MIRANDOPOLIS;SP;SAO PAULO;;;;;5
5,22864E+13;POSTO 14 LAVABEM LTDA;4;4731800;AVENIDA;WASHINGTON LUIS;6927;;AEROPORTO;SP;SAO PAULO;;;;;5
5,2304E+13;AUTO POSTO ITAPEMIRIM LTDA;2;4731800;AVENIDA;CAMPANELLA;2042;;ITAQUERA;SP;SAO PAULO;;;;;3
