2,18141E+13;EXPRESSO LUBRIFICA LTDA;8;4732600;ALAMEDA;AFONSO SCHMIDT;271;"TERREO;";SANTA TERESINHA;SP;SAO PAULO;12 34322157;12 34241318;12 34241318;CONTABILIDADE@GRUPOVA.COM.BR;1
2,18339E+13;AUTO POSTO MIRANTE DO TUCURUVI LTDA;2;4731800;AVENIDA;TUCURUVI;1016;;TUCURUVI;SP;SAO PAULO;11 20239999;;;PLUMAS@PLUMASCONTABIL.COM.BR;5
2,18922E+13;GRAN SAO MATHEUS POSTO E SERVICOS LTDA;2;4731800;AVENIDA;SAPOPEMBA;12729;;SAPOPEMBA;SP;SAO PAULO;11 65531201;11 96553120;;PULOG@BOL.COM.BR;5
2,1919E+13;DJALMA VAZ CAVALCANTI 04144689883;2;4732600;AVENIDA;GOVERNADOR CARVALHO PINTO;2228;;VILA SAO GERALDO;SP;SAO PAULO;11 57260231;;;CONTATO@VERUSCONTABILIDADE.COM.BR;1
2,19604E+13;AUTO POSTO E SERVICOS CURVAO LTDA;2;4731800;RUA;MARCIO BECK MACHADO;150;;CIDADE TIRADENTES;SP;SAO PAULO;11 59046664;11 99877101;;MOTA@CONTAR.CNT.BR;5
2,19615E+13;AUTO POSTO M & M LTDA;2;4731800;AVENIDA;CASA VERDE;2305;;CASA VERDE;SP;SAO PAULO;41 30224561;41 91238266;;SIDEBAILLO@HOTMAIL.COM;5
2,19615E+13;AUTO POSTO ARP LTDA;2;4731800;AVENIDA;ITAQUERA;2804;;JARDIM MARINGA;SP;SAO PAULO;41 30224561;;;SIDEBAILLO@HOTMAIL.COM;5
2,19625E+13;AMF AEROPORTO COMERCIO VAREJISTA DE COMBUSTIVEIS LTDA;2;4731800;AVENIDA;WASHINGTON LUIS;5730;;SANTO AMARO;SP;SAO PAULO;11 59046664;11 78563021;11 59046664;CONTAR.CONTAR@UOL.COM.BR;5
2,20328E+13;GABRIELLA AUTO SERVICE LTDA;2;4731800;RUA;CASALDELO;12;"QUADRA: 16 - S;";VILA PIERINA;SP;SAO PAULO;11 27814133;11 27817185;11 34772038;EDECRI@IG.COM.BR;5
2,20403E+13;LEONARDO SILVA MARQUES 06218428508;8;4732600;RUA;CACHOEIRA ALEGRE;341;CASA 1;JARDIM SANTA CRUZ (ZONA NORTE);SP;SAO PAULO;11 39829865;;;lrdeliverydeoleo@gmail.com;1
2,20446E+13;AUTO POSTO JARDIM DO CAMBUCI LTDA;2;4731800;RUA;DA INDEPENDENCIA;196;;CAMBUCI;SP;SAO PAULO;11 35720535;;;PARALEGAL@CONTEC.CNT.BR;5
2,20545E+13;AUTO POSTO CATUAI LTDA;8;4731800;RUA;DEPUTADO LACERDA FRANCO;428;;PINHEIROS;SP;SAO PAULO;11 38769272;11 38769273;;SOCIETARIO@ONLINECONTABILIDADE.COM.BR;5
2,21185E+13;MULTIBOX AUTO POSTO LTDA;8;4731800;AVENIDA;RANGEL PESTANA;950;;BRAS;SP;SAO PAULO;11 65531201;;;PULOG@BOL.COM.BR;5
2,21189E+13;CENTRO AUTOMOTIVO RUA DOS TRILHOS LTDA;2;4731800;RUA;DOS TRILHOS;137;;MOOCA;SP;SAO PAULO;11 29502066;;11 29502066;ARFECONTABIL@TERRA.COM.BR;5
2,2124E+13;AUTO POSTO FLOR DE LIS LTDA;2;4731800;ESTRADA;DAS LAGRIMAS;3185;;SAO JOAO CLIMACO;SP;SAO PAULO;11 35720535;;;PARALEGAL@CONTEC.CNT.BR;5
2,21326E+13;M.N. DE SOUZA COMERCIO DE LUBRIFICANTES;2;4732600;ESTRADA;CANAL DE COCAIA;2835;;PARQUE RESIDENCIAL COCAIA;SP;SAO PAULO;11 59363722;;;CONTIFACILSP@HOTMAIL.COM;1
2,21759E+13;POSTO DE SERVICOS AUTOMOTIVOS CITY AMERICA LTDA;2;4731800;AVENIDA;OTAVIANO ALVES DE LIMA;22;;CASA VERDE BAIXA;SP;SAO PAULO;11 22014492;11 22018895;11 22018895;CONTABILIDADE.FERNANDES@IG.COM.BR;3
2,2229E+13;ECO POSTO BANDEIRANTES LTDA;2;4731800;AVENIDA;DOS BANDEIRANTES;3459;;PLANALTO PAULISTA;SP;SAO PAULO;11 50419780;11 50961908;19 32552454;ECOPOSTO@REDEMONTEIRO.COM.BR;5
2,22644E+13;VINICIUS DE SOUZA PAULINO 34633744801;2;4732600;RUA;AMLETO MARCHI;46;CASA;PARQUE FERNANDA;SP;SAO PAULO;11 58252771;;;;1
2,23079E+13;CENTRO AUTOMOTIVO ARICANDUVA PLAZA LTDA;2;4731800;AVENIDA;ARICANDUVA;8800;;JARDIM SAO CRISTOVAO;SP;SAO PAULO;11 29502066;;11 29502066;ARFECONTABIL@TERRA.COM.BR;5
2,23292E+13;STAR LUB COMERCIO DE LUBRIFICANTES LTDA.;2;4732600;ESTRADA;DA BARONESA;55;": A LOJA 2;";PARQUE BOLOGNE;SP;SAO PAULO;11 58310920;;;STARLUB@HOTMAIL.COM;1
2,23711E+13;AUTO POSTO CRV LTDA.;2;4731800;RUA;DO IMPERADOR;1677;;VILA PAIVA;SP;SAO PAULO;11 26090564;11 98946309;11 26090564;CONTABILBERRINI@TERRA.COM.BR;5
2,24069E+13;AUTO POSTO ALVORADA DA VILA LTDA;2;4731800;RUA;ALVILANDIA;20;;VILA MADALENA;SP;SAO PAULO;11 20999400;;11 22817327;CONTABILIDADE@CARVALHOMACHADO.COM.BR;5
2,24073E+13;DNA DO OLEO LTDA;2;4732600;RUA;JOAQUIM MARRA;1083;FRENTE;VILA TALARICO;SP;SAO PAULO;11 22892145;;;C-DO-OLEO@BOL.COM.BR;1
2,24112E+13;LEANDRO LOPES MACEDO NETO 16697407816;1;4732600;RUA;GENERAL JARDIM;522;TERREO;VILA BUARQUE;SP;SAO PAULO;11 98396111;;;leandrolopes72@hotmail.com;1
2,24176E+13;EDINAUDO APARECIDO BATISTA 13970498805;2;4732600;RUA;FREI CLAUDE ALBERVILLE;136;;JARDIM JOAO XXIII;SP;SAO PAULO;11 38183845;;;ptmcontabilidade@hotmail.com;1
2,24214E+13;PAULO HENRIQUE FERREIRA DA SILVA 38874004885;1;4732600;RUA;AMEDEO BASSI;29;BLOCO 1;JARDIM MARTINI;SP;SAO PAULO;11 62945687;;;paulo.henrique91@live.com;1
2,24455E+13;LUCIA CRISTINA DA SILVA 10669775851;2;4732600;RUA;INDIO PERI;40;TERREO;JARDIM PERI;SP;SAO PAULO;11 22310529;;;fenix.supertroca.lub@gmail.com;1
2,25068E+13;AUTO POSTO MARECHAL TITO LTDA;2;4731800;AVENIDA;MARECHAL TITO;4590;;ITAIM PAULISTA;SP;SAO PAULO;11 30352800;;11 29564667;WAGNER.CARVALHO@POSTOSSETEE.COM.BR;5
2,25263E+13;AUTO POSTO G-10 LTDA;2;4731800;AVENIDA;DOUTOR ASSIS RIBEIRO;10555;;VILA JACUI;SP;SAO PAULO;11 29570443;11 32131557;11 32131557;INTELIGENCIA.CONTABIL@YAHOO.COM.BR;5
2,26176E+13;GABRIELA CRISTIANE MAZZO MOREIRA CENTRO AUTOMOTIVO;8;4732600;ESTRADA;DE ITAPECERICA;977;;VILA DAS BELEZAS;SP;SAO PAULO;11 56875222;;;REXCONTABIL@UOL.COM.BR;1
2,26464E+13;NOVO BRILHO CENTRO AUTOMOTIVO LTDA;2;4731800;AVENIDA;PAES DE BARROS;1999;"TERREO;";MOOCA;SP;SAO PAULO;11 40190126;11 98878577;11 22164361;SHELL_NOVOBRILHO@OUTLOOK.COM.BR;5
2,26877E+13;AUTO POSTO 1488 LTDA;2;4731800;AVENIDA;DO RIO BONITO;1488;;SOCORRO;SP;SAO PAULO;11 29724132;11 29724678;11 29724678;THADEU@CONTABILIDADERODRIGUES.COM.BR;5
2,27332E+13;FRANCIELE DE ALMEIDA MATTOS PEDERNEIRA 32166134882;2;4732600;RUA;JOAO CABRAL;15;SALA 03;JARDIM DO COLEGIO (ZONA NORTE);SP;SAO PAULO;11 55943739;;;jefadv@hotmail.com;1
2,27614E+13;TIAGO RUFINO PINTO 27915116878;2;4732600;RUA;SINFONIA ITALIANA;101;;JARDIM SAO BERNARDO;SP;SAO PAULO;11 61503965;;;tiagorufino35@hotmail.com;1
2,27818E+13;MC COMERCIO DE PRODUTOS E SERVICOS AUTOMOTIVOS LTDA;8;4732600;RUA;TOBIAS BARRETO;873;;MOOCA;SP;SAO PAULO;11 29364606;;;CONTABIL.WMG@GMAIL.COM;1
2,27824E+13;JOSE PEREIRA DOS SANTOS 34200518830;2;4732600;AVENIDA;RAIMUNDO PEREIRA DE MAGALHAES;9498;TERREO;PIRITUBA;SP;SAO PAULO;11 00000000;;;PSCONSTRUCAO@OUTLOOK.COM.BR;1
2,28144E+13;JOAO PEREIRA DOS SANTOS 36993086859;8;4732600;RUA;BARAO DE ALMEIDA VALIM;106;TERREO;VILA JUREMA;SP;SAO PAULO;11 41054228;;;JPLUBRIFICANTES@OUTLOOK.COM.BR;1
2,28664E+13;REI DO OLEO BUTANTA LTDA;2;4732600;RUA;CAMARGO;94;;BUTANTA;SP;SAO PAULO;11 26192941;;;FINANCEIRORDO@HOTMAIL.COM;1
2,28904E+13;PAULISTA REVENDEDORA DE COMBUSTIVEIS LTDA;2;4731800;AVENIDA;SANTOS DUMONT;1979;SETOR B LOTE 3 PARTE;SANTANA;SP;SAO PAULO;21 25097794;;;CARLOS@JETFLYCOMBUSTIVEIS.COM.BR;5
2,28956E+13;SCIENCE ENERGY BRASIL COMERCIO DE ADITIVOS PARA OLEO COMBUSTIVEL LTDA;2;4732600;AVENIDA;ANGELICA;2223;"SALA: 1307; CONJ: 131; ANDAR: 13;";CONSOLACAO;SP;SAO PAULO;11 96329301;;;ENERGYPLUS@ENERGYPLUS.COM.BR;5
2,28988E+13;ALEMAO FILTROS E LUBRIFICANTES LTDA;2;4732600;ESTRADA;DE ITAPECERICA;2196;;VILA PREL;SP;SAO PAULO;11 56864927;;;GVCONTABIL@GVCONTABILIDADE.COM.BR;1
2,29209E+13;FELIPE DE SOUZA BERNARDES LUSTOZA;2;4732600;AVENIDA;NORDESTINA;4408;;VILA NOVA CURUCA;SP;SAO PAULO;11 41130324;11 22856044;11 22856044;MR01CONTABILIDADE@BOL.COM.BR;1
2,29319E+13;COCAIA 10 POSTO DE SERVICOS E CONVENIENCIA LTDA;2;4731800;AVENIDA;PAULO GUILGUER REIMBERG;2090;;PARQUE MARIA FERNANDES;SP;SAO PAULO;11 20239999;;;PLUMAS@PLUMASCONTABIL.COM.BR;5
2,2952E+13;MULTI PARTS LUBRIFICANTES E ACESSORIOS LTDA;8;4732600;AVENIDA;ARICANDUVA;1630;CONJ 3;VILA CALIFORNIA;SP;SAO PAULO;11 29103137;;;CONAD@CONADCONTABILIDADE.COM.BR;3
2,29882E+13;COLISEU COMERCIO VAREJISTA DE COMBUSTIVEIS LTDA;2;4731800;AVENIDA;GIOVANNI GRONCHI;6775;;VILA ANDRADE;SP;SAO PAULO;11 59046664;;;CONTAR.CONTAR@UOL.COM.BR;5
2,30134E+13;CENTRO AUTOMOTIVO TREBBIANO LTDA;2;4731800;RUA;DIOGO LOPES;40;": 74;";VILA BERTIOGA;SP;SAO PAULO;11 21433811;11 21434433;11 21433811;SILVERIO@SILVERIO.COM.BR;5
2,30308E+13;JOSE ITAMAR ALVES DE OLIVEIRA 04008814388;8;4732600;RUA;BARRA ALTA;420;;JARDIM DAS FLORES;SP;SAO PAULO;11 23733389;;;jandcruz2011@live.com;1
2,30661E+13;MUNDO DO OLEO COMERCIO DE LUBRIFICANTES AUTOMOTIVOS LTDA;8;4732600;RUA;DOUTOR SILVIO DANTE BERTACCHI;486;;VILA SONIA;SP;SAO PAULO;11 59722556;;;RDNCONTABILIDADE@HOTMAIL.COM;1
2,30854E+13;AUTO POSTO XERETA LTDA.;2;4731800;RUA;MELO PEIXOTO;1777;;TATUAPE;SP;SAO PAULO;11 29141406;;11 29141406;OESTRELLA@UOL.COM.BR;5
2,31043E+13;QUIMECOL SOLUCOES QUIMICAS - EIRELI;2;4732600;RUA;CAIO GRACO;201;CONJ 103;VILA ROMANA;SP;SAO PAULO;11 38625099;;;QUIMECOL@QUIMECOL.COM.BR;1
2,31603E+13;RENAN SEHN SANTOS;2;4732600;RUA;VIRGINOPOLIS;107;APT 97;SACOMA;SP;SAO PAULO;11 25032852;;;RSSALESBR@GMAIL.COM;1
2,31875E+13;AUTO POSTO SUPER BUTANTA LTDA;2;4731800;AVENIDA;CORIFEU DE AZEVEDO MARQUES;5000;;VILA LAGEADO;SP;SAO PAULO;11 50411170;;11 55316168;CONCEITUAL@CONCEITUAL.CNT.BR;5
2,31935E+13;S. BIASSI LUBRIFICANTES EIRELI;2;4732600;AVENIDA;SAO MIGUEL;3111;;VILA CONSTANCA;SP;SAO PAULO;11 26215473;;;FISCALTREVO@GMAIL.COM;1
2,32251E+13;ADAIR GOMES DE SOUZA 01170049605;2;4732600;RUA;DONA ELISA PEREIRA DE BARROS;23;SALA 5;JARDIM EUROPA;SP;SAO PAULO;11 33135656;;;GOMES011@R7.COM;1
2,32263E+13;AUTO POSTO NOVA CONSELHEIRO EIRELI;2;4731800;RUA;CONSELHEIRO MOREIRA DE BARROS;2374;;LAUZANE PAULISTA;SP;SAO PAULO;11 20612300;11 20617849;11 38557540;POSTOCONSELHEIRO@GMAIL.COM;3
2,32263E+13;AUTO POSTO AEROGAS EIRELI;2;4731800;AVENIDA;JOAO PEDRO CARDOSO;428;;JABAQUARA;SP;SAO PAULO;11 77969219;11 82440969;11 96574242;CONTABILBERRINI@TERRA.COM.BR;5
2,32263E+13;CENTRO AUTOMOTIVO PORTO PRINCIPE LTDA;2;4731800;AVENIDA;PRESIDENTE TANCREDO NEVES;126;": 142;";VILA NANCY;SP;SAO PAULO;11 59084120;;;SOCIETARIO@TOTALAUDITORIA.COM.BR;5
2,33604E+13;ALLAN C LEAO LUBRIFICANTES;2;4732600;AVENIDA;CORONEL SEZEFREDO FAGUNDES;6754;A;JARDIM FRANCISCO MENDES;SP;SAO PAULO;11 29953667;11 29954192;11 29956793;NBZCON@NBZCON.COM.BR;1
2,33766E+13;CENTRO AUTOMOTIVO SUPER 900 LTDA;2;4731800;AVENIDA;JACU PESSEGO;S/N;LOTE 278;SECCAO COLONIAL DA VILA CARMOSINA;SP;SAO PAULO;11 26843923;;11 26843923;juridico@gslcontabil.com.br;5
2,3399E+13;CENTRO AUTOMOTIVO CASTANHEIRA LTDA;2;4731800;AVENIDA;MATEO BEI;1271;"TERREO;";SAO MATEUS;SP;SAO PAULO;11 22137215;11 22166892;11 22164361;LOURENCOCONTABILIDADE@HOTMAIL.COM;5
2,34032E+13;VALDENICE DO ROCIO GOLOS DAURA 75247488920;2;4732600;RUA;POETISA COLOMBINA;199;APT 212;JARDIM BONFIGLIOLI;SP;SAO PAULO;11 37222394;;;tutulub@yahoo.com;1
2,3422E+13;JESSICA MORETO DA SILVA 41989409830;2;4732600;RUA;JOSEFA MARIA DE LIMA;61;;JARDIM TIETE;SP;SAO PAULO;11 65261523;;;;1
2,3428E+13;AUTO POSTO M1 EIRELI;2;4731800;RUA;VERGUEIRO;4999;;VILA MARIANA;SP;SAO PAULO;11 55723415;11 59084120;11 55723415;SOCIETARIO@TOTALAUDITORIA.COM.BR;5
2,3428E+13;POSTO DE SERVICOS REIMAO LTDA;2;4731800;AVENIDA;SALIM FARAH MALUF;121;;TATUAPE;SP;SAO PAULO;11 50716720;;;INFORMACONT@INFORMACONT.COM.BR;5
2,34451E+13;MODENA AUTO POSTO LTDA;2;4731800;ESTRADA;DO M BOI MIRIM;3060;;JARDIM COIMBRA;SP;SAO PAULO;11 20239999;;11 20239994;PLUMAS@PLUMASCONTABIL.COM.BR;5
2,34463E+13;PARK DO OLEO FREGUESIA EIRELI;2;4732600;RUA;BONIFACIO CUBAS;735;;VILA ALBERTINA;SP;SAO PAULO;11 78597942;;;REIDOOLEOJAGUARE@GMAIL.COM;1
2,3454E+13;DANIEL SAN GIACOMO ARCANGELO 28246752847;8;4732600;RUA;CANANEIA;231;;VILA PRUDENTE;SP;SAO PAULO;11 20843195;;;ARCANGELODANIEL1@GMAIL.COM;1
2,3459E+13;AUTO POSTO FLOR DE GOIAS LTDA;2;4731800;RUA;AURELIANO LESSA;31;"TERREO;";VILA REGENTE FEIJO;SP;SAO PAULO;11 22137215;11 22166892;11 22164361;LOURENCOCONTABILIDADE@HOTMAIL.COM;5
2,34843E+13;REINADO DO OLEO COMERCIO DE LUBRIFICANTES LTDA;2;4732600;RUA;JULIAO FERREIRA DA SILVA;688;;JARDIM CENTENARIO;SP;SAO PAULO;11 39418711;11 74338376;11 39418711;ANTONIO.BR@IG.COM.BR;1
2,3495E+13;OFICINA CANARIO LTDA;8;4732600;RUA;TAMOIOS;214;;JARDIM AEROPORTO;SP;SAO PAULO;11 29494610;;;GERAL@LEBLONCONTABIL.COM.BR;1
2,35125E+13;MX COMERCIO DE LUBRIFICANTES LTDA;2;4732600;RUA;OLIMPIO JOSE GONCALVES;88;;VILA SANTA CLARA;SP;SAO PAULO;11 22115681;11991775;;PCELIANA@IG.COM.BR;1
2,3516E+13;ANGELINA LUCI COELHO MUNIZ 08802127808;2;4732600;RUA;ALMEIDA MERCES;248;;TREMEMBE;SP;SAO PAULO;11 96749278;;;alcmuniz@ig.com.br;1
2,35304E+13;AUTO POSTO BELA ALIANCA EIRELI;2;4731800;RUA;CORDILHEIRAS;134;;BELA ALIANCA;SP;SAO PAULO;11 55735252;;;CONTAR.CONTAR@UOL.COM.BR;5
2,35382E+13;ABDELHAFID MOKDAD;2;4732600;AVENIDA;GUIDO CALOI;1985;GALPAO10 SUBSL;JARDIM SAO LUIS;SP;SAO PAULO;11 25920666;11 25920777;;CONTATO@MULLERCONTABIL.COM.BR;1
2,35831E+13;EDERVAN DE ALMEIDA BARBOSA 35730683839;8;4732600;ESTRADA;DO CAMPO LIMPO;2443;;VILA PREL;SP;SAO PAULO;11 69531720;;;edervanalmeida@gmail.com;1
2,35944E+13;JOSE CARLOS DE CASTRO 03842505809;2;4732600;RUA;NICOLA CONFORTO;199;;JARDIM AUGUSTO;SP;SAO PAULO;11 95443621;;;PAIABAJC@GMAIL.COM;1
2,36219E+13;POSTO DE SERVICOS CLASSE A LTDA;2;4731800;ESTRADA;DE ITAPECERICA;1849;;VILA MARACANA;SP;SAO PAULO;11 20239999;;;MURILLO.ORIAN@UOL.COM.BR;5
2,36868E+13;AUTO POSTO PORTAL SAPOPEMBA LTDA;2;4731800;AVENIDA;ADELIA CHOHFI;5300;;PARQUE SAO RAFAEL;SP;SAO PAULO;11 29141406;;;OESTRELLA@UOL.COM.BR;5
2,36869E+13;AUTO POSTO SUPER SANTANA EIRELI;2;4731800;RUA;DOUTOR CESAR;303;;SANTANA;SP;SAO PAULO;11 22612300;11 20617849;11 38557540;POSTOSUPERSANTANA@GMAIL.COM;5
2,37159E+13;POSTO NOVA FAMILIA LTDA;2;4731800;AVENIDA;SENADOR TEOTONIO VILELA;2.089;TERREO;CIDADE DUTRA;SP;SAO PAULO;11 36838848;11 36836472;11 36836472;CONTILEXOSC@YAHOO.COM.BR;5
2,37321E+13;AUTO POSTO MORAES D'PAULA - EIRELI;2;4731800;RUA;ALFREDO PIMENTA;253;;JARDIM BRASILIA (ZONA LESTE);SP;SAO PAULO;11 59084120;11 55723415;11 55723415;SOCIETARIO@TOTALAUDITORIA.COM.BR;5
2,37413E+13;MARCELA SANTOS DE MELLO 23038114812;8;4732600;RUA;CAIMOAMBO;161;CASA A;PARQUE ITABERABA;SP;SAO PAULO;11 39845501;;;maya.comercial@hotmail.com;1
2,37829E+13;SHALOM DO OLEO COMERCIO E SERVICOS DE LUBRIFICANTES LTDA;2;4732600;ESTRADA;DO M BOI MIRIM;169;167;JARDIM DAS FLORES;SP;SAO PAULO;11 56677857;;11 56677857;MARCIOMIKAMI2132@HOTMAIL.COM;1
2,37906E+13;DONIZETTI POSSE 08803836829;2;4732600;AVENIDA;XAVIER PINHEIRO;250;;VILA FORMOSA;SP;SAO PAULO;11 27817374;;;donizett.01@gmail.com;1
2,38057E+13;B.N.DE OLIVEIRA LUBRIFICANTES;2;4732600;RUA;MADRE DE DEUS;1700;LOJA 2;MOOCA;SP;SAO PAULO;11 99624379;;;CAFLUBRIFICANTES2020@GMAIL.COM;1
2,38628E+13;SP DO OLEO II E LUBRIFICANTES LTDA;2;4732600;AVENIDA;GUAPIRA;1953;1977;TUCURUVI;SP;SAO PAULO;11 23848799;;;MPOLATI@UOL.COM.BR;1
2,38941E+13;AUTO POSTO MINI-ITAQUERAO LTDA;2;4731800;AVENIDA;ITAQUERA;7475;;VILA CARMOSINA;SP;SAO PAULO;11 25231815;;11 25231815;LEGALIZACAO@QUALICONTAX.COM.BR;5
2,39231E+13;BEATRIZ CRISTIANE NUNES ARAGAO 25696574840;2;4732600;AVENIDA;PROFESSOR ALIPIO DE BARROS;210;BOX 55;JARDIM MAIA;SP;SAO PAULO;11 51977778;;;;1
2,40527E+13;AUTO POSTO GIGANTE DA ENGENHEIRO LTDA;2;4731800;AVENIDA;ENGENHEIRO CAETANO ALVARES;2777;;IMIRIM;SP;SAO PAULO;11 29502066;;11 29502066;ARFECONTABIL@TERRA.COM.BR;5
2,4108E+13;SAO FRANCISCO CENTER SERVICE LTDA;2;4732600;RUA;BARTOLOMEO BON;7;LOTE 12 QUADRA4;JARDIM DRACENA;SP;SAO PAULO;11 99999999;;;SAOFRANCISCO706@GMAIL.COM;1
2,41295E+13;AUTO POSTO MIRANTE DO TIETE LTDA;2;4731800;RUA;DOUTOR EDGARD THEOTONIO SANTANA;492;;PARQUE INDUSTRIAL TOMAS EDSON;SP;SAO PAULO;11 21433811;11 21434433;11 21433811;SILVERIO@SILVERIO.COM.BR;5
2,42611E+13;AUTO POSTO SAKURA LTDA;2;4731800;RUA;ALTO BELO;850;;VILA ANTONIETA;SP;SAO PAULO;11 20591130;;11 20591130;SAKURA.ESCRITORIO@HOTMAIL.COM;5
2,42758E+13;CASSIO RODRIGO DA COSTA PINTO 33189166846;2;4732600;RUA;MOSSORO;201;;VILA NOVA;SP;SAO PAULO;11 27176361;;;kk7rodrigo@gmail.com;1
2,42988E+13;HENRIQUE FERREIRA DA SILVA;2;4732600;AVENIDA;DOUTOR JOSE ARTUR NOVA;1535;;PARQUE PAULISTANO;SP;SAO PAULO;11 26215473;;;FISCALTREVO@GMAIL.COM;1
2,43143E+13;OIL EXPRESS - TROCA DE OLEO DELIVERY LTDA;2;4732600;RUA;FRANCISCO RODRIGUES ALVES;221;;VILA IORIO;SP;SAO PAULO;11 98791821;;;;1
2,43617E+13;AUTO POSTO NOVA ALIANCA I LTDA;2;4731800;AVENIDA;ITAQUERA;8080;;VILA CARMOSINA;SP;SAO PAULO;15 33428451;;11 99997755;CONTATO@ESCRITORIOGOLD.COM.BR;5
2,43617E+13;AUTO POSTO BOXTER MARGINAL LTDA;2;4731800;RUA;JACIRENDI;739;;TATUAPE;SP;SAO PAULO;11 26729450;;11 99995522;CONTABIL@BOXTER.COM.BR;5
2,43838E+13;CENTRO AUTOMOTIVO NOVA PAULISTA LTDA;2;4731800;RUA;DO PARAISO;120;;PARAISO;SP;SAO PAULO;11 31732080;11 31732051;11 31732080;GUILHERME.GALACINE@DSPGRUPO.COM.BR;5
2,43897E+13;JUCIARA MOTA PEREIRA 35908768839;2;4732600;RUA;ALVARES FAGUNDES;823;;AMERICANOPOLIS;SP;SAO PAULO;11 56230857;;;rogeriopereira2016@hotmail.com;1
2,44043E+13;ANDRE RODRIGO GIANNATEMPO SILVA 28826122814;2;4732600;AVENIDA;LUIZ FERREIRA DA SILVA;219;;VILA SANTA CLARA;SP;SAO PAULO;11 95855299;;;;1
2,44205E+13;CARLOS DE JESUS ALONSO 09407490840;8;4732600;RUA;FREITAS DE AZEVEDO;33;;JARDIM FANGANIELLO;SP;SAO PAULO;11 28673085;;;alonsojesuscarlos@gmail.com;1
2,44385E+13;NOVA IMPERIO COMERCIO E SERVICOS DE LUBRIFICANTES LTDA;2;4732600;AVENIDA;ATLANTICA;5946;LOJA 2;PARQUE ATLANTICO;SP;SAO PAULO;11 43238782;11 56678782;11 56677857;FINANCEIRO@NOVAIMPERIODOOLEO.COM.BR;1
2,44391E+13;CORIN COMERCIO DE COMBUSTIVEIS AUTOMOTIVOS LTDA;2;4731800;RUA;CORIN;573;LETRA A;VILA RE;SP;SAO PAULO;11 22944992;11 26183779;11 26184505;GENESISCONTABIL@SUPERIG.COM.BR;5
2,44525E+13;WILLIAN JHULYAN CINTRA DE CARVALHO 43493179880;2;4732600;AVENIDA;SENADOR TEOTONIO VILELA;6161;"LOTE 09;QUADRA 02";VILA SAO JOSE (CIDADE DUTRA);SP;SAO PAULO;11 55212144;;;wmamultimarcas@gmail.com;1
2,44741E+13;AUTO POSTO MARIA CANDIDA LTDA;2;4731800;RUA;MARIA CANDIDA;1.619;;VILA GUILHERME;SP;SAO PAULO;11 21456200;;;TIAGO.GOMES@SONDA.COM.BR;5
2,45231E+13;AUTO POSTO E SERVICOS 19 DE JANEIRO LTDA;2;4731800;AVENIDA;DEZENOVE DE JANEIRO;629;;VILA CARRAO;SP;SAO PAULO;11 29720069;;;ARTE@SUPERIG.COM.BR;5
2,4556E+13;CANAA COMERCIO E SERVICOS DE LUBRIFICANTES LTDA;2;4732600;AVENIDA;JOAO DIAS;1381;LOJA 2;SANTO AMARO;SP;SAO PAULO;11 43238782;11 56418886;11 56418886;FINANCEIRO@NOVAIMPERIODOOLEO.COM.BR;1
2,46206E+13;PAULO ROCHA LEMOS 06472953856;8;4732600;RUA;ZACARIAS ALVES DE MELO;108;BLOCO A2 NR 21;JARDIM IBITIRAMA;SP;SAO PAULO;11 29144275;;;paulorlemos@bol.com.br;1
2,46334E+13;AUTO POSTO FONTALES LTDA;2;4731800;RUA;DO USHIKICHI KAMIYA;598;TERREO;PARQUE CASA DE PEDRA;SP;SAO PAULO;11 22137215;11 22166892;11 22164361;LOURENCOCONTABILIDADE@HOTMAIL.COM;5
2,46702E+13;LEAO & ISHIBASHI LUBRIFICANTES LTDA;2;4732600;AVENIDA;DOUTOR GASTAO VIDIGAL 1946;1.946;ANEXO PORTAO 13 E 14 LOTE RUA 22;VILA LEOPOLDINA;SP;SAO PAULO;11 38515619;11 38510962;;CAYRO@TERRA.COM.BR;3
2,47011E+13;AUTO POSTO PITTY COMBUSTIVEIS LTDA;4;4732600;AVENIDA;RIO DAS PEDRAS;2550;;JARDIM ARICANDUVA;SP;SAO PAULO;11 25231815;;11 25231815;LEGALIZACAO@QUALICONTAX.COM.BR;3
2,47512E+13;Q-OLEO DO BRASIL COMERCIO DE LUBRIFICANTES LTDA;2;4732600;RUA;HELENA;280;SALA 611;VILA OLIMPIA;SP;SAO PAULO;11 38730954;;11 38730954;ROCONTABIL@ROCONTABIL.COM.BR;5
2,47783E+13;ALESSANDRA BUKE BARONI;2;4732600;AVENIDA;DAS CEREJEIRAS;664;;JARDIM JAPAO;SP;SAO PAULO;11 23684163;;;ALEBUKE@GAMIL.COM;1
2,47829E+13;FLAVIA DOS SANTOS FERDINANDO 26485892877;8;4732600;RUA;AUGUSTA SANTEL;39;;JARDIM CELESTE;SP;SAO PAULO;11 76941193;;;flavia@hotmail.com;1
2,4809E+13;BRENER FELIPE DE SOUZA MARQUI 36817475805;2;4732600;RUA;EMILIA MORGADO MUNHOZ GARCIA;185;;VILA DAS BELEZAS;SP;SAO PAULO;11 58143202;;;brenerfelipe@hotmail.com;1
2,4821E+13;ADRIANO DE CARVALHO GUILLEN 24647458806;8;4732600;RUA;FREI DURAO;14;;VILA SAO JOSE (IPIRANGA);SP;SAO PAULO;11 20614058;;;adriano@guillen.com.br;1
2,48399E+13;CARLOS ALBERTO GERAISSATI 27600416891;2;4732600;RUA;JOAQUIM NEVES MONTEIRO;152;BLOCO 14 C;JARDIM SANTA CRUZ (CAMPO GRANDE);SP;SAO PAULO;11 80798066;;;geraissaticarlos@gmail.com;1
2,48662E+13;CASTELO DO OLEO LUCENA EIRELI;2;4732600;RUA;JEQUIRITUBA;1559;;PARQUE AMERICA;SP;SAO PAULO;11 26454612;;;LOJA2@CASTELODOOLEO.COM.BR;1
2,49475E+13;CENTRO AUTOMOTIVO E COMERCIO DE COMBUSTIVEIS MAXXIMA I LTDA;2;4731800;RUA;FRANCISCO REBELO;891;;VILA CALIFORNIA;SP;SAO PAULO;11 21433811;11 21434433;;SILVERIO@SILVERIO.COM.BR;5
2,49707E+13;COMERCIO VAREJISTA DE COMBUSTIVEIS ALMEIDA TORRES LTDA;2;4731800;RUA;ALMEIDA TORRES;413;;ACLIMACAO;SP;SAO PAULO;11 59046664;11 78565665;;SAC@CONTAR.CNT.BR;5
2,50132E+13;AUTO POSTO PORTAL TREMEMBE EIRELI;2;4731800;AVENIDA;CORONEL SEZEFREDO FAGUNDES;1816;;TUCURUVI;SP;SAO PAULO;11 20612300;11 20617849;;POSTOTREMEMBE@GMAIL.COM;3
2,50185E+13;AGROPREMIUM COMERCIO DE PRODUTOS AGROPECUARIOS EIRELI;2;4732600;AVENIDA;ENGENHEIRO CAETANO ALVARES;530;CONJ 3 - SALA 13;LIMAO;SP;SAO PAULO;11 50724509;;;CONTATO@ACSS.COM.BR;3
2,51315E+13;AUTO POSTO ARPA LTDA;4;4731800;AVENIDA;CORIFEU DE AZEVEDO MARQUES;4950;;VILA LAGEADO;SP;SAO PAULO;41 30224561;;;SIDEBAILLO@HOTMAIL.COM;5
2,51663E+13;FULL POWER AUTO POSTO LTDA;2;4731800;RUA;ITINGUCU;2751;TERREO;VILA RE;SP;SAO PAULO;11 22137215;;;LOURENCOCONTABILIDADE@HOTMAIL.COM;5
2,52165E+13;JM FILTROS E LUBRIFICANTES LTDA;8;4732600;AVENIDA;MARECHAL TITO;5955;;ITAIM PAULISTA;SP;SAO PAULO;15 32722120;;;FRANQUIA@GAETAREIDOOLEO.COM.BR;1
2,52368E+13;ARAM COMERCIO DE LUBRIFICANTES LTDA;2;4732600;RUA;MAGARINOS TORRES;132;SALA 2;VILA MARIA BAIXA;SP;SAO PAULO;11 22015575;;;ALESSANDRA@INDUSTROL.COM.BR;1
2,52965E+13;ANDRE KRANJ KLOBUCAR 42220143899;2;4732600;AVENIDA;VITOR MANZINI;450A;;SANTO AMARO;SP;SAO PAULO;11 96442260;;;;1
2,52983E+13;CENTRO AUTOMOTIVO GABRIEL SARAIVA LTDA;2;4731800;AVENIDA;SADAMU INOUE;6170;;JARDIM CASA GRANDE;SP;SAO PAULO;11 20239999;;;SAC@CONSULTORIAHERA.COM.BR;5
2,53159E+13;RENATO DOMINGOS DE JESUS 30907082807;2;4732600;RUA;JULIO CESAR MOREIRA;456;;JARDIM RODOLFO PIRANI;SP;SAO PAULO;11 27541415;;;;1
2,53177E+13;A COSTA ACESSORIOS;8;4732600;RUA;FLORENCIO DE ABREU;70;TERREO BOX 1;CENTRO;SP;SAO PAULO;11 47488902;;;JOZELYCR@OUTLOOK.COM;3
2,53341E+13;AUTO POSTO SUPER CUPECE LTDA;2;4731800;AVENIDA;CUPECE;2202;;JARDIM PRUDENCIA;SP;SAO PAULO;11 20612300;11 20617849;11 39667500;POSTOCUPECE@GMAIL.COM;5
2,53513E+13;BARBARA ALVES DOS ANJOS TOQUEIRO 32640622838;2;4732600;RUA;EUCLIDES PACHECO;1700;;VILA GOMES CARDIM;SP;SAO PAULO;11 41089182;;;lopes7618@outlook.com;1
2,53565E+13;NSA I POSTO DE ABASTECIMENTO E SERVICOS AUTOMOTIVOS LTDA;2;4731800;AVENIDA;EDUCADOR PAULO FREIRE;293;;PARQUE NOVO MUNDO;SP;SAO PAULO;11 25231815;;11 25231815;LEGALIZACAO@QUALICONTAX.COM.BR;5
2,53677E+13;LUIZ ROBERTO DE SOUZA 03507577801;2;4732600;RUA;FREDERICO RENE DE JAEGHER;754;;RIO BONITO;SP;SAO PAULO;11 56666575;;;;1
2,5371E+13;CENTRO AUTOMOTIVO AUTODROMO LTDA;8;4731800;AVENIDA;INTERLAGOS;6208;;INTERLAGOS;SP;SAO PAULO;11 55947404;;;AUTODROMO@UOL.COM.BR;5
2,53919E+13;ALESSANDRO COSTA SILVA 34442593876;2;4732600;RUA;EUCLIDES PACHECO;1490;;VILA GOMES CARDIM;SP;SAO PAULO;11 41089182;;;lopes7618@outlook.com;1
2,54881E+13;AUTO POSTO S3 BANDEIRANTES LTDA;2;4731800;AVENIDA;DOS BANDEIRANTES;3414;;PLANALTO PAULISTA;SP;SAO PAULO;11 27766001;11 27837430;11 27828213;MURILLO.ORIAN@UOL.COM.BR;5
2,55344E+13;ANDERSON DA SILVA RIBEIRO 25557733809;2;4732600;TRAVESSA;ANTONIO BERNARDO DA COSTA;26;;JARDIM IMPERADOR (ZONA LESTE);SP;SAO PAULO;11 98531334;;;anderson.ribeiro14@yahoo.com;1
2,60106E+13;SOLANGE BATISTA DA SILVA MEIRA 30380082810;2;4732600;RUA;TOMAS TEIXEIRA;91;;VILA CONSTANCA;SP;SAO PAULO;11 41145861;;;SBLUBRIFICANTES@OUTLOOK.COM.BR;1
2,60869E+13;RAQUEL SIQUEIRA SANTOS 03119180424;2;4732600;RUA;CAMPO NOVO DO SUL;206;;VILA ANDRADE;SP;SAO PAULO;11 86662723;;;kekel10santos@hotmail.com;1
2,61215E+13;DANIEL NUNES DE OLIVEIRA 37462700816;8;4732600;RUA;ESTEVAO RIBEIRO GARCIA;128;CASA 01;JARDIM VIRGINIA;SP;SAO PAULO;11 25617130;;;danyel2023@hotmail.com;1
2,61331E+13;P.C MEDEIROS LUBRIFICANTES AUTOMOTIVOS EIRELI;2;4732600;RUA;PALACIO DO CATETE;7A;;JARDIM RINCAO;SP;SAO PAULO;11 44196662;;;PATRICIA@CASADOOLEOMAIRIPORA.COM.BR;1
2,61684E+13;RICARDO CUSTODIO DE ALCANTARA;8;4732600;RUA;EDUARDO RAMOS;36;;PARQUE AMERICA;SP;SAO PAULO;11 97350444;;;ALCANTARACOMSUC@HOTMAIL.COM;1
2,61928E+13;BR OIL EXPRESS COMERCIO E SERVICOS LUBRIFICANTES LTDA;8;4732600;AVENIDA;ANTONELO DA MESSINA;1726;;SITIO DO PIQUERI;SP;SAO PAULO;11 29726299;;;DEPTOLEGAL@DESPACON.COM.BR;3
2,62016E+13;RRJF AUTO POSTO LTDA;2;4731800;RUA;SAO DOMINGOS;136;;BELA VISTA;SP;SAO PAULO;11 59046664;11 83630419;;SAC@CONTAR.CNT.BR;5
2,62276E+13;AUTO POSTO VILA ITABERABA LTDA;2;4731800;ESTRADA;LAZARO AMANCIO DE BARROS;492;;VILA ITABERABA;SP;SAO PAULO;11 29720069;;;ARTE@SUPERIG.COM.BR;5
2,62573E+13;FELIPE MONTENEGRO DE SOUZA BORGES 35336513806;2;4732600;AVENIDA;ATLANTICA;1351;FUNDOS;SOCORRO;SP;SAO PAULO;11 54824823;;;felipe.assistsp@gmail.com;1
2,62864E+13;MARGARIDA PEREIRA MARQUINI 14005961819;8;4732600;TRAVESSA;FRANCISCO FRASQUILO;18;CASA 01;FAZENDA DA JUTA;SP;SAO PAULO;11 20154915;;;;1
2,62866E+13;G.L. CAR LUBRIFICANTES LTDA;2;4732600;RUA;CORONEL FRANCISCO INACIO;663;;VILA MOINHO VELHO;SP;SAO PAULO;11 22720519;;;RENATA.FONSECA@HOTMAIL.COM;1
2,62901E+13;ECO-KLABIN COMERCIO VAREJISTA DE COMBUSTIVEIS LTDA;2;4731800;RUA;COLONIA DA GLORIA;289;;VILA MARIANA;SP;SAO PAULO;11 59046664;11 78563021;;SAC@CONTAR.CNT.BR;5
2,63753E+13;STAR RACE LUBRIFICANTES EIRELI;2;4732600;RUA;ITAMARACA;397;;AGUA RASA;SP;SAO PAULO;11 22735054;;;FISCAL@JMSCONTABILIDADE.COM.BR;1
2,63928E+13;REI DO OLEO PAUFERRO LTDA;2;4732600;RUA;VOLUNTARIOS DA PATRIA;3281;LETRA A;SANTANA;SP;SAO PAULO;11 39745025;11 39746805;11 39745025;CONTATO@JASCONTABILIDADE.CNT.BR;1
2,64233E+13;CRISTIANE PEREIRA DA SILVA 30192095870;8;4732600;RUA;COSTA BARROS;2200;"BLOCO 8C;APT 03";SITIO PINHEIRINHO;SP;SAO PAULO;11 23681147;;;jucrislucas@gmail.com;1
2,6442E+13;ROGERIO SANTOS BARRETO 41136980822;8;4732600;AVENIDA;NOVA CONQUISTA;2094;;JARDIM DA CONQUISTA (ZONA LESTE);SP;SAO PAULO;11 27532358;;;rogeriosantosbarreto@hotmail.com;1
2,64808E+13;H. B. AUTO POSTO E SERVICOS LTDA;2;4731800;AVENIDA;JABAQUARA;603;;MIRANDOPOLIS;SP;SAO PAULO;11 38468699;;;HENRIQUE@VALENTINACARAN.COM.BR;3
2,64808E+13;AUTO POSTO MAX PREMIUM LTDA;2;4731800;AVENIDA;JACU-PESSEGO (NOVA TRABALHADORES);4700;;JOSE BONIFACIO;SP;SAO PAULO;11 26729450;;11 99999999;CONTABIL@BOXTER.COM.BR;5
2,65294E+13;POSTO DE SERVICOS ELDORADO DO IGUATEMI LTDA;2;4731800;AVENIDA;RAGUEB CHOHFI;4939;;JARDIM IGUATEMI;SP;SAO PAULO;11 27240268;;;DCONTABIL.GLJ@GMAIL.COM;5
